,Unnamed: 0.1,Unnamed: 0,title,date,stock,Text_Cleaned,Score,label,score
988132,988132,1000270.0,"Shares of several healthcare companies are trading lower in sympathy with the overall market following an increase in coronavirus cases in some US states that have reopened, leading to concerns of a second wave of the virus.",2020-06-11 10:22:00-04:00,PFE,shares of several healthcare companies are trading lower in sympathy with the overall market following an increase in coronavirus cases in some us states that have reopened leading to concerns of a second wave of the virus,"{'neg': 0.052, 'neu': 0.782, 'pos': 0.166, 'compound': 0.5859}",negative,0.9986187219619751
988133,988133,1000271.0,Pfizer Reports FDA Approval Of Co.'s NYVEPRIA,2020-06-11 08:04:00-04:00,PFE,pfizer reports fda approval of co s nyvepria,"{'neg': 0.0, 'neu': 0.693, 'pos': 0.307, 'compound': 0.4767}",positive,0.9959858059883118
988134,988134,1000272.0,Johnson & Johnson To Start Coronavirus Vaccine Human Trials Ahead Of Schedule In July,2020-06-11 00:16:00-04:00,PFE,johnson and johnson to start coronavirus vaccine human trials ahead of schedule in july,"{'neg': 0.0, 'neu': 1.0, 'pos': 0.0, 'compound': 0.0}",neutral,0.9998063445091248
988135,988135,1000273.0,"The Daily Biotech Pulse: Keytruda Setback For Merck, Denali Pulls The Plug On Neurological Asset",2020-06-10 07:30:00-04:00,PFE,the daily biotech pulse keytruda setback for merck denali pulls the plug on neurological asset,"{'neg': 0.0, 'neu': 0.848, 'pos': 0.152, 'compound': 0.3612}",negative,0.9967449903488159
988136,988136,1000274.0,"Pfizer Announces Top-Line Results From JADE TEEN Trial Of Abrocitinib In Adolescents With Moderate-To-Severe Atopic Dermatitis; Observed Improvements In Skin Clearance, Disease Extent, And Severity Among Patients 12 To <18",2020-06-10 06:46:00-04:00,PFE,pfizer announces top line results from jade teen trial of abrocitinib in adolescents with moderate to severe atopic dermatitis observed improvements in skin clearance disease extent and severity among patients 12 to less than 18,"{'neg': 0.067, 'neu': 0.827, 'pos': 0.106, 'compound': 0.128}",positive,0.9996445178985596
988137,988137,1000275.0,Valneva Announces HSR Clearance For Lyme Vaccine Collaboration With Pfizer,2020-06-08 12:04:00-04:00,PFE,valneva announces hsr clearance for lyme vaccine collaboration with pfizer,"{'neg': 0.0, 'neu': 1.0, 'pos': 0.0, 'compound': 0.0}",positive,0.9989533424377441
988138,988138,1000276.0,AstraZeneca Approached Gilead With A Deal That Could Be The Biggest On Record: Report,2020-06-08 03:56:00-04:00,PFE,astrazeneca approached gilead with a deal that could be the biggest on record report,"{'neg': 0.0, 'neu': 1.0, 'pos': 0.0, 'compound': 0.0}",positive,0.9969960451126099
988139,988139,1000277.0,Ex-FDA Chief On White House's Coronavirus Vaccine Shortlist: 'They Chose Very Novel Platforms',2020-06-04 11:02:00-04:00,PFE,ex fda chief on white houses coronavirus vaccine shortlist they chose very novel platforms,"{'neg': 0.0, 'neu': 0.834, 'pos': 0.166, 'compound': 0.3804}",neutral,0.9998428821563721
988140,988140,1000278.0,Revisiting The Coronavirus Vaccine Race: Updates On The 10 Candidates In Clinics,2020-06-03 17:53:00-04:00,PFE,revisiting the coronavirus vaccine race updates on the 10 candidates in clinics,"{'neg': 0.0, 'neu': 1.0, 'pos': 0.0, 'compound': 0.0}",neutral,0.999884843826294
988141,988141,1000279.0,"UPDATE: Five Companies Chosen For 'Vaccine Finalist' Are Moderna, Johnson & Johnson, Merck, Pfizer And AstraZeneca",2020-06-03 13:09:00-04:00,PFE,update five companies chosen for vaccine finalist are moderna johnson and johnson merck pfizer and astrazeneca,"{'neg': 0.0, 'neu': 1.0, 'pos': 0.0, 'compound': 0.0}",neutral,0.9998862743377686
988142,988142,1000280.0,"Fauci Reiterates Moderna Vaccine Data Is 'Cautiously Optimistic,' Expects Pfizer's Results To Be The Same",2020-06-02 08:56:00-04:00,PFE,fauci reiterates moderna vaccine data is cautiously optimistic expects pfizers results to be the same,"{'neg': 0.0, 'neu': 0.859, 'pos': 0.141, 'compound': 0.3182}",positive,0.9994264841079712
988143,988143,1000281.0,"The Daily Biotech Pulse: FDA Nod For Roche's Combo Therapy In Liver Cancer, Allena Rips Higher, Pfizer To Invest Up To $500M In Biotechs",2020-06-02 07:45:00-04:00,PFE,the daily biotech pulse fda nod for roches combo therapy in liver cancer allena rips higher pfizer to invest up to dollars 00 million in biotechs,"{'neg': 0.15, 'neu': 0.85, 'pos': 0.0, 'compound': -0.6597}",positive,0.9992891550064087
988144,988144,1000282.0,71 Biggest Movers From Yesterday,2020-06-02 04:39:00-04:00,PFE,71 biggest movers from yesterday,"{'neg': 0.0, 'neu': 1.0, 'pos': 0.0, 'compound': 0.0}",neutral,0.9998496770858765
988145,988145,1000283.0,"Pfizer Analyst Takes Stock Of Negative Breast Cancer Data, Pharma Giant's 2025 Goals",2020-06-01 14:25:00-04:00,PFE,pfizer analyst takes stock of negative breast cancer data pharma giants 2025 goals,"{'neg': 0.424, 'neu': 0.576, 'pos': 0.0, 'compound': -0.8442}",negative,0.8833996057510376
988146,988146,1000284.0,48 Stocks Moving In Monday's Mid-Day Session,2020-06-01 12:34:00-04:00,PFE,48 stocks moving in mondays mid day session,"{'neg': 0.0, 'neu': 1.0, 'pos': 0.0, 'compound': 0.0}",neutral,0.9998738765716553
988147,988147,1000285.0,"JP Morgan Maintains Neutral on Pfizer, Lowers Price Target to $36",2020-06-01 11:31:00-04:00,PFE,jp morgan maintains neutral on pfizer lowers price target to dollars 6,"{'neg': 0.113, 'neu': 0.752, 'pos': 0.135, 'compound': 0.0772}",positive,0.9987892508506775
988148,988148,1000286.0,Pfizer shares are trading lower after the company's data monitoring committee said its breast cancer treatment trial is unlikely to show statistically significant improvement.,2020-06-01 08:40:00-04:00,PFE,pfizer shares are trading lower after the companys data monitoring committee said its breast cancer treatment trial is unlikely to show statistically significant improvement,"{'neg': 0.202, 'neu': 0.583, 'pos': 0.215, 'compound': -0.1531}",negative,0.9986671209335327
988149,988149,1000287.0,26 Stocks Moving in Monday's Pre-Market Session,2020-06-01 07:02:00-04:00,PFE,26 stocks moving in mondays pre market session,"{'neg': 0.0, 'neu': 1.0, 'pos': 0.0, 'compound': 0.0}",neutral,0.9998683929443359
988150,988150,1000288.0,A Peek Into The Markets: US Stock Futures Edge Lower Following Weekend of Violent Protests; Manufacturing Data In Focus,2020-06-01 06:02:00-04:00,PFE,a peek into the markets us stock futures edge lower following weekend of violent protests manufacturing data in focus,"{'neg': 0.333, 'neu': 0.667, 'pos': 0.0, 'compound': -0.7906}",negative,0.9980307221412659
988151,988151,1000289.0,"5 Stocks To Watch For June 1, 2020",2020-06-01 04:31:00-04:00,PFE,5 stocks to watch for june 1 2020,"{'neg': 0.0, 'neu': 1.0, 'pos': 0.0, 'compound': 0.0}",neutral,0.9998422861099243
988152,988152,1000290.0,Pfizer Falls On Disappointing Breast Cancer PALLAS Study,2020-05-29 16:55:00-04:00,PFE,pfizer falls on disappointing breast cancer pallas study,"{'neg': 0.559, 'neu': 0.441, 'pos': 0.0, 'compound': -0.8225}",negative,0.9983620047569275
988153,988153,1000291.0,"Pfizer Says Data Monitoring Committe Determined Phase 3 Trial Of IBRANCE Plus Endocrine Therapy in HR+, HER2- Early Breast Cancer Is Unlikely To Show Statistically Significant Improvement In Primary Endpoint",2020-05-29 16:16:00-04:00,PFE,pfizer says data monitoring committe determined phase 3 trial of ibrance plus endocrine therapy in hr her2 early breast cancer is unlikely to show statistically significant improvement in primary endpoint,"{'neg': 0.117, 'neu': 0.691, 'pos': 0.191, 'compound': 0.2023}",positive,0.9996028542518616
988154,988154,1000292.0,Pfizer Reports Final PROSPER Results Show XTANDI Significantly Extends Overall Survival In Men With Non-Metastatic Castration-Resistant Prostate Cancer,2020-05-29 08:18:00-04:00,PFE,pfizer reports final prosper results show xtandi significantly extends overall survival in men with non metastatic castration resistant prostate cancer,"{'neg': 0.184, 'neu': 0.753, 'pos': 0.063, 'compound': -0.5994}",positive,0.9997019171714783
988155,988155,1000293.0,"The Daily Biotech Pulse: ASCO Presentations Begin, Altimmune Pops On Insider Buying, Immutep Gets R&D Grant",2020-05-29 07:22:00-04:00,PFE,the daily biotech pulse asco presentations begin altimmune pops on insider buying immutep gets r and d grant,"{'neg': 0.0, 'neu': 0.872, 'pos': 0.128, 'compound': 0.3612}",neutral,0.9998040795326233
988156,988156,1000294.0,"Cramer Shares His Thoughts On Teva, Oxford Industries And More",2020-05-29 06:40:00-04:00,PFE,cramer shares his thoughts on teva oxford industries and more,"{'neg': 0.0, 'neu': 0.804, 'pos': 0.196, 'compound': 0.296}",neutral,0.9998862743377686
988157,988157,1000295.0,Corning And Pfizer Announce Supply Agreement For Corning Valor Glass Packaging,2020-05-28 08:31:00-04:00,PFE,corning and pfizer announce supply agreement for corning valor glass packaging,"{'neg': 0.0, 'neu': 0.758, 'pos': 0.242, 'compound': 0.4939}",positive,0.9992460012435913
988158,988158,1000296.0,ContraFect Corporation Announces Private Placement Of Common Stock And Warrants To Pfizer Inc.,2020-05-26 07:32:00-04:00,PFE,contrafect corporation announces private placement of common stock and warrants to pfizer inc,"{'neg': 0.0, 'neu': 1.0, 'pos': 0.0, 'compound': 0.0}",neutral,0.9998844861984253
988159,988159,1000297.0,Novavax Begins Phase 1 Clinical Trial Of Its Coronavirus Vaccine,2020-05-26 02:48:00-04:00,PFE,novavax begins phase 1 clinical trial of its coronavirus vaccine,"{'neg': 0.0, 'neu': 1.0, 'pos': 0.0, 'compound': 0.0}",neutral,0.9998865127563477
988160,988160,1000298.0,The Week Ahead In Biotech: ASCO Presentations In The Spotlight,2020-05-24 14:40:00-04:00,PFE,the week ahead in biotech asco presentations in the spotlight,"{'neg': 0.0, 'neu': 1.0, 'pos': 0.0, 'compound': 0.0}",neutral,0.9998801946640015
988161,988161,1000299.0,"In The Midst Of Pandemic, Traders Pin Their Hopes On These Healthcare ETFs",2020-05-19 09:38:00-04:00,PFE,in the midst of pandemic traders pin their hopes on these healthcare etfs,"{'neg': 0.0, 'neu': 0.811, 'pos': 0.189, 'compound': 0.4215}",neutral,0.9998432397842407
988162,988162,1000300.0,Moncef Slaoui To Divest Moderna Stake As He Joins White House Vaccine Accelerator,2020-05-19 09:00:00-04:00,PFE,moncef slaoui to divest moderna stake as he joins white house vaccine accelerator,"{'neg': 0.0, 'neu': 1.0, 'pos': 0.0, 'compound': 0.0}",neutral,0.9997367262840271
988163,988163,1000301.0,"The Daily Biotech Pulse: FDA Nod For Roche, Arbutus Releases Positive Readout For HBV Therapy, Moderna Announces $1.34B Common Stock Offering",2020-05-19 08:24:00-04:00,PFE,the daily biotech pulse fda nod for roche arbutus releases positive readout for hbv therapy moderna announces dollars .34 billion common stock offering,"{'neg': 0.0, 'neu': 0.859, 'pos': 0.141, 'compound': 0.5574}",positive,0.9986166954040527
988164,988164,1000302.0,"These 6 Coronavirus Vaccine Candidates Are The Likeliest To Succeed, Says Morgan Stanley",2020-05-18 12:07:00-04:00,PFE,these 6 coronavirus vaccine candidates are the likeliest to succeed says morgan stanley,"{'neg': 0.0, 'neu': 0.789, 'pos': 0.211, 'compound': 0.4939}",neutral,0.9576868414878845
988165,988165,1000303.0,"GSK, Pfizer Owned ViiV Healthcare Announces Long-acting Injectable Formulation of Cabotegravir Dosed Every Two Months Shows Higher Efficacy Than Daily Oral PrEP",2020-05-18 06:25:00-04:00,PFE,gsk pfizer owned viiv healthcare announces long acting injectable formulation of cabotegravir dosed every two months shows higher efficacy than daily oral prep,"{'neg': 0.0, 'neu': 1.0, 'pos': 0.0, 'compound': 0.0}",positive,0.9992139339447021
988166,988166,1000304.0,Pfizer Highlights Updated Phase 1b Data On PF-06939926 To Treat Duchenne Muscular Dystrophy,2020-05-15 08:03:00-04:00,PFE,pfizer highlights updated phase 1 billion data on pf 06939926 to treat duchenne muscular dystrophy,"{'neg': 0.0, 'neu': 0.838, 'pos': 0.162, 'compound': 0.4019}",neutral,0.9998667240142822
988167,988167,1000305.0,"The Daily Biotech Pulse: Co-Diagnostics Earnings, NantKwest Plans Pancreatic Cancer Study, ADC Therapeutics IPO",2020-05-15 07:49:00-04:00,PFE,the daily biotech pulse co diagnostics earnings nantkwest plans pancreatic cancer study adc therapeutics ipo,"{'neg': 0.239, 'neu': 0.761, 'pos': 0.0, 'compound': -0.6597}",neutral,0.9998635053634644
988168,988168,1000306.0,Pfizer Reports Top-Line Results From Phase 3 Lot Consistency Study Of 20-Valent Pneumococcal Conjugate Vaccine In Pneumococcal Vaccine-Naive Adults 18-49,2020-05-14 10:00:00-04:00,PFE,pfizer reports top line results from phase 3 lot consistency study of 20 valent pneumococcal conjugate vaccine in pneumococcal vaccine naive adults 18 to 49,"{'neg': 0.078, 'neu': 0.855, 'pos': 0.067, 'compound': -0.0772}",neutral,0.9998769760131836
988169,988169,1000307.0,"AbbVie's Potential Is 'Underappreciated,' Says Morgan Stanley Analyst",2020-05-13 12:03:00-04:00,PFE,abbvies potential is underappreciated says morgan stanley analyst,"{'neg': 0.0, 'neu': 1.0, 'pos': 0.0, 'compound': 0.0}",positive,0.9983924031257629
988170,988170,1000308.0,"Benzinga Pro's Top 5 Stocks To Watch For Wed., May 13, 2020: CSCO, PFE, NCLH, ALLK, SDC",2020-05-13 07:58:00-04:00,PFE,benzinga pros top 5 stocks to watch for wed may 13 2020 csco pfe nclh allk sdc,"{'neg': 0.0, 'neu': 0.899, 'pos': 0.101, 'compound': 0.2023}",neutral,0.9998351335525513
988171,988171,1000309.0,A Peek Into The Markets: US Stock Futures Up Ahead Of Fed's Powell Speech,2020-05-13 05:45:00-04:00,PFE,a peek into the markets us stock futures up ahead of feds powell speech,"{'neg': 0.0, 'neu': 1.0, 'pos': 0.0, 'compound': 0.0}",neutral,0.999862790107727
988172,988172,1000310.0,Moderna CEO Says Company's Vaccine Alone Can't Meet Global Supply,2020-05-13 05:03:00-04:00,PFE,moderna ceo says companys vaccine alone cant meet global supply,"{'neg': 0.182, 'neu': 0.818, 'pos': 0.0, 'compound': -0.25}",neutral,0.9941275119781494
988173,988173,1000311.0,Pfizer Plans To Test Coronavirus Vaccine On Thousands Of Patients By September,2020-05-13 02:18:00-04:00,PFE,pfizer plans to test coronavirus vaccine on thousands of patients by september,"{'neg': 0.0, 'neu': 1.0, 'pos': 0.0, 'compound': 0.0}",neutral,0.9998770952224731
988174,988174,1000312.0,"Pfizer Highlights New Data From Trials Of 18 Approved, Investigational Medicines Will Be Presented At ASCO 20 Virtual Program May 29-31",2020-05-12 12:04:00-04:00,PFE,pfizer highlights new data from trials of 18 approved investigational medicines will be presented at asco 20 virtual program may 29 to 31,"{'neg': 0.0, 'neu': 0.887, 'pos': 0.113, 'compound': 0.4215}",neutral,0.9998787641525269
988175,988175,1000313.0,Cruise Line Earnings Later This Week Could Provide Insight On Brutal Quarter For Industry,2020-05-11 11:27:00-04:00,PFE,cruise line earnings later this week could provide insight on brutal quarter for industry,"{'neg': 0.24, 'neu': 0.76, 'pos': 0.0, 'compound': -0.6249}",positive,0.9809561371803284
988176,988176,1000314.0,Senator Schumer Called on Veterans Affairs Administration to Come Clean on Whether It's Using Veterans to Test Hydroxychloroquine,2020-05-10 17:11:00-04:00,PFE,senator schumer called on veterans affairs administration to come clean on whether its using veterans to test hydroxychloroquine,"{'neg': 0.0, 'neu': 0.863, 'pos': 0.137, 'compound': 0.4019}",neutral,0.999765932559967
988177,988177,1000315.0,"The Week Ahead In Biotech: Virtual Conference Presentations, Clovis PDUFA Date In The Spotlight",2020-05-10 15:40:00-04:00,PFE,the week ahead in biotech virtual conference presentations clovis pdufa date in the spotlight,"{'neg': 0.0, 'neu': 1.0, 'pos': 0.0, 'compound': 0.0}",neutral,0.9998880624771118
988178,988178,1000316.0,"The Daily Biotech Pulse: FDA Approves Novartis Lung Cancer Drug, 2-Way Contest Emerging For Tetraphase Pharma, Dexcom To Join S&P 500",2020-05-07 07:41:00-04:00,PFE,the daily biotech pulse fda approves novartis lung cancer drug 2 way contest emerging for tetraphase pharma dexcom to join SP500 500,"{'neg': 0.155, 'neu': 0.671, 'pos': 0.173, 'compound': -0.128}",neutral,0.9881570935249329
988179,988179,1000317.0,"Pfizer Begins Human Testing Of Coronavirus Vaccine In US, Michigan Among Manufacturing Centers",2020-05-05 14:58:00-04:00,PFE,pfizer begins human testing of coronavirus vaccine in us michigan among manufacturing centers,"{'neg': 0.0, 'neu': 1.0, 'pos': 0.0, 'compound': 0.0}",neutral,0.9998894929885864
988180,988180,1000318.0,'Pfizer begins coronavirus vaccine testing in US; Mich. lab could mass produce it' -Detroit Free Press,2020-05-05 13:16:00-04:00,PFE,pfizer begins coronavirus vaccine testing in us mich lab could mass produce it detroit free press,"{'neg': 0.0, 'neu': 0.82, 'pos': 0.18, 'compound': 0.5106}",neutral,0.9998853206634521
988181,988181,1000319.0,"U.S. Immigration And Customs Working With 3M, Amazon, Pfizer & Others To Curtail Imports Of Counterfeit Masks, Coronavirus Tests, Other Gear",2020-05-05 12:34:00-04:00,PFE,u s immigration and customs working with 3 million amazon pfizer and others to curtail imports of counterfeit masks coronavirus tests other gear,"{'neg': 0.0, 'neu': 0.928, 'pos': 0.072, 'compound': 0.1779}",neutral,0.9405035376548767
988182,988182,1000320.0,What You Should Know About Alexion's $1.4B Proposed Buyout Of Portola Pharma,2020-05-05 09:10:00-04:00,PFE,what you should know about alexions dollars .4 billion proposed buyout of portola pharma,"{'neg': 0.0, 'neu': 1.0, 'pos': 0.0, 'compound': 0.0}",neutral,0.9998747110366821
988183,988183,1000321.0,Pfizer and BioNTech shares are trading higher after the companies announced they have dosed their first participants in the US as part of the coronavirus mRNA vaccine development program.,2020-05-05 07:12:00-04:00,PFE,pfizer and biontech shares are trading higher after the companies announced they have dosed their first participants in the us as part of the coronavirus mrna vaccine development program,"{'neg': 0.0, 'neu': 0.927, 'pos': 0.073, 'compound': 0.296}",positive,0.9996370077133179
988184,988184,1000322.0,Pfizer And BioNTech Dose First Participants In US As Part Of Global COVID-19 (Coronavirus) mRNA Vaccine Development Program,2020-05-05 06:45:00-04:00,PFE,pfizer and biontech dose first participants in us as part of global covid 19 coronavirus mrna vaccine development program,"{'neg': 0.0, 'neu': 1.0, 'pos': 0.0, 'compound': 0.0}",neutral,0.9998955726623535
988185,988185,1000324.0,Pfizer Highlights Results Of New Data For Group B Streptococcus Infection Published In Journal Of Infectious Diseases,2020-05-04 09:01:00-04:00,PFE,pfizer highlights results of new data for group b streptococcus infection published in journal of infectious diseases,"{'neg': 0.0, 'neu': 1.0, 'pos': 0.0, 'compound': 0.0}",neutral,0.9989621639251709
988186,988186,1000325.0,The Week Ahead In Biotech: Smid-Cap Earnings News Flow Picks Up Pace,2020-05-03 08:45:00-04:00,PFE,the week ahead in biotech smid cap earnings news flow picks up pace,"{'neg': 0.0, 'neu': 1.0, 'pos': 0.0, 'compound': 0.0}",positive,0.9996610879898071
988187,988187,1000326.0,From Earlier: Pfizer Aims For 10-20M Virus Vaccine Doses By End Of 2020,2020-04-30 13:07:00-04:00,PFE,from earlier pfizer aims for 10 to 20 million virus vaccine doses by end of 2020,"{'neg': 0.0, 'neu': 1.0, 'pos': 0.0, 'compound': 0.0}",neutral,0.9998723268508911
988188,988188,1000327.0,"Valneva and Pfizer Announce Collaboration to Co-Develop and Commercialize Lyme Disease Vaccine, VLA15",2020-04-30 05:43:00-04:00,PFE,valneva and pfizer announce collaboration to co develop and commercialize lyme disease vaccine vla15,"{'neg': 0.0, 'neu': 1.0, 'pos': 0.0, 'compound': 0.0}",neutral,0.9008324146270752
988189,988189,1000328.0,"Barclays Maintains Equal-Weight on Pfizer, Raises Price Target to $37",2020-04-29 11:59:00-04:00,PFE,barclays maintains equal weight on pfizer raises price target to dollars 7,"{'neg': 0.0, 'neu': 1.0, 'pos': 0.0, 'compound': 0.0}",positive,0.9993575215339661
988190,988190,1000329.0,"The Daily Biotech Pulse: Inovio's MERS Vaccine Data, Fast Track Designation For Erytech, FDA Approves Higher Dose Of Merck's Keytruda",2020-04-29 08:40:00-04:00,PFE,the daily biotech pulse inovios mers vaccine data fast track designation for erytech fda approves higher dose of mercks keytruda,"{'neg': 0.0, 'neu': 0.876, 'pos': 0.124, 'compound': 0.4019}",positive,0.9935001730918884
988191,988191,1000330.0,"Pfizer Says Coronavirus Vaccine Could Be Available By Fall, US Clinical Trials To Begin Next Week",2020-04-29 00:09:00-04:00,PFE,pfizer says coronavirus vaccine could be available by fall us clinical trials to begin next week,"{'neg': 0.0, 'neu': 1.0, 'pos': 0.0, 'compound': 0.0}",neutral,0.9998799562454224
988192,988192,1000331.0,A CURE For The Common Earnings Play,2020-04-28 14:48:00-04:00,PFE,a cure for the common earnings play,"{'neg': 0.0, 'neu': 0.714, 'pos': 0.286, 'compound': 0.34}",neutral,0.9950436353683472
988193,988193,1000332.0,Pfizer Says Coronavirus Vaccine Could Be Ready For Emergency Use By Fall If Passes Testing; Could Begin Testing As Soon As Next Week,2020-04-28 13:14:00-04:00,PFE,pfizer says coronavirus vaccine could be ready for emergency use by fall if passes testing could begin testing as soon as next week,"{'neg': 0.1, 'neu': 0.805, 'pos': 0.096, 'compound': -0.0258}",neutral,0.9993795156478882
988194,988194,1000333.0,From Pfizer Earnings Conference Call: Net Impact Of Coronavirus Pandemic On FY20 Sales Should Be 'Negligible',2020-04-28 10:34:00-04:00,PFE,from pfizer earnings conference call net impact of coronavirus pandemic on fy20 sales should be negligible,"{'neg': 0.0, 'neu': 1.0, 'pos': 0.0, 'compound': 0.0}",negative,0.9974513649940491
988195,988195,1000334.0,Morning Market Stats in 5 Minutes,2020-04-28 10:32:00-04:00,PFE,morning market stats in 5 minutes,"{'neg': 0.0, 'neu': 1.0, 'pos': 0.0, 'compound': 0.0}",neutral,0.9998799562454224
988196,988196,1000335.0,Pfizer CEO Says No Change In Commitment To Merger Of Upjohn Unit With Mylan,2020-04-28 10:21:00-04:00,PFE,pfizer ceo says no change in commitment to merger of upjohn unit with mylan,"{'neg': 0.131, 'neu': 0.714, 'pos': 0.155, 'compound': 0.1027}",neutral,0.9998069405555725
988197,988197,1000336.0,"Earnings Feast: Bring a Plate With Healthcare and Caterpillar in Morning, GOOGL And AMD Later",2020-04-28 10:06:00-04:00,PFE,earnings feast bring a plate with healthcare and caterpillar in morning googl and amd later,"{'neg': 0.0, 'neu': 1.0, 'pos': 0.0, 'compound': 0.0}",neutral,0.9998534917831421
988198,988198,1000337.0,"The Daily Biotech Pulse: Pfizer Earnings, Roche's Spinal Muscular Dystrophy Treatment, Moderna COVID-19 Vaccine Update",2020-04-28 07:36:00-04:00,PFE,the daily biotech pulse pfizer earnings roches spinal muscular dystrophy treatment moderna covid 19 vaccine update,"{'neg': 0.0, 'neu': 1.0, 'pos': 0.0, 'compound': 0.0}",neutral,0.9995588660240173
988199,988199,1000338.0,Pfizer shares are trading higher after the company reported better-than-expected Q1 EPS and sales results.,2020-04-28 07:20:00-04:00,PFE,pfizer shares are trading higher after the company reported better than expected first quarter eps and sales results,"{'neg': 0.0, 'neu': 0.758, 'pos': 0.242, 'compound': 0.6249}",positive,0.9997077584266663
988200,988200,1000339.0,"Pfizer Sees FY20 Adj. EPS $2.82-$2.92 vs $2.86 Est., Sales $48.5B-$50.5B vs $49.33B Est.",2020-04-28 06:46:00-04:00,PFE,pfizer sees fy20 adj eps dollars .82 dollars .92 vs dollars .86 est sales dollars 8.5 billion dollars 0.5 billion vs dollars 9.33 billion est,"{'neg': 0.0, 'neu': 1.0, 'pos': 0.0, 'compound': 0.0}",neutral,0.9998810291290283
988201,988201,1000340.0,"Pfizer Q1 Adj. EPS $0.800 Beats $0.730 Estimate, Sales $12.028B Beat $11.870B Estimate",2020-04-28 06:45:00-04:00,PFE,pfizer first quarter adj eps dollars .800 beats dollars .730 estimate sales dollars 2.028 billion beat dollars 1.870 billion estimate,"{'neg': 0.0, 'neu': 1.0, 'pos': 0.0, 'compound': 0.0}",neutral,0.999785840511322
988202,988202,1000341.0,"A Peek Into The Markets: US Stock Futures Up Ahead Of Earnings, Economic Reports",2020-04-28 05:48:00-04:00,PFE,a peek into the markets us stock futures up ahead of earnings economic reports,"{'neg': 0.0, 'neu': 1.0, 'pos': 0.0, 'compound': 0.0}",neutral,0.9997807145118713
988203,988203,1000342.0,"Earnings Scheduled For April 28, 2020",2020-04-28 04:55:00-04:00,PFE,earnings scheduled for april 28 2020,"{'neg': 0.0, 'neu': 1.0, 'pos': 0.0, 'compound': 0.0}",neutral,0.9998875856399536
988204,988204,1000343.0,"10 Stocks To Watch For April 28, 2020",2020-04-28 04:04:00-04:00,PFE,10 stocks to watch for april 28 2020,"{'neg': 0.0, 'neu': 1.0, 'pos': 0.0, 'compound': 0.0}",neutral,0.9998575448989868
988205,988205,1000344.0,"Apple And Amazon Earnings, Fed Meeting Among Highlights In Busy Week Ahead",2020-04-27 09:44:00-04:00,PFE,apple and amazon earnings fed meeting among highlights in busy week ahead,"{'neg': 0.0, 'neu': 0.866, 'pos': 0.134, 'compound': 0.1779}",neutral,0.9997021555900574
988206,988206,1000345.0,"The Week Ahead In Biotech (April 26-May 2): Cancer Conference, Earnings News Flow In The Spotlight",2020-04-26 16:37:00-04:00,PFE,the week ahead in biotech april 26 may 2 cancer conference earnings news flow in the spotlight,"{'neg': 0.216, 'neu': 0.784, 'pos': 0.0, 'compound': -0.6597}",neutral,0.9998701810836792
988207,988207,1000346.0,Inovio CEO Says 'It's Possible' For Coronavirus Vaccine To Be Ready In 12 To 18 Months,2020-04-23 22:19:00-04:00,PFE,inovio ceo says its possible for coronavirus vaccine to be ready in 12 to 18 months,"{'neg': 0.0, 'neu': 0.857, 'pos': 0.143, 'compound': 0.3612}",neutral,0.9998762607574463
