,Unnamed: 0.1,Unnamed: 0,title,date,stock,Text_Cleaned,Score,label,score
989386,989386,1001546.0,"Hearing Gilead, Pfizer CEOs Currently Meeting At Davos, Traders Speculating M&A Talks",2017-01-18 11:46:00-05:00,PFE,hearing gilead pfizer ceos currently meeting at davos traders speculating m and a talks,"{'neg': 0.0, 'neu': 1.0, 'pos': 0.0, 'compound': 0.0}",neutral,0.9998689889907837
989387,989387,1001547.0,Orphan Drugs Among 2015's Top 10 Best-Selling Medications,2017-01-18 10:40:00-05:00,PFE,orphan drugs among 2015 top 10 best selling medications,"{'neg': 0.0, 'neu': 0.538, 'pos': 0.462, 'compound': 0.7184}",neutral,0.9947273135185242
989388,989388,1001548.0,"Incyte PDUFA Date Pushed Back, JMP Discusses Impact",2017-01-17 08:13:00-05:00,PFE,incyte pdufa date pushed back jmp discusses impact,"{'neg': 0.0, 'neu': 1.0, 'pos': 0.0, 'compound': 0.0}",negative,0.9527604579925537
989389,989389,1001549.0,All The Markets Trump Moved During His Speech Today,2017-01-11 15:51:00-05:00,PFE,all the markets trump moved during his speech today,"{'neg': 0.0, 'neu': 1.0, 'pos': 0.0, 'compound': 0.0}",neutral,0.9998749494552612
989390,989390,1001550.0,Trump: Drug Industry Is 'Getting Away With Murder',2017-01-11 12:15:00-05:00,PFE,trump drug industry is getting away with murder,"{'neg': 0.402, 'neu': 0.598, 'pos': 0.0, 'compound': -0.6908}",negative,0.5269580483436584
989391,989391,1001551.0,"Watching Weakness In Amgen,Biogen, Gilead, Mylan, Pfizer And Other Biotechs After Pres. Elect Trump Negative Statement On Drug Pricing",2017-01-11 11:25:00-05:00,PFE,watching weakness in amgen biogen gilead mylan pfizer and other biotechs after pres elect trump negative statement on drug pricing,"{'neg': 0.265, 'neu': 0.735, 'pos': 0.0, 'compound': -0.7579}",negative,0.9986708164215088
989392,989392,1001552.0,The Fentanyl Abuse Epidemic,2017-01-10 07:02:00-05:00,PFE,the fentanyl abuse epidemic,"{'neg': 0.583, 'neu': 0.417, 'pos': 0.0, 'compound': -0.6369}",neutral,0.9995620846748352
989393,989393,1001553.0,The Year's Biggest Healthcare Conference Commences This Week; Here's What You Need To Know,2017-01-09 06:33:00-05:00,PFE,the years biggest healthcare conference commences this week heres what you need to know,"{'neg': 0.0, 'neu': 1.0, 'pos': 0.0, 'compound': 0.0}",neutral,0.9998772144317627
989394,989394,1001554.0,Spark Gets A Check From Pfizer And A Downgrade From Vetr,2017-01-05 16:39:00-05:00,PFE,spark gets a check from pfizer and a downgrade from vetr,"{'neg': 0.0, 'neu': 0.84, 'pos': 0.16, 'compound': 0.2263}",positive,0.9925610423088074
989395,989395,1001555.0,ICU Medical Announces Terms To Acquire Hospira Infusion Systems From Pfizer Have Changed; Purchase Price Maximum Lowered From $1B To $900M,2017-01-05 16:13:00-05:00,PFE,icu medical announces terms to acquire hospira infusion systems from pfizer have changed purchase price maximum lowered from dollars b to dollars 00 million,"{'neg': 0.061, 'neu': 0.939, 'pos': 0.0, 'compound': -0.128}",neutral,0.9728384613990784
989396,989396,1001556.0,"ICU Medical, Inc. Provides Update on Hospira Infusion Systems Transaction, Says U.S. and Other Required Antitrust Clearances for Transaction Received, Deal To Close Feb. 2017",2017-01-05 16:06:00-05:00,PFE,icu medical inc provides update on hospira infusion systems transaction says u s and other required antitrust clearances for transaction received deal to close feb 2017,"{'neg': 0.0, 'neu': 1.0, 'pos': 0.0, 'compound': 0.0}",neutral,0.99982088804245
989397,989397,1001557.0,"The Market In 5 Minutes: Jobless Claims Fall Again, Retailers Struggle",2017-01-05 09:13:00-05:00,PFE,the market in 5 minutes jobless claims fall again retailers struggle,"{'neg': 0.187, 'neu': 0.813, 'pos': 0.0, 'compound': -0.3182}",negative,0.9985150694847107
989398,989398,1001558.0,AbCellera Reports Multi-Target Research Collaboration with Pfizer,2017-01-05 09:02:00-05:00,PFE,abcellera reports multi target research collaboration with pfizer,"{'neg': 0.0, 'neu': 1.0, 'pos': 0.0, 'compound': 0.0}",neutral,0.999895453453064
989399,989399,1001559.0,Pfizer Reports Positive Top-Line Results from the Comparative REFLECTIONS B538-02 Study for PF-06410293,2017-01-05 08:31:00-05:00,PFE,pfizer reports positive top line results from the comparative reflections b538 to 02 study for pf 06410293,"{'neg': 0.0, 'neu': 0.735, 'pos': 0.265, 'compound': 0.6597}",positive,0.9996316432952881
989400,989400,1001560.0,Wall Street's M&A Chatter From January 4,2017-01-05 06:51:00-05:00,PFE,wall streets m and a chatter from january 4,"{'neg': 0.0, 'neu': 1.0, 'pos': 0.0, 'compound': 0.0}",neutral,0.9998862743377686
989401,989401,1001561.0,Spark Therapeutics Reports $15 Million Milestone Payment from Pfizer for Progress in Hemophilia B Gene Therapy Program,2017-01-04 07:32:00-05:00,PFE,spark therapeutics reports dollars 5 million milestone payment from pfizer for progress in hemophilia b gene therapy program,"{'neg': 0.0, 'neu': 0.773, 'pos': 0.227, 'compound': 0.5719}",positive,0.9986795783042908
989402,989402,1001562.0,Barron's Best Income Ideas For 2017,2017-01-02 17:26:00-05:00,PFE,barrons best income ideas for 2017,"{'neg': 0.0, 'neu': 0.543, 'pos': 0.457, 'compound': 0.6369}",neutral,0.999829888343811
989403,989403,1001563.0,"Standpoint Defends Opko Health, Thinks Bad News Will Reverse Within 3 Months",2016-12-30 12:45:00-05:00,PFE,standpoint defends opko health thinks bad news will reverse within 3 months,"{'neg': 0.241, 'neu': 0.759, 'pos': 0.0, 'compound': -0.5423}",positive,0.9988425970077515
989404,989404,1001564.0,Opko Health's Phase 3 Data Sends Stock Plunging,2016-12-30 10:12:00-05:00,PFE,opko healths phase 3 data sends stock plunging,"{'neg': 0.0, 'neu': 1.0, 'pos': 0.0, 'compound': 0.0}",negative,0.9984014630317688
989405,989405,1001565.0,"Pre-Market Prep Host Dennis Dick Tweets: Some huge sell imbalances this morning: $PG -151K, $VZ -242K, $XOM -183K, $WMT -127K, $CVX -117K, $GE -471K, $CAT -95K, $PFE -373K",2016-12-30 09:01:00-05:00,PFE,pre market prep host dennis dick tweets some huge sell imbalances this morning pg negative 151 thousand vz negative 242 thousand xom negative 183 thousand wmt negative 127 thousand cvx negative 117 thousand ge negative 471 thousand cat negative 95 thousand pfe negative 373 thousand,"{'neg': 0.469, 'neu': 0.499, 'pos': 0.033, 'compound': -0.9856}",negative,0.9970468878746033
989406,989406,1001566.0,"OPKO Announces Commencement Of Data Analysis In Phase 3 Study Of hGH-CTP, No Statistical Difference On Primary Endpoint Between hGH-CTP And Placebo",2016-12-30 08:26:00-05:00,PFE,opko announces commencement of data analysis in phase 3 study of hgh ctp no statistical difference on primary endpoint between hgh ctp and placebo,"{'neg': 0.087, 'neu': 0.913, 'pos': 0.0, 'compound': -0.296}",neutral,0.9998760223388672
989407,989407,1001567.0,Expensive Breakups In 2016 Surpass GDPs Of Dozens Of Developing Nations,2016-12-28 15:00:00-05:00,PFE,expensive breakups in 2016 surpass gdps of dozens of developing nations,"{'neg': 0.0, 'neu': 1.0, 'pos': 0.0, 'compound': 0.0}",neutral,0.9993960857391357
989408,989408,1001568.0,6 Worst Biotech Stocks Of 2016,2016-12-23 11:50:00-05:00,PFE,6 worst biotech stocks of 2016,"{'neg': 0.451, 'neu': 0.549, 'pos': 0.0, 'compound': -0.6249}",negative,0.9659282565116882
989409,989409,1001569.0,"Meet The New Dogs: 2017's Dogs Of The Dow Include Coca-Cola, Boeing",2016-12-22 09:55:00-05:00,PFE,meet the new dogs 2017 dogs of the dow include coca cola boeing,"{'neg': 0.0, 'neu': 1.0, 'pos': 0.0, 'compound': 0.0}",neutral,0.9998903274536133
989410,989410,1001570.0,Breaking Down The Crowded Novel Ovarian Cancer Treatment Space,2016-12-21 09:19:00-05:00,PFE,breaking down the crowded novel ovarian cancer treatment space,"{'neg': 0.321, 'neu': 0.511, 'pos': 0.168, 'compound': -0.4767}",neutral,0.9998468160629272
989411,989411,1001571.0,Phizer Supplemental NDA for IBRANCE Accepted by FDA,2016-12-21 08:01:00-05:00,PFE,phizer supplemental nda for ibrance accepted by fda,"{'neg': 0.0, 'neu': 0.769, 'pos': 0.231, 'compound': 0.2732}",neutral,0.9998751878738403
989412,989412,1001572.0,7 Companies That Could Be Acquired In 2017,2016-12-20 10:00:00-05:00,PFE,7 companies that could be acquired in 2017,"{'neg': 0.0, 'neu': 1.0, 'pos': 0.0, 'compound': 0.0}",neutral,0.9998966455459595
989413,989413,1001573.0,Jefferies' 2017 Global Pharma Outlook,2016-12-19 10:56:00-05:00,PFE,jefferies 2017 global pharma outlook,"{'neg': 0.0, 'neu': 1.0, 'pos': 0.0, 'compound': 0.0}",neutral,0.9998619556427002
989414,989414,1001574.0,Portola Pharmaceuticals Enters into $50 Million Loan Agreement with Bristol-Myers Squibb and Pfizer for Continued Development of AndexXa,2016-12-19 08:00:00-05:00,PFE,portola pharmaceuticals enters into dollars 0 million loan agreement with bristol myers squibb and pfizer for continued development of andexxa,"{'neg': 0.0, 'neu': 0.856, 'pos': 0.144, 'compound': 0.4939}",positive,0.997183620929718
989415,989415,1001575.0,Pfizer Receives Approval in the European Union for Nimenrix in Infants Over 6 Months,2016-12-19 07:11:00-05:00,PFE,pfizer receives approval in the european union for nimenrix in infants over 6 months,"{'neg': 0.0, 'neu': 0.807, 'pos': 0.193, 'compound': 0.4767}",neutral,0.6985791325569153
989416,989416,1001576.0,Pfizer Reports FDA Approves Removal Of Boxed Warning Regarding Serious Neuropsychiatric Events From CHANTIX Labeling,2016-12-16 14:10:00-05:00,PFE,pfizer reports fda approves removal of boxed warning regarding serious neuropsychiatric events from chantix labeling,"{'neg': 0.201, 'neu': 0.652, 'pos': 0.147, 'compound': 0.0}",positive,0.9898926615715027
989417,989417,1001577.0,EMA Recommends Approval Of Pfizer's Lifmior For Treatment of Rheumatoid Arthritis,2016-12-16 07:33:00-05:00,PFE,ema recommends approval of pfizers lifmior for treatment of rheumatoid arthritis,"{'neg': 0.0, 'neu': 0.643, 'pos': 0.357, 'compound': 0.6124}",neutral,0.9703642725944519
989418,989418,1001578.0,Watch These 5 Huge Put Purchases In Thursday Trade,2016-12-15 04:25:00-05:00,PFE,watch these 5 huge put purchases in thursday trade,"{'neg': 0.0, 'neu': 0.777, 'pos': 0.223, 'compound': 0.3182}",neutral,0.9990532994270325
989419,989419,1001579.0,"UPDATE: Catalyst Biosciences Says Wyeth Has Granted Co. Exclusive License to Co.'s Proprietary Rights Applying to Factor CB 813a, CB 813d to Research, Develop, Manufacture, Commercialize Products",2016-12-14 16:37:00-05:00,PFE,update catalyst biosciences says wyeth has granted co exclusive license to co s proprietary rights applying to factor cb 813 a cb 81 3 dimensional to research develop manufacture commercialize products,"{'neg': 0.0, 'neu': 0.892, 'pos': 0.108, 'compound': 0.3612}",positive,0.9993724226951599
989420,989420,1001580.0,8-K from Catalyst Biosciences Shows Co. Entered Deal with Pfizer's Wyeth Related to Collaboration on Development of Novel Human Factor VIIa Products,2016-12-14 16:36:00-05:00,PFE,8 k from catalyst biosciences shows co entered deal with pfizers wyeth related to collaboration on development of novel human factor viia products,"{'neg': 0.0, 'neu': 0.905, 'pos': 0.095, 'compound': 0.3182}",positive,0.9991569519042969
989421,989421,1001581.0,"Pfizer, Astellas Announce Top-Line Results from Phase 4 PLATO Trial of XTANDI, Did Not Meet Primary Endpoint In PFS",2016-12-14 16:17:00-05:00,PFE,pfizer astellas announce top line results from phase 4 plato trial of xtandi did not meet primary endpoint in pfs,"{'neg': 0.0, 'neu': 0.913, 'pos': 0.087, 'compound': 0.2023}",negative,0.6696704626083374
989422,989422,1001582.0,FDA Reports Approval of Pfizer's Eucrisa for Eczema,2016-12-14 13:08:00-05:00,PFE,fda reports approval of pfizers eucrisa for eczema,"{'neg': 0.0, 'neu': 0.693, 'pos': 0.307, 'compound': 0.4767}",positive,0.6949639916419983
989423,989423,1001583.0,Option Alert: PFE Feb $32 Put; 4000 @Bid @$0.86; Ref=$32.86,2016-12-14 11:59:00-05:00,PFE,option alert pfe feb dollars 2 put 4000 dollars .86 ref equals dollars 2.86,"{'neg': 0.0, 'neu': 0.855, 'pos': 0.145, 'compound': 0.296}",neutral,0.9998770952224731
989424,989424,1001584.0,Pfizer Reports Research & License Collaboration With Ab Initio To Discover GPCR Activating Antibodies,2016-12-13 13:05:00-05:00,PFE,pfizer reports research and license collaboration with ab initio to discover gpcr activating antibodies,"{'neg': 0.0, 'neu': 1.0, 'pos': 0.0, 'compound': 0.0}",neutral,0.9998575448989868
989425,989425,1001585.0,Technical Alert: Pfizer Pushes Higher For Second Day In A Row,2016-12-12 13:23:00-05:00,PFE,technical alert pfizer pushes higher for second day in a row,"{'neg': 0.0, 'neu': 0.82, 'pos': 0.18, 'compound': 0.296}",positive,0.9995500445365906
989426,989426,1001586.0,Pfizer Raises Qtr. Dividend from $0.30 to $0.32/Share,2016-12-12 11:54:00-05:00,PFE,pfizer raises qtr dividend from dollars .30 to dollars,"{'neg': 0.0, 'neu': 1.0, 'pos': 0.0, 'compound': 0.0}",positive,0.9989629983901978
989427,989427,1001587.0,"European Crohn's, Colitis Organisation Issues New Statement Support a Switch to Biosimilar from Reference Product in Inflammatory Bowel Disease",2016-12-09 10:18:00-05:00,PFE,european crohns colitis organisation issues new statement support a switch to biosimilar from reference product in inflammatory bowel disease,"{'neg': 0.0, 'neu': 0.87, 'pos': 0.13, 'compound': 0.4019}",neutral,0.8676596283912659
989428,989428,1001588.0,What If Trump Keeps Badmouthing Drug Pricing?,2016-12-07 13:38:00-05:00,PFE,what if trump keeps badmouthing drug pricing,"{'neg': 0.0, 'neu': 1.0, 'pos': 0.0, 'compound': 0.0}",neutral,0.9993898868560791
989429,989429,1001589.0,"Pfizer, J&J, Other Big Pharma Names Dip Lower Just After the Open",2016-12-07 09:34:00-05:00,PFE,pfizer j and j other big pharma names dip lower just after the open,"{'neg': 0.145, 'neu': 0.855, 'pos': 0.0, 'compound': -0.296}",negative,0.9973522424697876
989430,989430,1001590.0,"Citi Global Healthcare Conf. Takes Place Today; Presenters Include Pfizer, Aerie Pharmaceuticals, Bristol-Myers, Alexion, Illumina, & Envision Healthcare",2016-12-07 08:38:00-05:00,PFE,citi global healthcare conf takes place today presenters include pfizer aerie pharmaceuticals bristol myers alexion illumina and envision healthcare,"{'neg': 0.0, 'neu': 1.0, 'pos': 0.0, 'compound': 0.0}",neutral,0.9998879432678223
989431,989431,1001591.0,Pfizer Fined $106 Million For Anti-Epilepsy Drug,2016-12-07 07:56:00-05:00,PFE,pfizer fined dollars 06 million for anti epilepsy drug,"{'neg': 0.223, 'neu': 0.777, 'pos': 0.0, 'compound': -0.3182}",negative,0.9299420118331909
989432,989432,1001592.0,CMA Fines Pfizer 84.2M for Drug Price Hike to NHS for Anti-epilepsy Drug,2016-12-07 04:54:00-05:00,PFE,cma fines pfizer 84.2 million for drug price hike to nhs for anti epilepsy drug,"{'neg': 0.141, 'neu': 0.859, 'pos': 0.0, 'compound': -0.3182}",negative,0.9916232228279114
989433,989433,1001593.0,8 Of The Biggest Biotech Announcements Out Of The 2016 ASH Meeting,2016-12-06 16:09:00-05:00,PFE,8 of the biggest biotech announcements out of the 2016 ash meeting,"{'neg': 0.0, 'neu': 1.0, 'pos': 0.0, 'compound': 0.0}",neutral,0.999872088432312
989434,989434,1001594.0,Pressure Biosciences CEO On Biological Samples: It's All About How You Break Open A Cell,2016-12-05 15:55:00-05:00,PFE,pressure biosciences ceo on biological samples its all about how you break open a cell,"{'neg': 0.136, 'neu': 0.864, 'pos': 0.0, 'compound': -0.296}",neutral,0.9998934268951416
989435,989435,1001595.0,Allergan's Strength Lies In Its New Products And Robust Pipeline,2016-12-05 12:04:00-05:00,PFE,allergans strength lies in its new products and robust pipeline,"{'neg': 0.182, 'neu': 0.455, 'pos': 0.364, 'compound': 0.4215}",positive,0.99887615442276
989436,989436,1001596.0,The Medicines Company Is A Major Cardiovascular Player In The Making,2016-12-05 11:42:00-05:00,PFE,the medicines company is a major cardiovascular player in the making,"{'neg': 0.0, 'neu': 1.0, 'pos': 0.0, 'compound': 0.0}",neutral,0.9998887777328491
989437,989437,1001597.0,"Pfizer, Avillion Reports Phase 3 BFORE Study Of BOSULIF  Met Its Primary Endpoint",2016-12-05 08:01:00-05:00,PFE,pfizer avillion reports phase 3 bfore study of bosulif met its primary endpoint,"{'neg': 0.0, 'neu': 1.0, 'pos': 0.0, 'compound': 0.0}",neutral,0.9998778104782104
989438,989438,1001598.0,"Spark Therapeutics, Pfizer Present Updated Preliminary Data from Hemophilia B Phase 1/2 Trial Suggesting Consistent and Sustained Levels of Factor IX Activity at ASH 2016",2016-12-03 14:50:00-05:00,PFE,spark therapeutics pfizer present updated preliminary data from hemophilia b phase .5 trial suggesting consistent and sustained levels of factor ix activity at ash 2016,"{'neg': 0.0, 'neu': 0.927, 'pos': 0.073, 'compound': 0.2263}",positive,0.7634117603302002
989439,989439,1001599.0,Pfizer Announces New Phase 2 Results Show Investigational Compound Glasdegib Improved Overall Survival in AML and High-Risk MDS at ASH 2016,2016-12-03 14:38:00-05:00,PFE,pfizer announces new phase 2 results show investigational compound glasdegib improved overall survival in aml and high risk mds at ash 2016,"{'neg': 0.073, 'neu': 0.664, 'pos': 0.262, 'compound': 0.7506}",positive,0.9997076392173767
989440,989440,1001600.0,Benzinga's Top Initiations,2016-12-02 09:24:00-05:00,PFE,benzingas top initiations,"{'neg': 0.0, 'neu': 0.526, 'pos': 0.474, 'compound': 0.2023}",neutral,0.9998692274093628
989441,989441,1001601.0,"The Market In 5 Minutes: Payrolls, Smith & Wesson Earnings And Starbucks' CEO Change",2016-12-02 09:03:00-05:00,PFE,the market in 5 minutes payrolls smith and wesson earnings and starbucks ceo change,"{'neg': 0.0, 'neu': 1.0, 'pos': 0.0, 'compound': 0.0}",neutral,0.9998856782913208
989442,989442,1001602.0,Guggenheim Initiates Coverage On Pfizer at Neutral,2016-12-02 07:18:00-05:00,PFE,guggenheim initiates coverage on pfizer at neutral,"{'neg': 0.0, 'neu': 1.0, 'pos': 0.0, 'compound': 0.0}",neutral,0.9998444318771362
989443,989443,1001603.0,"Pre-Market Prep Host Dennis Dick Tweets: Notable opening imbalances: $BAC +615K, $C +114K, $JPM +120K, $PFE +101K, $GE -143K, $PG -55K, $TWTR +35K",2016-12-01 09:22:00-05:00,PFE,pre market prep host dennis dick tweets notable opening imbalances bac positive 615 thousand c positive 114 thousand jpm positive 120 thousand pfe positive 101 thousand ge negative 143 thousand pg negative 55 thousand twtr positive 35 thousand,"{'neg': 0.173, 'neu': 0.468, 'pos': 0.359, 'compound': 0.91}",negative,0.9854494333267212
989444,989444,1001604.0,Pfizer's LYRICA Phase 3 Trial in Pediatric Epilepsy Meets Primary Endpoint,2016-12-01 08:03:00-05:00,PFE,pfizers lyrica phase 3 trial in pediatric epilepsy meets primary endpoint,"{'neg': 0.0, 'neu': 1.0, 'pos': 0.0, 'compound': 0.0}",neutral,0.9996887445449829
989445,989445,1001605.0,"IBM, Pfizer to Accelerate Immuno-oncology Research with Watson for Drug Discovery",2016-12-01 08:00:00-05:00,PFE,ibm pfizer to accelerate immuno oncology research with watson for drug discovery,"{'neg': 0.0, 'neu': 1.0, 'pos': 0.0, 'compound': 0.0}",positive,0.9980734586715698
989446,989446,1001606.0,Pfizer Announces It Met Primary Endpoint For the Pivotal Comparative REFLECTIONS B3271002 Study for PF-05280014,2016-11-30 08:30:00-05:00,PFE,pfizer announces it met primary endpoint for the pivotal comparative reflections b3271002 study for pf 05280014,"{'neg': 0.0, 'neu': 1.0, 'pos': 0.0, 'compound': 0.0}",neutral,0.9345142245292664
989447,989447,1001607.0,"Barclays Downgrades 5 Biopharma Stocks, Upgrades Pfizer And Alexion",2016-11-29 10:39:00-05:00,PFE,barclays downgrades 5 biopharma stocks upgrades pfizer and alexion,"{'neg': 0.0, 'neu': 1.0, 'pos': 0.0, 'compound': 0.0}",negative,0.9872888326644897
989448,989448,1001608.0,Benzinga's Top Upgrades,2016-11-29 08:49:00-05:00,PFE,benzingas top upgrades,"{'neg': 0.0, 'neu': 0.526, 'pos': 0.474, 'compound': 0.2023}",positive,0.7773524522781372
989449,989449,1001609.0,FDA Accepts the Biologics License Application for Avelumab for the Treatment of Metastatic Merkel Cell Carcinoma for Priority Review,2016-11-29 08:18:00-05:00,PFE,fda accepts the biologics license application for avelumab for the treatment of metastatic merkel cell carcinoma for priority review,"{'neg': 0.0, 'neu': 0.887, 'pos': 0.113, 'compound': 0.3182}",neutral,0.9623819589614868
989450,989450,1001610.0,Barclays Upgrades Pfizer to Overweight,2016-11-29 05:56:00-05:00,PFE,barclays upgrades pfizer to overweight,"{'neg': 0.385, 'neu': 0.615, 'pos': 0.0, 'compound': -0.3612}",positive,0.9981163740158081
989451,989451,1001611.0,Can You Guess This Chart?,2016-11-23 07:36:00-05:00,PFE,can you guess this chart,"{'neg': 0.0, 'neu': 1.0, 'pos': 0.0, 'compound': 0.0}",neutral,0.9998624324798584
989452,989452,1001612.0,Stop The Presses: Xanax Sales Tend To Pick Up During The Holiday Season,2016-11-22 14:25:00-05:00,PFE,stop the presses xanax sales tend to pick up during the holiday season,"{'neg': 0.138, 'neu': 0.692, 'pos': 0.17, 'compound': 0.128}",positive,0.9996342658996582
989453,989453,1001613.0,"QuintilesIMS Forms New Collaboration with Bristol-Myers Squibb, Lilly, Merck KGaA, Darmstadt, Germany, and Pfizer to Generate Real World Insights On Usage of Anti-Cancer Therapies Across Europe",2016-11-22 08:04:00-05:00,PFE,quintilesims forms new collaboration with bristol myers squibb lilly merck kgaa darmstadt germany and pfizer to generate real world insights on usage of anti cancer therapies across europe,"{'neg': 0.205, 'neu': 0.795, 'pos': 0.0, 'compound': -0.7717}",neutral,0.9386434555053711
989454,989454,1001614.0,President-Elect Trump and Your Portfolio,2016-11-21 16:20:00-05:00,PFE,president elect trump and your portfolio,"{'neg': 0.0, 'neu': 1.0, 'pos': 0.0, 'compound': 0.0}",neutral,0.999879002571106
989455,989455,1001615.0,"Pre-Market Prep Host Dennis Dick Tweets: Notable opening imbalances: $BABA +175K, $TWTR -90K, $BAC -236K, $MS -175K, $SQ -182K, $KR -109K, $PFE +109K",2016-11-17 09:25:00-05:00,PFE,pre market prep host dennis dick tweets notable opening imbalances baba positive 175 thousand twtr negative 90 thousand bac negative 236 thousand ms negative 175 thousand sq negative 182 thousand kr negative 109 thousand pfe positive 109 thousand,"{'neg': 0.415, 'neu': 0.468, 'pos': 0.116, 'compound': -0.9612}",negative,0.9369139075279236
989456,989456,1001616.0,PALOMA-2 Phase 3 Study Published In The New England Journal Of Medicine Demonstrates Clinical Benefit Of Pfizer's IBRANCE,2016-11-16 17:11:00-05:00,PFE,paloma 2 phase 3 study published in the new england journal of medicine demonstrates clinical benefit of pfizers ibrance,"{'neg': 0.0, 'neu': 0.857, 'pos': 0.143, 'compound': 0.4588}",positive,0.9986500144004822
989457,989457,1001617.0,"UPDATE: Pfizer Says OPAL Broaden, OPAL Beyond Met Primary Efficacy Endpoints Showing Statistically Significant Improvement with Tofacitinib 5 mg, 10 mg Twice Daily vs Placebo",2016-11-15 08:03:00-05:00,PFE,update pfizer says opal broaden opal beyond met primary efficacy endpoints showing statistically significant improvement with tofacitinib 5 mg 10 mg twice daily vs placebo,"{'neg': 0.0, 'neu': 0.827, 'pos': 0.173, 'compound': 0.5859}",positive,0.9996681213378906
989458,989458,1001618.0,Pfizer Reports Results from Phase 3 OPAL Development Program Investigating XELJANZ for Psoriatic Arthritis,2016-11-15 08:02:00-05:00,PFE,pfizer reports results from phase 3 opal development program investigating xeljanz for psoriatic arthritis,"{'neg': 0.0, 'neu': 1.0, 'pos': 0.0, 'compound': 0.0}",neutral,0.999832272529602
989459,989459,1001619.0,"13F from Paulson & Co. Shows Increased Stake in Loxo Oncology, New Stake in Monster Worldwide, Steris, Talend, Tobira Therapeutics, Reduced Stakes in Pfizer, Puma Biotech, Synergy Pharma, Vanda, Liquidated Stake in Rite Aid",2016-11-14 17:54:00-05:00,PFE,13 f from paulson and co shows increased stake in loxo oncology new stake in monster worldwide steris talend tobira therapeutics reduced stakes in pfizer puma biotech synergy pharma vanda liquidated stake in rite aid,"{'neg': 0.0, 'neu': 0.942, 'pos': 0.058, 'compound': 0.2732}",positive,0.999413251876831
989460,989460,1001620.0,"UPDATE: Pfizer Says CRADA 'assesses OX40 agonist, utomilumab and avelumab immuno-oncology assets alone and in various combinations'",2016-11-14 08:14:00-05:00,PFE,update pfizer says crada assesses ox40 agonist utomilumab and avelumab immuno oncology assets alone and in various combinations,"{'neg': 0.102, 'neu': 0.812, 'pos': 0.086, 'compound': -0.0772}",neutral,0.9998892545700073
989461,989461,1001621.0,Pfizer Reports Collaboration with National Cancer Institute for Studying of Three Immunotherapy Agents Target Multiple Cancers,2016-11-14 08:14:00-05:00,PFE,pfizer reports collaboration with national cancer institute for studying of three immunotherapy agents target multiple cancers,"{'neg': 0.227, 'neu': 0.773, 'pos': 0.0, 'compound': -0.6597}",neutral,0.9998558759689331
989462,989462,1001622.0,Landmark Study Demonstrates Pfizer's Celebrex has Similar Cardiovascular Risk vs Prescription Doses of Ibuprofen and Naproxen,2016-11-13 18:01:00-05:00,PFE,landmark study demonstrates pfizers celebrex has similar cardiovascular risk vs prescription doses of ibuprofen and naproxen,"{'neg': 0.121, 'neu': 0.805, 'pos': 0.075, 'compound': -0.2023}",neutral,0.8444145917892456
989463,989463,1001623.0,"Barron's Picks And Pans: Trump Stocks, Thermo Fisher, Discover And More",2016-11-13 14:59:00-05:00,PFE,barrons picks and pans trump stocks thermo fisher discover and more,"{'neg': 0.0, 'neu': 1.0, 'pos': 0.0, 'compound': 0.0}",neutral,0.9998682737350464
989464,989464,1001624.0,2 Big Medical Marijuana Stocks Riding High Post-Election,2016-11-10 10:45:00-05:00,PFE,2 big medical marijuana stocks riding high post election,"{'neg': 0.0, 'neu': 1.0, 'pos': 0.0, 'compound': 0.0}",positive,0.9945310950279236
