,Unnamed: 0.1,Unnamed: 0,title,date,stock,Text_Cleaned,Score,label,score
558419,558419,569192.0,TD Ameritrade Moves One Step Closer Towards Making Trading Through Your Car Possible,2019-07-22 07:34:00-04:00,GOOG,td ameritrade moves one step closer towards making trading through your car possible,"{'neg': 0.0, 'neu': 1.0, 'pos': 0.0, 'compound': 0.0}",positive,0.9959698915481567
558420,558420,569193.0,Google to Pay $13M to End 2010 Privacy Lawsuit,2019-07-21 17:02:00-04:00,GOOG,google to pay dollars 3 million to end 2010 privacy lawsuit,"{'neg': 0.268, 'neu': 0.732, 'pos': 0.0, 'compound': -0.3182}",neutral,0.997685432434082
558421,558421,569194.0,FaceApp Is A Reminder That Our Data Is More Vulnerable Than We Realize,2019-07-19 11:48:00-04:00,GOOG,faceapp is a reminder that our data is more vulnerable than we realize,"{'neg': 0.155, 'neu': 0.845, 'pos': 0.0, 'compound': -0.2944}",neutral,0.9973188042640686
558422,558422,569195.0,"Raymond James Maintains Strong Buy on Microsoft, Raises Target to $163 As Firm Believes Co 'established a strong competitive advantage as one of the top-three hyperscale cloud vendors, but with distinct advantages over AWS and GOOG' Cites 3 Reasons:",2019-07-19 09:48:00-04:00,GOOG,raymond james maintains strong buy on microsoft raises target to dollars 63 as firm believes co established a strong competitive advantage as one of the top three hyperscale cloud vendors but with distinct advantages over aws and goog cites 3 reasons,"{'neg': 0.0, 'neu': 0.748, 'pos': 0.252, 'compound': 0.8316}",positive,0.999695897102356
558423,558423,569196.0,"'Israeli security company reportedly has tool that spies on Apple, Google and Facebook cloud data' -CNBC",2019-07-19 09:33:00-04:00,GOOG,israeli security company reportedly has tool that spies on apple google and facebook cloud data cnbc,"{'neg': 0.0, 'neu': 0.862, 'pos': 0.138, 'compound': 0.34}",neutral,0.9998716115951538
558424,558424,569197.0,Huawei Will Continue Using Android OS For Its Phones,2019-07-18 09:15:00-04:00,GOOG,huawei will continue using android os for its phones,"{'neg': 0.0, 'neu': 1.0, 'pos': 0.0, 'compound': 0.0}",neutral,0.9998743534088135
558425,558425,569198.0,Russia Fines Google For Refusing To Filter Traffic,2019-07-18 08:55:00-04:00,GOOG,russia fines google for refusing to filter traffic,"{'neg': 0.278, 'neu': 0.722, 'pos': 0.0, 'compound': -0.4019}",negative,0.7885608077049255
558426,558426,569199.0,"UPDATE: KeyBanc On Google, Facebook, Twitter Sees 'advertisers gaining greater appreciation for the quality of impression, reach, frequency that is available, which is driving strong demand for quality video ad inventory'",2019-07-17 12:15:00-04:00,GOOG,update keybanc on google facebook twitter sees advertisers gaining greater appreciation for the quality of impression reach frequency that is available which is driving strong demand for quality video ad inventory,"{'neg': 0.037, 'neu': 0.594, 'pos': 0.369, 'compound': 0.9081}",positive,0.999664306640625
558427,558427,569200.0,"KeyBanc Previews Google, Facebook, Twitter Q2 Earnings, Continues 'to see strong growth in the volume and quality of available video ad inventory across the major platforms'",2019-07-17 12:14:00-04:00,GOOG,keybanc previews google facebook twitter second quarter earnings continues to see strong growth in the volume and quality of available video ad inventory across the major platforms,"{'neg': 0.0, 'neu': 0.809, 'pos': 0.191, 'compound': 0.7096}",positive,0.9996957778930664
558428,558428,569201.0,It's Almost Time For These Leveraged Media ETFs,2019-07-17 09:27:00-04:00,GOOG,its almost time for these leveraged media etfs,"{'neg': 0.0, 'neu': 1.0, 'pos': 0.0, 'compound': 0.0}",neutral,0.999817430973053
558429,558429,569202.0,Stock Wars: GM Vs. Ford Vs. Tesla Vs. Toyota,2019-07-17 08:19:00-04:00,GOOG,stock wars gm vs ford vs tesla vs toyota,"{'neg': 0.31, 'neu': 0.69, 'pos': 0.0, 'compound': -0.5574}",neutral,0.9998681545257568
558430,558430,569203.0,Google Banned Major Chinese App Developer CooTek from Play Store and Ad Platforms,2019-07-17 04:12:00-04:00,GOOG,google banned major chinese app developer cootek from play store and ad platforms,"{'neg': 0.183, 'neu': 0.671, 'pos': 0.146, 'compound': -0.1531}",neutral,0.5813120007514954
558431,558431,569204.0,Trump Says He Would Recommend That US Attorney General And Various Agencies Take A Look At Google's Involvement In China To See If There Is Truth To Allegations,2019-07-16 12:59:00-04:00,GOOG,trump says he would recommend that us attorney general and various agencies take a look at googles involvement in china to see if there is truth to allegations,"{'neg': 0.0, 'neu': 0.844, 'pos': 0.156, 'compound': 0.5859}",neutral,0.9998427629470825
558432,558432,569205.0,"'...Thiel believes Google should be investigated for treason. He accuses Google of working with the Chinese Government."" @foxandfriends  A great and brilliant guy who knows this subject better than anyone! The Trump Administration will take a look!'",2019-07-16 07:54:00-04:00,GOOG,thiel believes google should be investigated for treason he accuses google of working with the chinese government a great and brilliant guy who knows this subject better than anyone the trump administration will take a look,"{'neg': 0.113, 'neu': 0.658, 'pos': 0.229, 'compound': 0.7579}",neutral,0.9996457099914551
558433,558433,569206.0,'Google accused of ripping off digital ad technology in U.S. lawsuit' -Yahoo Finance,2019-07-15 15:34:00-04:00,GOOG,google accused of ripping off digital ad technology in u s lawsuit yahoo finance,"{'neg': 0.255, 'neu': 0.745, 'pos': 0.0, 'compound': -0.4767}",neutral,0.8551937937736511
558434,558434,569207.0,"'SOURCES: Trump Administration taking aim @Google as 2020 election approaches, believes $GOOG discriminating against conservatives in search. officials talk about a possible major crackdown on the tech giant they believe...' -Tweets Charles Gasparino",2019-07-15 13:21:00-04:00,GOOG,sources trump administration taking aim as 2020 election approaches believes goog discriminating against conservatives in search officials talk about a possible major crackdown on the tech giant they believe tweets charles gasparino,"{'neg': 0.0, 'neu': 1.0, 'pos': 0.0, 'compound': 0.0}",neutral,0.9704921245574951
558435,558435,569208.0,Why Big Tech Could Face Big Threat Following Social Media Summit,2019-07-12 13:31:00-04:00,GOOG,why big tech could face big threat following social media summit,"{'neg': 0.254, 'neu': 0.746, 'pos': 0.0, 'compound': -0.5267}",negative,0.9441607594490051
558436,558436,569209.0,"Munster Talks Growth Outlook For Amazon, Google",2019-07-12 07:36:00-04:00,GOOG,munster talks growth outlook for amazon google,"{'neg': 0.0, 'neu': 0.538, 'pos': 0.462, 'compound': 0.5106}",positive,0.9763643145561218
558437,558437,569210.0,4 Apps To Help You Save For A Down Payment,2019-07-11 16:46:00-04:00,GOOG,4 apps to help you save for a down payment,"{'neg': 0.0, 'neu': 0.576, 'pos': 0.424, 'compound': 0.7096}",neutral,0.995739221572876
558438,558438,569211.0,Tech Stocks To Watch Closely,2019-07-11 13:16:00-04:00,GOOG,tech stocks to watch closely,"{'neg': 0.0, 'neu': 1.0, 'pos': 0.0, 'compound': 0.0}",neutral,0.9997397065162659
558439,558439,569212.0,Facebook Shares Unaffected Following UK Sun Article 'Google secretly building NEW Facebook rival called Shoelace that's like 'Tinder for making friends'',2019-07-11 11:33:00-04:00,GOOG,facebook shares unaffected following uk sun article google secretly building new facebook rival called shoelace thats like tinder for making friends,"{'neg': 0.0, 'neu': 0.698, 'pos': 0.302, 'compound': 0.7783}",neutral,0.999832272529602
558440,558440,569213.0,Breaking Down 3 Of The Year's Most Intriguing Cybersecurity Stocks,2019-07-11 10:25:00-04:00,GOOG,breaking down 3 of the years most intriguing cybersecurity stocks,"{'neg': 0.0, 'neu': 1.0, 'pos': 0.0, 'compound': 0.0}",neutral,0.9997475743293762
558441,558441,569214.0,"After Hitting 3000 For First Time, Market Mulls Delta Results, More Powell",2019-07-11 10:04:00-04:00,GOOG,after hitting 3000 for first time market mulls delta results more powell,"{'neg': 0.0, 'neu': 1.0, 'pos': 0.0, 'compound': 0.0}",neutral,0.9905519485473633
558442,558442,569215.0,'IRS Allegedly Hopes to Make Tech Giants Release User Crypto Activity' -Coin Telegraph,2019-07-09 15:57:00-04:00,GOOG,irs allegedly hopes to make tech giants release crypto activity coin telegraph,"{'neg': 0.0, 'neu': 0.797, 'pos': 0.203, 'compound': 0.4215}",neutral,0.9998019337654114
558443,558443,569216.0,What To Know About Google's Acquisition Of Elastifile,2019-07-09 12:31:00-04:00,GOOG,what to know about googles acquisition of elastifile,"{'neg': 0.0, 'neu': 1.0, 'pos': 0.0, 'compound': 0.0}",neutral,0.9998699426651001
558444,558444,569217.0,'Google to acquire Elastifile' -Google Cloud Blog Post,2019-07-09 10:06:00-04:00,GOOG,google to acquire elastifile google cloud blog post,"{'neg': 0.0, 'neu': 1.0, 'pos': 0.0, 'compound': 0.0}",neutral,0.9997443556785583
558445,558445,569218.0,Defensive Names Could Help This Growth Sector ETF,2019-07-08 07:26:00-04:00,GOOG,defensive names could help this growth sector etf,"{'neg': 0.0, 'neu': 0.424, 'pos': 0.576, 'compound': 0.7003}",positive,0.9994481205940247
558446,558446,569219.0,'Retailers Eager to Lodge Antitrust Complaints Against Amazon and Google' -Bloomberg,2019-07-01 16:56:00-04:00,GOOG,retailers eager to lodge antitrust complaints against amazon and google bloomberg,"{'neg': 0.181, 'neu': 0.537, 'pos': 0.282, 'compound': 0.128}",neutral,0.9984233379364014
558447,558447,569220.0,Google Shares Unaffected As Following Post From Co.'s 'The Keyword' Blog: 'Breaking ground in Nevada',2019-07-01 14:20:00-04:00,GOOG,google shares unaffected as following post from co s the keyword blog breaking ground in nevada,"{'neg': 0.0, 'neu': 0.872, 'pos': 0.128, 'compound': 0.296}",neutral,0.9998606443405151
558448,558448,569221.0,Google Maps Launching Live Traffic Delays For Buses In Places Where Real-Time Information Direct From Local Transit Agencies Is Not Available,2019-06-27 13:30:00-04:00,GOOG,google maps launching live traffic delays for buses in places where real time information direct from local transit agencies is not available,"{'neg': 0.0, 'neu': 1.0, 'pos': 0.0, 'compound': 0.0}",neutral,0.9995540976524353
558449,558449,569222.0,"Alphabet's Cybersecurity Firm, Chronicle, Will Become Part Of Google Cloud",2019-06-27 12:25:00-04:00,GOOG,alphabets cybersecurity firm chronicle will become part of google cloud,"{'neg': 0.0, 'neu': 1.0, 'pos': 0.0, 'compound': 0.0}",neutral,0.9998897314071655
558450,558450,569223.0,Trump: Social Media Companies 'Trying To Rig The Election',2019-06-26 13:37:00-04:00,GOOG,trump social media companies trying to rig the election,"{'neg': 0.158, 'neu': 0.842, 'pos': 0.0, 'compound': -0.128}",neutral,0.999811589717865
558451,558451,569224.0,'The White House is hosting a social media summit as Trump continues to assail tech companies' -CNBC,2019-06-26 11:35:00-04:00,GOOG,the white house is hosting a social media summit as trump continues to assail tech companies cnbc,"{'neg': 0.0, 'neu': 1.0, 'pos': 0.0, 'compound': 0.0}",neutral,0.9997245669364929
558452,558452,569225.0,"White House To Hold Social Media Summit On Thurs., Jul. 11, 2019",2019-06-26 11:34:00-04:00,GOOG,white house to hold social media summit on thurs jul 11 2019,"{'neg': 0.0, 'neu': 1.0, 'pos': 0.0, 'compound': 0.0}",neutral,0.999882698059082
558453,558453,569226.0,"Trade Winds, Fed Still In Focus, But Strong Micron Results Might Help Semiconductors",2019-06-26 10:09:00-04:00,GOOG,trade winds fed still in focus but strong micron results might help semiconductors,"{'neg': 0.0, 'neu': 0.579, 'pos': 0.421, 'compound': 0.8402}",positive,0.999527096748352
558454,558454,569227.0,"Trump Says Google Is 'Totally Biased', Says Tech Companies Should Be Sued",2019-06-26 08:45:00-04:00,GOOG,trump says google is totally biased says tech companies should be sued,"{'neg': 0.179, 'neu': 0.821, 'pos': 0.0, 'compound': -0.3384}",neutral,0.9731751084327698
558455,558455,569228.0,"Trump Says We Should Be Suing Google And Facebook, Perhaps We Will",2019-06-26 08:41:00-04:00,GOOG,trump says we should be suing google and facebook perhaps we will,"{'neg': 0.16, 'neu': 0.84, 'pos': 0.0, 'compound': -0.2732}",neutral,0.9998067021369934
558456,558456,569229.0,Needham's Checks Suggest Angi Homeservices Faces Growing Competition From Google,2019-06-25 16:34:00-04:00,GOOG,needhams checks suggest angi homeservices faces growing competition from google,"{'neg': 0.0, 'neu': 0.841, 'pos': 0.159, 'compound': 0.1779}",negative,0.9861941933631897
558457,558457,569230.0,'UPDATE: Youtube DELETES Video Exposing Google Plan to Interfere in 2020 Election' -The Dan Bongino Show,2019-06-25 10:28:00-04:00,GOOG,update youtube deletes video exposing google plan to interfere in 2020 election the dan bongino show,"{'neg': 0.123, 'neu': 0.877, 'pos': 0.0, 'compound': -0.2732}",neutral,0.9838429689407349
558458,558458,569231.0,"'Fast Money' Traders Talk Gold, Defensive Stocks And More",2019-06-25 07:43:00-04:00,GOOG,fast money traders talk gold defensive stocks and more,"{'neg': 0.0, 'neu': 0.879, 'pos': 0.121, 'compound': 0.0258}",neutral,0.9998427629470825
558459,558459,569232.0,Google Will Invest An Added $1.1B In Dutch Data Centers,2019-06-24 13:03:00-04:00,GOOG,google will invest an added dollars .1 billion in dutch data centers,"{'neg': 0.0, 'neu': 1.0, 'pos': 0.0, 'compound': 0.0}",neutral,0.9991750121116638
558460,558460,569233.0,"Google Will Invest Added €1B In Dutch Data Centers; Will Build New Data Center In Middenmeer, Netherlands",2019-06-24 09:31:00-04:00,GOOG,google will invest added 1 billion in dutch data centers will build new data center in middenmeer netherlands,"{'neg': 0.0, 'neu': 1.0, 'pos': 0.0, 'compound': 0.0}",neutral,0.9971465468406677
558461,558461,569234.0,Hearing Moffett Nathanson Out Saying Alphabet Q1 Earnings May Show Core Search Growth Has Slowed Such That Other Google Businesses  Could No Longer Prop Up Results; Unconfirmed,2019-06-24 08:57:00-04:00,GOOG,hearing moffett nathanson out saying alphabet first quarter earnings may show core search growth has slowed such that other google businesses could no longer prop up results unconfirmed,"{'neg': 0.118, 'neu': 0.799, 'pos': 0.083, 'compound': -0.0258}",negative,0.9987779259681702
558462,558462,569235.0,"Hearing Cleveland Research Out With Negative Checks On Alphabet, Checks Show Search Business Trending Weak As Major Customers Appear Increasingly Reluctant To Add Spend; Unconfirmed",2019-06-24 08:56:00-04:00,GOOG,hearing cleveland research out with negative checks on alphabet checks show search business trending weak as major customers appear increasingly reluctant to add spend unconfirmed,"{'neg': 0.325, 'neu': 0.675, 'pos': 0.0, 'compound': -0.8442}",negative,0.9985880255699158
558463,558463,569236.0,"Senate Democrats Ask FTC, Justice Department About Status Of Possible Anti-Trust Probes Into Apple, Amazon.Com, Facebook And Alphabet",2019-06-21 14:28:00-04:00,GOOG,senate democrats ask ftc justice department about status of possible anti trust probes into apple amazon com facebook and alphabet,"{'neg': 0.086, 'neu': 0.599, 'pos': 0.315, 'compound': 0.7269}",neutral,0.9998220801353455
558464,558464,569237.0,"The Other Low Volatility ETF Is Doing Alright, Too",2019-06-21 12:01:00-04:00,GOOG,the other low volatility etf is doing alright too,"{'neg': 0.189, 'neu': 0.631, 'pos': 0.18, 'compound': -0.0258}",positive,0.9990702271461487
558465,558465,569238.0,Kevin O'Leary On How His E-Commerce And Internet ETF Is Thriving In A Volatile Market,2019-06-21 07:21:00-04:00,GOOG,kevin oleary on how his e commerce and internet etf is thriving in a volatile market,"{'neg': 0.0, 'neu': 1.0, 'pos': 0.0, 'compound': 0.0}",positive,0.9958508014678955
558466,558466,569239.0,'Google is giving up on competing with Apple's iPad as it ends its tablet business and cancels two unreleased devices' -Business Insider,2019-06-20 14:56:00-04:00,GOOG,google is giving up on competing with apples ipad as it ends its tablet business and cancels two unreleased devices business insider,"{'neg': 0.078, 'neu': 0.823, 'pos': 0.099, 'compound': 0.128}",negative,0.9534657597541809
558467,558467,569240.0,This CEO Thinks Big Tech Enables Data Breaches,2019-06-20 13:10:00-04:00,GOOG,this ceo thinks big tech enables data breaches,"{'neg': 0.0, 'neu': 1.0, 'pos': 0.0, 'compound': 0.0}",neutral,0.9996752738952637
558468,558468,569241.0,Shares of several technology companies are trading higher amid renewed hopes of a Federal Reserve rate cut this year and in sympathy with Oracle reporting strong Q4 earnings.,2019-06-20 07:29:00-04:00,GOOG,shares of several technology companies are trading higher amid renewed hopes of a federal reserve rate cut this year and in sympathy with oracle reporting strong fourth quarter earnings,"{'neg': 0.057, 'neu': 0.65, 'pos': 0.293, 'compound': 0.8271}",positive,0.9996621608734131
558469,558469,569242.0,Report: YouTube Exploring Standalone App For Kids Content,2019-06-19 13:00:00-04:00,GOOG,report youtube exploring standalone app for kids content,"{'neg': 0.0, 'neu': 1.0, 'pos': 0.0, 'compound': 0.0}",neutral,0.9998782873153687
558470,558470,569243.0,"How Trucks Are Becoming A Solution, Not A Product",2019-06-19 11:42:00-04:00,GOOG,how trucks are becoming a solution not a product,"{'neg': 0.0, 'neu': 0.777, 'pos': 0.223, 'compound': 0.3182}",neutral,0.9998192191123962
558471,558471,569244.0,Cloud Looming? Oracle's Revenue Seen Down In Competitive Atmosphere,2019-06-18 14:42:00-04:00,GOOG,cloud looming oracles revenue seen down in competitive atmosphere,"{'neg': 0.147, 'neu': 0.686, 'pos': 0.167, 'compound': 0.0516}",negative,0.9983202815055847
558472,558472,569245.0,'Google has confirmed that they have resolved the Google Calendar issue. All Salesloft features that integrate with calendar are now operational' -SalesLoft Status,2019-06-18 13:32:00-04:00,GOOG,google has confirmed that they have resolved the google calendar issue all salesloft features that integrate with calendar are now operational salesloft status,"{'neg': 0.0, 'neu': 0.928, 'pos': 0.072, 'compound': 0.1779}",positive,0.5324093103408813
558473,558473,569246.0,Google To Invest Additional $1B In Housing In The Bay Area,2019-06-18 12:43:00-04:00,GOOG,google to invest additional dollars b in housing in the bay area,"{'neg': 0.0, 'neu': 1.0, 'pos': 0.0, 'compound': 0.0}",neutral,0.982631266117096
558474,558474,569247.0,"Sanofi, Google Partner On Health Care-Focused Virtual Innovation Lab",2019-06-18 10:54:00-04:00,GOOG,sanofi google partner on health care focused virtual innovation lab,"{'neg': 0.0, 'neu': 0.455, 'pos': 0.545, 'compound': 0.8126}",neutral,0.9998784065246582
558475,558475,569248.0,'Our team is aware of this issue and working on a fix. Appreciate your patience.' -Tweet From Google Calendar,2019-06-18 10:44:00-04:00,GOOG,our team is aware of this issue and working on a fix appreciate your patience tweet from google calendar,"{'neg': 0.0, 'neu': 0.87, 'pos': 0.13, 'compound': 0.4019}",neutral,0.9988928437232971
558476,558476,569249.0,A Surprising ETF Stands Firm Amid Trade War Controversy,2019-06-18 08:04:00-04:00,GOOG,a surprising etf stands firm amid trade war controversy,"{'neg': 0.3, 'neu': 0.538, 'pos': 0.162, 'compound': -0.4215}",positive,0.998314380645752
558477,558477,569250.0,Chinese Brands Are Taking The Global Economy By Storm,2019-06-17 15:05:00-04:00,GOOG,chinese brands are taking the global economy by storm,"{'neg': 0.0, 'neu': 1.0, 'pos': 0.0, 'compound': 0.0}",negative,0.8750373125076294
558478,558478,569251.0,"'Alphabet is worth 50% more if broken up, but not Facebook, analyst says' -CNBC",2019-06-17 14:50:00-04:00,GOOG,alphabet is worth 50 percent more if broken up but not facebook analyst says cnbc,"{'neg': 0.132, 'neu': 0.781, 'pos': 0.087, 'compound': -0.1875}",neutral,0.9997356534004211
558479,558479,569252.0,Ask Our Experts 6/16/2019: Sage Advertising Advice Shared At Women Grow Leadership Summit,2019-06-17 09:44:00-04:00,GOOG,ask our experts sage advertising advice shared at women grow leadership summit,"{'neg': 0.0, 'neu': 0.821, 'pos': 0.179, 'compound': 0.34}",neutral,0.9996925592422485
558480,558480,569253.0,Huawei Delays Foldable Phone Launch,2019-06-14 15:10:00-04:00,GOOG,huawei delays foldable phone launch,"{'neg': 0.0, 'neu': 1.0, 'pos': 0.0, 'compound': 0.0}",negative,0.9814777374267578
558481,558481,569254.0,Google CEO Sundar Pichai Was In Oklahoma To Announce A $600M Investment To Expand Data Center In Mayes County,2019-06-13 13:28:00-04:00,GOOG,google ceo sundar pichai was in oklahoma to announce a dollars 00 million investment to expand data center in mayes county,"{'neg': 0.0, 'neu': 0.897, 'pos': 0.103, 'compound': 0.3182}",neutral,0.9633400440216064
558482,558482,569255.0,Legal Expert Breaks Down Antitrust Risk For Big US Tech Stocks,2019-06-13 13:12:00-04:00,GOOG,legal expert breaks down antitrust risk for big us tech stocks,"{'neg': 0.167, 'neu': 0.714, 'pos': 0.119, 'compound': -0.1531}",neutral,0.9990308284759521
558483,558483,569256.0,From Kyrgyzstan To London: How This CEO Is Trying To Revolutionize Productivity In Financial Services,2019-06-13 11:39:00-04:00,GOOG,from kyrgyzstan to london how this ceo is trying to revolutionize productivity in financial services,"{'neg': 0.0, 'neu': 1.0, 'pos': 0.0, 'compound': 0.0}",positive,0.9477652907371521
558484,558484,569257.0,"Final-Mile Delivery Firms Struggle To Stay Up With, Let Alone Ahead Of The Curve",2019-06-13 09:40:00-04:00,GOOG,final mile delivery firms struggle to stay up with let alone ahead of the curve,"{'neg': 0.249, 'neu': 0.751, 'pos': 0.0, 'compound': -0.5106}",negative,0.986676037311554
558485,558485,569258.0,"Nomura: AMD's Upcoming Products Can Drive Revenue Momentum, Operating Leverage",2019-06-12 14:17:00-04:00,GOOG,nomura amds upcoming products can drive revenue momentum operating leverage,"{'neg': 0.0, 'neu': 1.0, 'pos': 0.0, 'compound': 0.0}",positive,0.9996862411499023
558486,558486,569259.0,'Fmr #Google Engineer @m_wacker says he was FIRED just days after he appeared on 'Trish Regan Primetime' to expose the company's bias and 'outrage mobs'' -Tweet From FOX Business Anchor Trish Regan,2019-06-11 16:40:00-04:00,GOOG,fmr engineer says he was fired just days after he appeared on trish regan primetime to expose the companys bias and outrage mobs tweet from fox business anchor trish regan,"{'neg': 0.276, 'neu': 0.724, 'pos': 0.0, 'compound': -0.836}",neutral,0.7818500399589539
558487,558487,569260.0,YouTube's Account Purges Spark A Cannabis Content Alternative,2019-06-11 12:35:00-04:00,GOOG,youtubes account purges spark a cannabis content alternative,"{'neg': 0.0, 'neu': 0.787, 'pos': 0.213, 'compound': 0.2263}",neutral,0.8981778025627136
558488,558488,569261.0,Dept. Of Justice Antitrust Chief Touts Importance Of Protecting Competition In Digital Economy,2019-06-11 11:21:00-04:00,GOOG,dept of justice antitrust chief touts importance of protecting competition in digital economy,"{'neg': 0.065, 'neu': 0.588, 'pos': 0.347, 'compound': 0.7003}",neutral,0.9942923784255981
558489,558489,569262.0,Shares of Shares of several semiconductor and technology companies are trading higher on continued trade optimism. The recent US-Mexico deal boosted confidence that the US could also strike a deal with China.,2019-06-11 09:47:00-04:00,GOOG,shares of shares of several semiconductor and technology companies are trading higher on continued trade optimism the recent us mexico deal boosted confidence that the us could also strike a deal with china,"{'neg': 0.036, 'neu': 0.64, 'pos': 0.325, 'compound': 0.9042}",positive,0.9997066855430603
558490,558490,569263.0,Morgan Stanley Says The Market Is Underappreciating Tesla's AV Business,2019-06-11 09:43:00-04:00,GOOG,morgan stanley says the market is underappreciating teslas av business,"{'neg': 0.0, 'neu': 1.0, 'pos': 0.0, 'compound': 0.0}",positive,0.8447579145431519
558491,558491,569264.0,Hearing Needham Out Saying A Breakup Of Google Would Yield Investors ~50%,2019-06-11 06:16:00-04:00,GOOG,hearing needham out saying a breakup of google would yield investors 50 percent,"{'neg': 0.0, 'neu': 1.0, 'pos': 0.0, 'compound': 0.0}",neutral,0.9983178377151489
558492,558492,569265.0,The IMX Reaches A Six-Month High After May's Volatility,2019-06-10 15:00:00-04:00,GOOG,the imx reaches a six month high after mays volatility,"{'neg': 0.0, 'neu': 0.882, 'pos': 0.118, 'compound': 0.0516}",negative,0.9633749127388
558493,558493,569266.0,The Importance Of Dataism In The Future Of Freight Hauling,2019-06-10 11:30:00-04:00,GOOG,the importance of dataism in the future of freight hauling,"{'neg': 0.0, 'neu': 0.783, 'pos': 0.217, 'compound': 0.3612}",neutral,0.999871015548706
558494,558494,569267.0,"Shares of several technology companies are trading higher after the U.S. and Mexico signed part of an immigration deal. If reached, Mexico would avoid previously announced tariffs; if not reached, President Trump stated tariffs would be reinstated.",2019-06-10 10:21:00-04:00,GOOG,shares of several technology companies are trading higher after the u s and mexico signed part of an immigration deal if reached mexico would avoid previously announced tariffs if not reached president trump stated tariffs would be reinstated,"{'neg': 0.085, 'neu': 0.827, 'pos': 0.088, 'compound': 0.0268}",positive,0.9978690147399902
558495,558495,569268.0,Whitney Tilson: 'I Think We Are In An IPO Bubble',2019-06-10 10:04:00-04:00,GOOG,whitney tilson i think we are in an ipo bubble,"{'neg': 0.0, 'neu': 1.0, 'pos': 0.0, 'compound': 0.0}",neutral,0.9998655319213867
558496,558496,569269.0,Trump Says EU Is Attacking US Companies,2019-06-10 08:58:00-04:00,GOOG,trump says eu is attacking us companies,"{'neg': 0.333, 'neu': 0.667, 'pos': 0.0, 'compound': -0.4588}",neutral,0.9991093277931213
