,Unnamed: 0.1,Unnamed: 0,title,date,stock,Text_Cleaned,Score,label,score
989001,989001,1001143.0,PreMarket Prep Opening Imbalance Update: Square 215k Shares To Sell; Salesforce 43K To Sell; GE 96k To Buy; Alibaba 68k To Sell; Twitter 25k To Sell; Pfizer 56k To Sell; ConocoPhillips 27k To Sell,2018-03-07 08:35:00-05:00,PFE,premarket prep opening imbalance update square 215 thousand shares to sell salesforce 43 thousand to sell ge 96 thousand to buy alibaba 68 thousand to sell twitter 25 thousand to sell pfizer 56 thousand to sell conocophillips 27 thousand to sell,"{'neg': 0.0, 'neu': 0.948, 'pos': 0.052, 'compound': 0.296}",neutral,0.9998754262924194
989002,989002,1001144.0,The Week Ahead: Discount Retailers Close Out Earnings Season,2018-03-05 14:17:00-05:00,PFE,the week ahead discount retailers close out earnings season,"{'neg': 0.0, 'neu': 1.0, 'pos': 0.0, 'compound': 0.0}",neutral,0.9998359680175781
989003,989003,1001145.0,"The Week Ahead In Biotech: Earnings, PDUFA Dates And More",2018-03-02 14:12:00-05:00,PFE,the week ahead in biotech earnings pdufa dates and more,"{'neg': 0.0, 'neu': 1.0, 'pos': 0.0, 'compound': 0.0}",neutral,0.9998695850372314
989004,989004,1001146.0,Vetr Crowd Upgrades Pfizer,2018-03-02 07:21:00-05:00,PFE,vetr crowd upgrades pfizer,"{'neg': 0.0, 'neu': 1.0, 'pos': 0.0, 'compound': 0.0}",neutral,0.9953802824020386
989005,989005,1001147.0,Attention Biotech Investors: Mark Your Calendar For These March PDUFA Dates,2018-02-28 10:08:00-05:00,PFE,attention biotech investors mark your calendar for these march pdufa dates,"{'neg': 0.0, 'neu': 1.0, 'pos': 0.0, 'compound': 0.0}",neutral,0.9998832941055298
989006,989006,1001148.0,Pfizer Filing Shows Registration For Mixed Securities Shelf Offering,2018-02-26 16:14:00-05:00,PFE,pfizer filing shows registration for mixed securities shelf offering,"{'neg': 0.0, 'neu': 0.784, 'pos': 0.216, 'compound': 0.296}",neutral,0.9998733997344971
989007,989007,1001149.0,"Pfizer Receives Positive CHMP Opinion for Two Hematology Medicines, MYLOTARG and BOSULIF",2018-02-23 09:00:00-05:00,PFE,pfizer receives positive chmp opinion for two hematology medicines mylotarg and bosulif,"{'neg': 0.0, 'neu': 0.753, 'pos': 0.247, 'compound': 0.5574}",positive,0.9994441866874695
989008,989008,1001150.0,Pfizer Says EMA Has Recommended Against Expanding Use Of SUTENT To Include Adjuvant Treatment Of Adult Patients At High Risk Of RCC Following Nephrectomy,2018-02-23 08:33:00-05:00,PFE,pfizer says ema has recommended against expanding use of sutent to include adjuvant treatment of adult patients at high risk of rcc following nephrectomy,"{'neg': 0.081, 'neu': 0.849, 'pos': 0.069, 'compound': -0.0772}",neutral,0.9963996410369873
989009,989009,1001151.0,Solid Biosciences Snags Bullish Initiation As It Develops Gene Therapy For Muscular Dystrophy,2018-02-21 09:18:00-05:00,PFE,solid biosciences snags bullish initiation as it develops gene therapy for muscular dystrophy,"{'neg': 0.0, 'neu': 0.882, 'pos': 0.118, 'compound': 0.1531}",negative,0.7415745258331299
989010,989010,1001152.0,Goldman Sachs Gets Firm On Solid Biosciences,2018-02-20 13:25:00-05:00,PFE,goldman sachs gets firm on solid biosciences,"{'neg': 0.0, 'neu': 0.789, 'pos': 0.211, 'compound': 0.1531}",positive,0.9993098974227905
989011,989011,1001153.0,How McKesson Will Stand The Test Of Amazon,2018-02-20 11:06:00-05:00,PFE,how mckesson will stand the test of amazon,"{'neg': 0.0, 'neu': 0.805, 'pos': 0.195, 'compound': 0.1779}",neutral,0.9998548030853271
989012,989012,1001154.0,PreMarket Prep Opening NYSE Imbalance Update: 186k Shares To Sell; MS 60k sell; Twitter 68k Share To Sell; Nike 41k Shares To Sell; Square 41 Shares To Buy; Pfizer 81k Shares To Sell,2018-02-20 08:33:00-05:00,PFE,premarket prep opening nyse imbalance update 186 thousand shares to sell ms 60 thousand sell twitter 68 thousand share to sell nike 41 thousand shares to sell square 41 shares to buy pfizer 81 thousand shares to sell,"{'neg': 0.0, 'neu': 0.75, 'pos': 0.25, 'compound': 0.8402}",neutral,0.9998593330383301
989013,989013,1001155.0,Spark Therapeutics to Manufacture and Deliver SPARK-9001 to Pfizer in a $14M Agreement,2018-02-20 07:56:00-05:00,PFE,spark therapeutics to manufacture and deliver spark 9001 to pfizer in a dollars 4 million agreement,"{'neg': 0.0, 'neu': 0.65, 'pos': 0.35, 'compound': 0.7184}",neutral,0.9998888969421387
989014,989014,1001156.0,Deciphera Pharma Scores A Sell-Side Recommendation,2018-02-16 12:59:00-05:00,PFE,deciphera pharma scores a sell side recommendation,"{'neg': 0.0, 'neu': 1.0, 'pos': 0.0, 'compound': 0.0}",positive,0.9992326498031616
989015,989015,1001157.0,Cramer Looks At The Dow's Biggest Losers,2018-02-14 10:31:00-05:00,PFE,cramer looks at the dows biggest losers,"{'neg': 0.362, 'neu': 0.638, 'pos': 0.0, 'compound': -0.5267}",negative,0.9795721173286438
989016,989016,1001158.0,Pfizer Receives Breakthrough Therapy Designation from FDA for PF-04965842,2018-02-14 08:32:00-05:00,PFE,pfizer receives breakthrough therapy designation from fda for pf 04965842,"{'neg': 0.0, 'neu': 1.0, 'pos': 0.0, 'compound': 0.0}",positive,0.9983841180801392
989017,989017,1001159.0,Premarket Opening NYSE Imbalance Update: Pfizer 217k Shares To Buy; ExxonMobil 176k Shares To Buy; Proctor & Gamble 123k Shares To Buy; General Electric 339k Shares To Buy; American Express 20k Shares To Buy; Boeing 32k Shares To Buy,2018-02-12 08:56:00-05:00,PFE,premarket opening nyse imbalance update pfizer 217 thousand shares to buy exxonmobil 176 thousand shares to buy proctor and gamble 123 thousand shares to buy general electric 339 thousand shares to buy american express 20 thousand shares to buy boeing 32 thousand shares to buy,"{'neg': 0.0, 'neu': 0.747, 'pos': 0.253, 'compound': 0.8807}",neutral,0.9998593330383301
989018,989018,1001160.0,"U.S., EU and Japan Health Authorities Accept Regulatory Submissions for Review of Pfizer's Third-Generation ALK Inhibitor Lorlatinib, U.S. New Drug Application Granted FDA Priority Review",2018-02-12 08:10:00-05:00,PFE,u s eu and japan health authorities accept regulatory submissions for review of pfizers third generation alk inhibitor lorlatinib u s new drug application granted fda priority review,"{'neg': 0.042, 'neu': 0.809, 'pos': 0.149, 'compound': 0.5106}",neutral,0.8801926970481873
989019,989019,1001161.0,Pfizer Announces the FDA Accepted and Granted Priority Review to the Company's NDA for Lorlantinib,2018-02-12 08:03:00-05:00,PFE,pfizer announces the fda accepted and granted priority review to the companys nda for lorlantinib,"{'neg': 0.0, 'neu': 0.76, 'pos': 0.24, 'compound': 0.4767}",positive,0.9917524456977844
989020,989020,1001162.0,The Alzheimer's Drug Pipeline: High Failure Rates In Research On An Increasingly Common Disease,2018-02-08 09:41:00-05:00,PFE,the alzheimers drug pipeline high failure rates in research on an increasingly common disease,"{'neg': 0.202, 'neu': 0.798, 'pos': 0.0, 'compound': -0.5106}",negative,0.9946730732917786
989021,989021,1001163.0,PreMarket Opening NYSE Imbalance Update: Twitter 206k Shares To Buy; Alibaba 60k Shares To Buy; Proctor Gamble 25k Shares Buy; Pfizer 35k Shares To Buy; Ford 71k Shares To Buy; JP Morgan 33k Shares To Buy; Square 63k Shares To Buy,2018-02-08 08:35:00-05:00,PFE,premarket opening nyse imbalance update twitter 206 thousand shares to buy alibaba 60 thousand shares to buy proctor gamble 25 thousand shares buy pfizer 35 thousand shares to buy ford 71 thousand shares to buy jp morgan 33 thousand shares to buy square 63 thousand shares to buy,"{'neg': 0.0, 'neu': 0.699, 'pos': 0.301, 'compound': 0.9217}",neutral,0.9998641014099121
989022,989022,1001164.0,GSK Says ViiV Healthcare Launches New Two-Drug HIV Study,2018-02-08 04:42:00-05:00,PFE,gsk says viiv healthcare launches new two drug hiv study,"{'neg': 0.0, 'neu': 1.0, 'pos': 0.0, 'compound': 0.0}",neutral,0.9991219639778137
989023,989023,1001165.0,Worst Day In 6 Years Offers 8 Great Buying Opportunities,2018-02-06 09:39:00-05:00,PFE,worst day in 6 years offers 8 great buying opportunities,"{'neg': 0.23, 'neu': 0.393, 'pos': 0.376, 'compound': 0.3818}",positive,0.9804461598396301
989024,989024,1001166.0,"Astellas, Pfizer Report Phase 3 PROSPER Trial Shows XTANDI Significantly Reduced Risk Of Metastasis, Death By ~71% In Men With Non-Metastatic Castration-Resistant Prostate Cancer",2018-02-05 17:12:00-05:00,PFE,astellas pfizer report phase 3 prosper trial shows xtandi significantly reduced risk of metastasis death by 71 percent in men with non metastatic castration resistant prostate cancer,"{'neg': 0.302, 'neu': 0.698, 'pos': 0.0, 'compound': -0.886}",positive,0.9996224641799927
989025,989025,1001167.0,"Barclays Maintains Overweight on Pfizer, Raises Price Target to $41.00",2018-01-31 11:50:00-05:00,PFE,barclays maintains overweight on pfizer raises price target to dollars 1.00,"{'neg': 0.2, 'neu': 0.8, 'pos': 0.0, 'compound': -0.3612}",negative,0.9630298018455505
989026,989026,1001168.0,Mid-Afternoon Market Update: Dow Falls Over 300 Points; Callidus Software Shares Rise On Acquisition News,2018-01-30 14:32:00-05:00,PFE,mid afternoon market update dow falls over 300 points callidus software shares rise on acquisition news,"{'neg': 0.0, 'neu': 0.872, 'pos': 0.128, 'compound': 0.296}",positive,0.9993072748184204
989027,989027,1001169.0,"CNBC's Meg Tirrell Tweets 'Spoke w $PFE mgmt team after the call...about gene therapy safety concerns...pointed out none with $PFE $AVXS $ONCE $BMRN studies. Said...surprised Wilson & $SLDB ""didn't have any way to resolve"" concerns [properly]'",2018-01-30 12:48:00-05:00,PFE,cnbcs meg tirrell tweets spoke w pfe mgmt team after the call about gene therapy safety concerns pointed out none with pfe avxs once bmrn studies said surprised wilson and sldb didnt have any way to resolve concerns properly,"{'neg': 0.0, 'neu': 0.831, 'pos': 0.169, 'compound': 0.743}",neutral,0.9504445195198059
989028,989028,1001170.0,Mid-Day Market Update: Crude Oil Down 2%; Thomson Reuters Shares Spike Higher,2018-01-30 12:00:00-05:00,PFE,mid day market update crude oil down 2 percent thomson reuters shares spike higher,"{'neg': 0.207, 'neu': 0.67, 'pos': 0.123, 'compound': -0.3612}",negative,0.996992826461792
989029,989029,1001171.0,Hang On: Rate Fears In Focus As Futures Point Lower After Monday's Big Losses,2018-01-30 10:47:00-05:00,PFE,hang on rate fears in focus as futures point lower after mondays big losses,"{'neg': 0.412, 'neu': 0.588, 'pos': 0.0, 'compound': -0.7717}",negative,0.7133150696754456
989030,989030,1001172.0,From Pfizer Q4 Earnings Conference Call: Co. To Repatriate Majority Of Its Overseas Cash During '18,2018-01-30 10:36:00-05:00,PFE,from pfizer fourth quarter earnings conference call co to repatriate majority of its overseas cash during 18,"{'neg': 0.0, 'neu': 1.0, 'pos': 0.0, 'compound': 0.0}",neutral,0.9997298121452332
989031,989031,1001173.0,Mid-Morning Market Update: Markets Open Lower; Pfizer Beats Q4 Expectations,2018-01-30 10:18:00-05:00,PFE,mid morning market update markets open lower pfizer beats fourth quarter expectations,"{'neg': 0.167, 'neu': 0.833, 'pos': 0.0, 'compound': -0.296}",negative,0.998380184173584
989032,989032,1001174.0,Benzinga Pro's 7 Stocks To Watch Today,2018-01-30 09:19:00-05:00,PFE,benzinga pros 7 stocks to watch today,"{'neg': 0.0, 'neu': 1.0, 'pos': 0.0, 'compound': 0.0}",neutral,0.9998375177383423
989033,989033,1001175.0,PreMarket Opening NYSE Imbalance Update: Coke 104k Shares To Sell; JP Morgan 111k To Sell; BofA 260k To Sell; Pfizer 361k to Sell; CVS 28k To Sell; Alibaba 86k To Sell; Juniper 33k To Sell; Twitter 95k To Buy,2018-01-30 09:11:00-05:00,PFE,premarket opening nyse imbalance update coke 104 thousand shares to sell jp morgan 111 thousand to sell bofa 260 thousand to sell pfizer 361 thousand to sell cvs 28 thousand to sell alibaba 86 thousand to sell juniper 33 thousand to sell twitter 95 thousand to buy,"{'neg': 0.051, 'neu': 0.87, 'pos': 0.079, 'compound': 0.1027}",neutral,0.9998722076416016
989034,989034,1001176.0,A Peek Into The Markets: U.S. Stock Futures Tumble Ahead Of Fed Meeting,2018-01-30 07:01:00-05:00,PFE,a peek into the markets u s stock futures tumble ahead of fed meeting,"{'neg': 0.0, 'neu': 1.0, 'pos': 0.0, 'compound': 0.0}",negative,0.9930523633956909
989035,989035,1001177.0,"Pfizer Sees FY18 Adj. EPS $2.90 to $3.00 vs $2.78 Est., Sales $53.5B to $55.5B vs $53.9B Est.",2018-01-30 06:49:00-05:00,PFE,pfizer sees fy18 adj eps dollars .90 to dollars .00 vs dollars .78 est sales dollars 3.5 billion to dollars 5.5 billion vs dollars 3.9 billion est,"{'neg': 0.0, 'neu': 1.0, 'pos': 0.0, 'compound': 0.0}",neutral,0.9998725652694702
989036,989036,1001178.0,"Pfizer Reports Q4 Adj. EPS $0.62 vs $0.56 Est., Sales $13.70B vs $13.68B Est.",2018-01-30 06:48:00-05:00,PFE,pfizer reports fourth quarter adj eps dollars .62 vs dollars .56 est sales dollars 3.70 billion vs dollars 3.68 billion est,"{'neg': 0.0, 'neu': 1.0, 'pos': 0.0, 'compound': 0.0}",neutral,0.999876856803894
989037,989037,1001179.0,"10 Stocks To Watch For January 30, 2018",2018-01-30 04:24:00-05:00,PFE,10 stocks to watch for january 30 2018,"{'neg': 0.0, 'neu': 1.0, 'pos': 0.0, 'compound': 0.0}",neutral,0.9998608827590942
989038,989038,1001180.0,"Earnings Scheduled For January 30, 2018",2018-01-30 04:02:00-05:00,PFE,earnings scheduled for january 30 2018,"{'neg': 0.0, 'neu': 1.0, 'pos': 0.0, 'compound': 0.0}",neutral,0.9998809099197388
989039,989039,1001181.0,"The Week Ahead: Big Tech Earnings, Fed Rate Decision Likely To Dominate Headlines",2018-01-29 14:45:00-05:00,PFE,the week ahead big tech earnings fed rate decision likely to dominate headlines,"{'neg': 0.111, 'neu': 0.889, 'pos': 0.0, 'compound': -0.128}",neutral,0.9933607578277588
989040,989040,1001182.0,"PFE, LLY, MRK Write Up 'Scripts For Q4",2018-01-29 10:52:00-05:00,PFE,pfe lly mrk write up scripts for fourth quarter,"{'neg': 0.0, 'neu': 1.0, 'pos': 0.0, 'compound': 0.0}",neutral,0.9998632669448853
989041,989041,1001183.0,"Fed, Earnings Are Meaty Filling Between Slices Of Job, Price Data",2018-01-29 09:55:00-05:00,PFE,fed earnings are meaty filling between slices of job price data,"{'neg': 0.0, 'neu': 1.0, 'pos': 0.0, 'compound': 0.0}",neutral,0.9998778104782104
989042,989042,1001184.0,"J&J No Longer Candidate For Purchase Of Pfizer's Consumer Unit; GlaxoSmithKline, Reckitt Benickser Working With Banks To Make A Bid",2018-01-25 09:34:00-05:00,PFE,j and j no longer candidate for purchase of pfizers consumer unit glaxosmithkline reckitt benickser working with banks to make a bid,"{'neg': 0.095, 'neu': 0.905, 'pos': 0.0, 'compound': -0.296}",neutral,0.9996174573898315
989043,989043,1001185.0,Pfizer Reports Top-Line Results For Potential Biosimilar To Rituxan/MabThera: REFLECTIONS B3281006 Study Showed 'Equivalence in Patients with Indolent Follicular Lymphoma',2018-01-24 08:31:00-05:00,PFE,pfizer reports top line results for potential biosimilar to rituxan and mabthera reflections b3281006 study showed equivalence in patients with indolent follicular lymphoma,"{'neg': 0.0, 'neu': 0.924, 'pos': 0.076, 'compound': 0.2023}",positive,0.9336548447608948
989044,989044,1001186.0,"Ford Earnings Preview: After Last Week's Wall Street Presentation, Not Much New Expected",2018-01-23 11:20:00-05:00,PFE,ford earnings preview after last weeks wall street presentation not much new expected,"{'neg': 0.0, 'neu': 1.0, 'pos': 0.0, 'compound': 0.0}",neutral,0.9997784495353699
989045,989045,1001187.0,Biotech M&A Off To A Strong Start In 2018: More Deals To Follow?,2018-01-23 10:58:00-05:00,PFE,biotech m and a off to a strong start in 2018 more deals to follow,"{'neg': 0.0, 'neu': 0.809, 'pos': 0.191, 'compound': 0.5106}",positive,0.999352753162384
989046,989046,1001188.0,"J&J Shares Unaffected Amid Word US Appeals Court Invalidated Co. Patent On Remicade, Ruling Prevents Co. From Challenging Pfizer's '16 Launch Of Cheaper Version Of Remicade",2018-01-23 10:41:00-05:00,PFE,j and j shares unaffected amid word us appeals court invalidated co patent on remicade ruling prevents co from challenging pfizers 16 launch of cheaper version of remicade,"{'neg': 0.0, 'neu': 0.831, 'pos': 0.169, 'compound': 0.4767}",negative,0.7854952216148376
989047,989047,1001189.0,A CURE For The Typical Healthcare Trade,2018-01-22 16:55:00-05:00,PFE,a cure for the typical healthcare trade,"{'neg': 0.0, 'neu': 1.0, 'pos': 0.0, 'compound': 0.0}",neutral,0.9998216032981873
989048,989048,1001190.0,The Top 10 Value Stocks In The S&P 500,2018-01-19 13:12:00-05:00,PFE,the top 10 value stocks in the SP500 500,"{'neg': 0.0, 'neu': 0.625, 'pos': 0.375, 'compound': 0.4939}",neutral,0.9998912811279297
989049,989049,1001191.0,Pfizer Partners with Foundation Medicine to Develop Companion Diagnostics for its Oncology Portfolio,2018-01-16 07:07:00-05:00,PFE,pfizer partners with foundation medicine to develop companion diagnostics for its oncology portfolio,"{'neg': 0.0, 'neu': 1.0, 'pos': 0.0, 'compound': 0.0}",neutral,0.9997884631156921
989050,989050,1001192.0,A Strategy That Beat The S&P 500: Here Are Your 2018 'Dogs Of The Dow',2018-01-11 17:14:00-05:00,PFE,a strategy that beat the SP500 500 here are your 2018 dogs of the dow,"{'neg': 0.0, 'neu': 1.0, 'pos': 0.0, 'compound': 0.0}",neutral,0.9998757839202881
989051,989051,1001193.0,Key Takeaways From The J.P. Morgan Healthcare Conference,2018-01-11 12:06:00-05:00,PFE,key takeaways from the j p morgan healthcare conference,"{'neg': 0.0, 'neu': 1.0, 'pos': 0.0, 'compound': 0.0}",neutral,0.9998871088027954
989052,989052,1001194.0,Basilea Announces Completion of License Agreement Extension With Pfizer for Antifungal Cresemba for China and Asia Pacific,2018-01-10 04:01:00-05:00,PFE,basilea announces completion of license agreement extension with pfizer for antifungal cresemba for china and asia pacific,"{'neg': 0.0, 'neu': 0.833, 'pos': 0.167, 'compound': 0.4939}",positive,0.9994550347328186
989053,989053,1001195.0,Vetr Crowd Upgrades Pfizer To Buy,2018-01-09 17:47:00-05:00,PFE,vetr crowd upgrades pfizer to buy,"{'neg': 0.0, 'neu': 1.0, 'pos': 0.0, 'compound': 0.0}",positive,0.9718464016914368
989054,989054,1001196.0,"GSK CEO On Pfizer Consumer Business, We Don't Need It, Wouldn't Overpay For It",2018-01-09 14:08:00-05:00,PFE,gsk ceo on pfizer consumer business we dont need it wouldnt overpay for it,"{'neg': 0.0, 'neu': 1.0, 'pos': 0.0, 'compound': 0.0}",neutral,0.9997901320457458
989055,989055,1001197.0,Alzheimer's Takes Another Hit As Pfizer Ends Research In The Area,2018-01-08 12:22:00-05:00,PFE,alzheimers takes another hit as pfizer ends research in the area,"{'neg': 0.0, 'neu': 1.0, 'pos': 0.0, 'compound': 0.0}",negative,0.996764063835144
989056,989056,1001198.0,"JP Morgan Healthcare Conference Begins Today, Presenters Include: Gilead, Illumina, Seattle Genetics, Biogen, Incyte, Baxter, Regeneron, Walgreens, Alnylam, Edwards Lifesciences, Molina, Alexion, Celgene, Pfizer, Neurocrine Biosciences, and Jazz Pharma",2018-01-08 09:00:00-05:00,PFE,jp morgan healthcare conference begins today presenters include gilead illumina seattle genetics biogen incyte baxter regeneron walgreens alnylam edwards lifesciences molina alexion celgene pfizer neurocrine biosciences and jazz pharma,"{'neg': 0.0, 'neu': 0.94, 'pos': 0.06, 'compound': 0.2023}",neutral,0.9998767375946045
989057,989057,1001199.0,"Argus Shares Eli Lilly's Optimism, Upgrades To Buy",2018-01-05 13:54:00-05:00,PFE,argus shares eli lillys optimism upgrades to buy,"{'neg': 0.0, 'neu': 0.513, 'pos': 0.487, 'compound': 0.6908}",positive,0.9996384382247925
989058,989058,1001200.0,The 'Bomb Cyclone' Portfolio: Winners And Losers,2018-01-05 11:58:00-05:00,PFE,the bomb cyclone portfolio winners and losers,"{'neg': 0.482, 'neu': 0.292, 'pos': 0.226, 'compound': -0.5423}",neutral,0.9998233914375305
989059,989059,1001201.0,Arvinas Announces Research Collaboration and License Agreement with Pfizer for the Discovery and Development of Protein Degradation Drug Candidates,2018-01-04 03:59:00-05:00,PFE,arvinas announces research collaboration and license agreement with pfizer for the discovery and development of protein degradation drug candidates,"{'neg': 0.144, 'neu': 0.72, 'pos': 0.136, 'compound': -0.0516}",positive,0.9987886548042297
989060,989060,1001202.0,"The Market In 5 Minutes: South Korea Cracks Down On Crypto, Tim Cook's Big Payday, Jobless Claims Steady",2017-12-28 09:12:00-05:00,PFE,the market in 5 minutes south korea cracks down on crypto tim cooks big payday jobless claims steady,"{'neg': 0.0, 'neu': 1.0, 'pos': 0.0, 'compound': 0.0}",negative,0.9977070093154907
989061,989061,1001203.0,"Merck Shares Down 0.12%, Pfizer Shares Up 0.11%; Earlier Companies Together Announced FDA Approvla For Their Collaboration Treatment STEGLATRO, STEGLUJAN and SEGLUROMET",2017-12-26 15:48:00-05:00,PFE,merck shares down 0.12 percent pfizer shares up 0.11 percent earlier companies together announced fda approvla for their collaboration treatment steglatro steglujan and segluromet,"{'neg': 0.0, 'neu': 0.833, 'pos': 0.167, 'compound': 0.5267}",negative,0.9985906481742859
989062,989062,1001204.0,Merck's Diabetes Drugs Get FDA Nod As Adjunct Therapies,2017-12-26 12:45:00-05:00,PFE,mercks diabetes drugs get fda nod as adjunct therapies,"{'neg': 0.0, 'neu': 1.0, 'pos': 0.0, 'compound': 0.0}",neutral,0.9997995495796204
989063,989063,1001205.0,The Companies That Led 2017's Biotech Rally,2017-12-22 09:50:00-05:00,PFE,the companies that led 2017 biotech rally,"{'neg': 0.0, 'neu': 1.0, 'pos': 0.0, 'compound': 0.0}",neutral,0.9998306035995483
989064,989064,1001206.0,Merck Reports FDA Granted Breakthrough Therapy Designation For Avelumab In Combo With INLYTA In Advanced Renal Cell Carcinoma,2017-12-21 13:01:00-05:00,PFE,merck reports fda granted breakthrough therapy designation for avelumab in combo with inlyta in advanced renal cell carcinoma,"{'neg': 0.0, 'neu': 0.8, 'pos': 0.2, 'compound': 0.4588}",positive,0.9995386600494385
989065,989065,1001207.0,Shares of Pfizer Down 0.88% On Negative Article From The Daily Mail On Chantix,2017-12-20 14:24:00-05:00,PFE,shares of pfizer down 0.88 percent on negative article from the daily mail on chantix,"{'neg': 0.196, 'neu': 0.688, 'pos': 0.116, 'compound': -0.3612}",negative,0.9985809326171875
989066,989066,1001208.0,Pfizer Reports FDA Approved Co.'s BOSULIF For Treatment Of Patients With Newly-Diagnosed Ph+ CML,2017-12-19 16:12:00-05:00,PFE,pfizer reports fda approved co s bosulif for treatment of patients with newly diagnosed ph cml,"{'neg': 0.0, 'neu': 0.843, 'pos': 0.157, 'compound': 0.4215}",positive,0.9985176920890808
989067,989067,1001209.0,Pfizer Raises Qtr. Dividend From $0.32 To $0.34/Share,2017-12-18 11:45:00-05:00,PFE,pfizer raises qtr dividend from dollars .32 to dollars,"{'neg': 0.0, 'neu': 1.0, 'pos': 0.0, 'compound': 0.0}",positive,0.9990643858909607
989068,989068,1001210.0,Pfizer Reports $10B Buyback Plan,2017-12-18 11:44:00-05:00,PFE,pfizer reports dollars 0 billion buyback plan,"{'neg': 0.0, 'neu': 1.0, 'pos': 0.0, 'compound': 0.0}",neutral,0.9982548356056213
989069,989069,1001211.0,"Lightning Round: Jim Cramer Shares His Thoughts On T-Mobile, Electronic Arts, And More",2017-12-15 07:33:00-05:00,PFE,lightning round jim cramer shares his thoughts on t mobile electronic arts and more,"{'neg': 0.0, 'neu': 0.855, 'pos': 0.145, 'compound': 0.296}",neutral,0.9998836517333984
989070,989070,1001212.0,Pfizer Announces FDA Approval of XELJANZ and XELJANZ XR for the Treatment of Active Psoriatic Arthritis,2017-12-15 06:25:00-05:00,PFE,pfizer announces fda approval of xeljanz and xeljanz xr for the treatment of active psoriatic arthritis,"{'neg': 0.0, 'neu': 0.707, 'pos': 0.293, 'compound': 0.7003}",positive,0.9990540146827698
989071,989071,1001213.0,"STAT News' Adam Feuerstein Responds To Tweet Highlighting '$PFE $AGN rumor - no source': 'The other day I heard $PFE for $BMY,' 'Also $ABBV for $BMY'",2017-12-14 10:05:00-05:00,PFE,stat news adam feuerstein responds to tweet highlighting pfe agn rumor to no source the other day i heard pfe for bmy also abbv for bmy,"{'neg': 0.081, 'neu': 0.919, 'pos': 0.0, 'compound': -0.296}",neutral,0.9998086094856262
989072,989072,1001214.0,Pfizer Reports Initiation Of Phase 3 Program For PF-04965842 For Moderate-To-Severe Atopic Dermatitis,2017-12-14 07:38:00-05:00,PFE,pfizer reports initiation of phase 3 program for pf 04965842 for moderate to severe atopic dermatitis,"{'neg': 0.148, 'neu': 0.852, 'pos': 0.0, 'compound': -0.3818}",neutral,0.9998540878295898
989073,989073,1001215.0,Pfizer Reports FDA Approved New Biosimilar Medicine IXIFI,2017-12-13 18:05:00-05:00,PFE,pfizer reports fda approved new biosimilar medicine ixifi,"{'neg': 0.0, 'neu': 0.714, 'pos': 0.286, 'compound': 0.4215}",positive,0.9989649057388306
989074,989074,1001216.0,Pfizer Reports Phase 3 TRUMENBA Data Published In NEJM Showed All 5 Co-Primary Immunogenicity Endpoints Were Met,2017-12-13 17:08:00-05:00,PFE,pfizer reports phase 3 trumenba data published in nejm showed all 5 co primary immunogenicity endpoints were met,"{'neg': 0.0, 'neu': 1.0, 'pos': 0.0, 'compound': 0.0}",neutral,0.9998747110366821
989075,989075,1001217.0,PreMarket Opening NYSE Imbalance Update: AT&T 168k Shares To Sell; Nike 54k Shares To Sell; Square 33k To Buy; Disney 41k To Buy; US Steel 53k Shares To Sell; Pfizer 50k Shares To Sell; Merck 28k Shares To Buy;,2017-12-13 09:06:00-05:00,PFE,premarket opening nyse imbalance update at and t 168 thousand shares to sell nike 54 thousand shares to sell square 33 thousand to buy disney 41 thousand to buy us steel 53 thousand shares to sell pfizer 50 thousand shares to sell merck 28 thousand shares to buy,"{'neg': 0.0, 'neu': 0.796, 'pos': 0.204, 'compound': 0.8402}",neutral,0.9998780488967896
