,Unnamed: 0.1,Unnamed: 0,title,date,stock,Text_Cleaned,Score,label,score
558171,558171,568944.0,Google Will Buy Fitbit For $2.1B,2019-11-01 09:23:00-04:00,GOOG,google will buy fitbit for dollars .1 billion,"{'neg': 0.0, 'neu': 1.0, 'pos': 0.0, 'compound': 0.0}",neutral,0.999880313873291
558172,558172,568945.0,Fitbit To Be Acquired By Google At $7.35/Share In Cash,2019-11-01 09:00:00-04:00,GOOG,fitbit to be acquired by google at dollars . in cash,"{'neg': 0.0, 'neu': 1.0, 'pos': 0.0, 'compound': 0.0}",neutral,0.9998841285705566
558173,558173,568946.0,"Court Filing Shows Google, Alphabet Have Sued Texas State Attorney General To Ensure Protection For Confidential Business Info",2019-10-31 14:43:00-04:00,GOOG,court filing shows google alphabet have sued texas state attorney general to ensure protection for confidential business info,"{'neg': 0.0, 'neu': 0.867, 'pos': 0.133, 'compound': 0.3818}",neutral,0.9981968998908997
558174,558174,568947.0,"With China Trade Back In Focus, Strong Earnings From Apple, Facebook Blunt The Blow",2019-10-31 10:00:00-04:00,GOOG,with china trade back in focus strong earnings from apple facebook blunt the blow,"{'neg': 0.0, 'neu': 0.798, 'pos': 0.202, 'compound': 0.5106}",positive,0.9996566772460938
558175,558175,568948.0,"Decision Day: Fed On Tap Later, Followed by Apple, Facebook After Close",2019-10-30 09:52:00-04:00,GOOG,decision day fed on tap later followed by apple facebook after close,"{'neg': 0.0, 'neu': 1.0, 'pos': 0.0, 'compound': 0.0}",neutral,0.9998611211776733
558176,558176,568949.0,"SiriusXM Reports Will Now Be Available On Google Nest Smart Speakers, Displays Via Google Assistant, No Terms Disclosed",2019-10-30 09:04:00-04:00,GOOG,siriusxm reports will now be available on google nest smart speakers displays via google assistant no terms disclosed,"{'neg': 0.105, 'neu': 0.766, 'pos': 0.129, 'compound': 0.128}",neutral,0.9999001026153564
558177,558177,568950.0,Sony To Shutter PlayStation Vue Amid 'Competitive Pay TV Industry',2019-10-29 17:36:00-04:00,GOOG,sony to shutter playstation vue amid competitive pay tv industry,"{'neg': 0.126, 'neu': 0.721, 'pos': 0.153, 'compound': 0.0772}",negative,0.9868553280830383
558178,558178,568951.0,PreMarket Prep: Buy The Dip Still Working,2019-10-29 14:09:00-04:00,GOOG,premarket prep buy the dip still working,"{'neg': 0.0, 'neu': 1.0, 'pos': 0.0, 'compound': 0.0}",neutral,0.9998123049736023
558179,558179,568952.0,'Fast Money' Picks For October 29,2019-10-29 12:08:00-04:00,GOOG,fast money picks for october 29,"{'neg': 0.0, 'neu': 1.0, 'pos': 0.0, 'compound': 0.0}",neutral,0.9998759031295776
558180,558180,568953.0,Cramer: $10B Pentagon Contract Validates Microsoft's Cloud Business,2019-10-29 12:05:00-04:00,GOOG,cramer dollars 0 billion pentagon contract validates microsofts cloud business,"{'neg': 0.0, 'neu': 0.789, 'pos': 0.211, 'compound': 0.34}",positive,0.9968309998512268
558181,558181,568954.0,"UBS Maintains Buy on Alphabet, Raises Price Target to $1,460",2019-10-29 11:49:00-04:00,GOOG,ubs maintains buy on alphabet raises price target to dollars 460,"{'neg': 0.0, 'neu': 1.0, 'pos': 0.0, 'compound': 0.0}",positive,0.9995468258857727
558182,558182,568955.0,The Head Of Fidelity Institutional Outlines The 4 Macro Trends Taking Over Financial Services Right Now,2019-10-29 11:35:00-04:00,GOOG,the head of fidelity institutional outlines the 4 macro trends taking over financial services right now,"{'neg': 0.0, 'neu': 1.0, 'pos': 0.0, 'compound': 0.0}",neutral,0.999887228012085
558183,558183,568956.0,Hey Google! Sell-Side Sentiment Solid After Alphabet's Q3 Earnings Disappoint,2019-10-29 11:20:00-04:00,GOOG,hey google sell side sentiment solid after alphabets third quarter earnings disappoint,"{'neg': 0.189, 'neu': 0.699, 'pos': 0.112, 'compound': -0.2732}",positive,0.9992793202400208
558184,558184,568957.0,3 Reasons Fitbit Could Be An Attractive M&A Target,2019-10-29 11:10:00-04:00,GOOG,3 reasons fitbit could be an attractive m and a target,"{'neg': 0.0, 'neu': 0.775, 'pos': 0.225, 'compound': 0.4404}",positive,0.9991138577461243
558185,558185,568958.0,"Alphabet Misses On Earnings, But Drugmakers, Mastercard Beat Expectations",2019-10-29 10:45:00-04:00,GOOG,alphabet misses on earnings but drugmakers mastercard beat expectations,"{'neg': 0.153, 'neu': 0.847, 'pos': 0.0, 'compound': -0.1154}",negative,0.9956865906715393
558186,558186,568959.0,"Deutsche Bank Maintains Buy on Alphabet, Lowers Price Target to $1,550",2019-10-29 10:17:00-04:00,GOOG,deutsche bank maintains buy on alphabet lowers price target to dollars 550,"{'neg': 0.12, 'neu': 0.88, 'pos': 0.0, 'compound': -0.128}",positive,0.999366819858551
558187,558187,568960.0,10 Biggest Price Target Changes For Tuesday,2019-10-29 08:50:00-04:00,GOOG,10 biggest price target changes for tuesday,"{'neg': 0.0, 'neu': 1.0, 'pos': 0.0, 'compound': 0.0}",neutral,0.999796450138092
558188,558188,568961.0,"Raymond James Maintains Outperform on Alphabet, Raises Price Target to $1,475",2019-10-29 07:58:00-04:00,GOOG,raymond james maintains outperform on alphabet raises price target to dollars 475,"{'neg': 0.0, 'neu': 1.0, 'pos': 0.0, 'compound': 0.0}",positive,0.9996696710586548
558189,558189,568962.0,A Peek Into The Markets: US Stock Futures Mostly Lower Ahead Of Fed Meeting,2019-10-29 06:30:00-04:00,GOOG,a peek into the markets us stock futures mostly lower ahead of fed meeting,"{'neg': 0.145, 'neu': 0.855, 'pos': 0.0, 'compound': -0.296}",negative,0.9937362670898438
558190,558190,568963.0,"12 Stocks To Watch For October 29, 2019",2019-10-29 05:23:00-04:00,GOOG,12 stocks to watch for october 29 2019,"{'neg': 0.0, 'neu': 1.0, 'pos': 0.0, 'compound': 0.0}",neutral,0.999876856803894
558191,558191,568964.0,Australia's ACCC Says Google Allegedly Misled Consumers on Collection and Use of Location Data,2019-10-29 03:48:00-04:00,GOOG,australias accc says google allegedly misled consumers on collection and use of location data,"{'neg': 0.0, 'neu': 1.0, 'pos': 0.0, 'compound': 0.0}",negative,0.7736198902130127
558192,558192,568965.0,'Validation Of The City And Region's Exciting Momentum': Dan Gilbert's Rocket Mortgage Brings Forbes' Under 30 Summit To Detroit,2019-10-28 19:02:00-04:00,GOOG,validation of the city and regions exciting momentum dan gilberts rocket mortgage brings forbes under 30 summit to detroit,"{'neg': 0.0, 'neu': 0.849, 'pos': 0.151, 'compound': 0.4939}",positive,0.9995129108428955
558193,558193,568966.0,5 Stocks Moving In Monday's After-Hours Session,2019-10-28 17:54:00-04:00,GOOG,5 stocks moving in mondays after hours session,"{'neg': 0.0, 'neu': 1.0, 'pos': 0.0, 'compound': 0.0}",neutral,0.9998520612716675
558194,558194,568967.0,Alphabet shares are trading lower after the company reported Q3 EPS of $10.12 versus the $12.38 estimate.,2019-10-28 16:24:00-04:00,GOOG,alphabet shares are trading lower after the company reported third quarter eps of dollars 0.12 versus the dollars 2.38 estimate,"{'neg': 0.098, 'neu': 0.804, 'pos': 0.098, 'compound': 0.0}",negative,0.9982966780662537
558195,558195,568968.0,Alphabet Shares Fall On Q3 Earnings,2019-10-28 16:15:00-04:00,GOOG,alphabet shares fall on third quarter earnings,"{'neg': 0.0, 'neu': 0.732, 'pos': 0.268, 'compound': 0.296}",negative,0.9983946681022644
558196,558196,568969.0,"Alphabet Q3 EPS $10.12 May Not Compare To $12.38 Estimate, Sales $40.499B Beat $40.32B Estimate",2019-10-28 16:05:00-04:00,GOOG,alphabet third quarter eps dollars 0.12 may not compare to dollars 2.38 estimate sales dollars 0.499 billion beat dollars 0.32 billion estimate,"{'neg': 0.0, 'neu': 1.0, 'pos': 0.0, 'compound': 0.0}",neutral,0.9989572763442993
558197,558197,568970.0,"Alphabet shares are trading higher ahead of the company's Q3 earnings report, which is expected to be released after the close today.",2019-10-28 14:41:00-04:00,GOOG,alphabet shares are trading higher ahead of the companys third quarter earnings report which is expected to be released after the close today,"{'neg': 0.0, 'neu': 0.909, 'pos': 0.091, 'compound': 0.296}",positive,0.9995766282081604
558198,558198,568971.0,"UPDATE: Alphabet Held Secret 'Logistics Summit' With Representatives From FedEx, Other Shipping Cos.",2019-10-28 14:30:00-04:00,GOOG,update alphabet held secret logistics summit with representatives from fedex other shipping cos,"{'neg': 0.0, 'neu': 1.0, 'pos': 0.0, 'compound': 0.0}",neutral,0.9998809099197388
558199,558199,568972.0,FedEx Shares Volatile As Hearing Google Held Secret Meetings With Representatives From FedEx,2019-10-28 14:27:00-04:00,GOOG,fedex shares volatile as hearing google held secret meetings with representatives from fedex,"{'neg': 0.0, 'neu': 0.845, 'pos': 0.155, 'compound': 0.296}",negative,0.9959949254989624
558200,558200,568973.0,Report: Google Looking To Acquire Fitbit,2019-10-28 12:19:00-04:00,GOOG,report google looking to acquire fitbit,"{'neg': 0.0, 'neu': 1.0, 'pos': 0.0, 'compound': 0.0}",neutral,0.9997180104255676
558201,558201,568974.0,More Earnings And A Fed Decision In Week Four Of The WeTrader Competition,2019-10-28 11:56:00-04:00,GOOG,more earnings and a fed decision in week four of the wetrader competition,"{'neg': 0.0, 'neu': 1.0, 'pos': 0.0, 'compound': 0.0}",neutral,0.9945381283760071
558202,558202,568975.0,"Fitbit Shares Resume Trade, Continue Higher, Now Up 29%",2019-10-28 11:52:00-04:00,GOOG,fitbit shares resume trade continue higher now up 29 percent,"{'neg': 0.0, 'neu': 0.804, 'pos': 0.196, 'compound': 0.296}",positive,0.9996734857559204
558203,558203,568976.0,Apple Shares Tick Very Slightly Lower (~0.1-0.2%) Following Report Alphabet Made Offer To Buy Fitbit,2019-10-28 11:50:00-04:00,GOOG,apple shares tick very slightly lower 0.1 to 0.2 percent following report alphabet made offer to buy fitbit,"{'neg': 0.107, 'neu': 0.785, 'pos': 0.108, 'compound': 0.0038}",negative,0.9983581900596619
558204,558204,568977.0,"Fitbit Shares Halted On Circuit Breaker, Up 18.6%, As Hearing Alphabat Made Offer To Buy Co.",2019-10-28 11:47:00-04:00,GOOG,fitbit shares halted on circuit breaker up 18.6 percent as hearing alphabat made offer to buy co,"{'neg': 0.0, 'neu': 0.879, 'pos': 0.121, 'compound': 0.296}",positive,0.9996310472488403
558205,558205,568978.0,Stocks That Hit 52-Week Highs On Monday,2019-10-28 10:51:00-04:00,GOOG,stocks that hit 52 week highs on monday,"{'neg': 0.0, 'neu': 1.0, 'pos': 0.0, 'compound': 0.0}",positive,0.9939233660697937
558206,558206,568979.0,"Another Bonanza Earnings Week As Apple Looms, With Fed, Payrolls Also On Weekly Agenda",2019-10-28 10:09:00-04:00,GOOG,another bonanza earnings week as apple looms with fed payrolls also on weekly agenda,"{'neg': 0.11, 'neu': 0.89, 'pos': 0.0, 'compound': -0.1531}",positive,0.9976363182067871
558207,558207,568980.0,Bloomberg Reports Apple is Hiring a Team to Bolster its Smart Home Devices,2019-10-28 07:44:00-04:00,GOOG,bloomberg reports apple is hiring a team to bolster its smart home devices,"{'neg': 0.0, 'neu': 0.816, 'pos': 0.184, 'compound': 0.4019}",positive,0.9911291599273682
558208,558208,568981.0,"9 Stocks To Watch For October 28, 2019",2019-10-28 05:05:00-04:00,GOOG,9 stocks to watch for october 28 2019,"{'neg': 0.0, 'neu': 1.0, 'pos': 0.0, 'compound': 0.0}",neutral,0.9998624324798584
558209,558209,568982.0,"Earnings Scheduled For October 28, 2019",2019-10-28 04:09:00-04:00,GOOG,earnings scheduled for october 28 2019,"{'neg': 0.0, 'neu': 1.0, 'pos': 0.0, 'compound': 0.0}",neutral,0.9998819828033447
558210,558210,568983.0,WeTrader Competition: Round Three Wrap-up,2019-10-25 16:03:00-04:00,GOOG,wetrader competition round three wrap up,"{'neg': 0.0, 'neu': 1.0, 'pos': 0.0, 'compound': 0.0}",neutral,0.9998502731323242
558211,558211,568984.0,"Ad Revenue, Cloud, Traffic Volume All In Focus As Alphabet Unveils Q3 Results",2019-10-25 13:35:00-04:00,GOOG,ad revenue cloud traffic volume all in focus as alphabet unveils third quarter results,"{'neg': 0.0, 'neu': 1.0, 'pos': 0.0, 'compound': 0.0}",neutral,0.9998576641082764
558212,558212,568985.0,Faster Internet = Bigger Paycheck?,2019-10-25 13:03:00-04:00,GOOG,faster internet equals bigger paycheck,"{'neg': 0.0, 'neu': 1.0, 'pos': 0.0, 'compound': 0.0}",positive,0.5784052014350891
558213,558213,568986.0,Will Netflix Inc Remain A FAA(N)G Stock?,2019-10-24 11:04:00-04:00,GOOG,will netflix inc remain a faang stock,"{'neg': 0.0, 'neu': 1.0, 'pos': 0.0, 'compound': 0.0}",neutral,0.9998737573623657
558214,558214,568987.0,Google Announces Changes to Search Engine 'Choice Screen' On Android Phones In EU,2019-10-23 12:51:00-04:00,GOOG,google announces changes to search engine choice screen on android phones in eu,"{'neg': 0.0, 'neu': 1.0, 'pos': 0.0, 'compound': 0.0}",neutral,0.99980229139328
558215,558215,568988.0,"Credit Suisse Maintains Outperform on Alphabet, Raises Price Target to $1.7K",2019-10-23 08:59:00-04:00,GOOG,credit suisse maintains outperform on alphabet raises price target to dollars .7 thousand,"{'neg': 0.0, 'neu': 0.822, 'pos': 0.178, 'compound': 0.3818}",positive,0.9996788501739502
558216,558216,568989.0,Google's Antitrust Probe Meeting Reportedly To Take Place Next Month,2019-10-23 04:09:00-04:00,GOOG,googles antitrust probe meeting reportedly to take place next month,"{'neg': 0.0, 'neu': 1.0, 'pos': 0.0, 'compound': 0.0}",neutral,0.9998596906661987
558217,558217,568990.0,More US State Attorneys General Join Facebook Antitrust Probe,2019-10-23 02:02:00-04:00,GOOG,more us state attorneys general join facebook antitrust probe,"{'neg': 0.0, 'neu': 0.784, 'pos': 0.216, 'compound': 0.296}",neutral,0.9998539686203003
558218,558218,568991.0,U.S. State AG's Probing Antitrust Concerns at Google Plan to Meet Next Month in Colorado to Discuss Investigation,2019-10-22 18:56:00-04:00,GOOG,u s state ags probing antitrust concerns at google plan to meet next month in colorado to discuss investigation,"{'neg': 0.0, 'neu': 1.0, 'pos': 0.0, 'compound': 0.0}",neutral,0.9998328685760498
558219,558219,568992.0,"KeyBanc Notes 'Despite signs of softness from large ad agencies, we believe ad spending across the major internet platforms remained healthy in 3Q'; Firm Maintains Overweight, $1,516 Target On Alphabet; Maintains Overweight, $240 Target On Facebook",2019-10-22 11:32:00-04:00,GOOG,keybanc notes despite signs of softness from large ad agencies we believe ad spending across the major internet platforms remained healthy in third quarter firm maintains overweight dollars 516 target on alphabet maintains overweight dollars 40 target on facebook,"{'neg': 0.114, 'neu': 0.824, 'pos': 0.062, 'compound': -0.3182}",positive,0.9996009469032288
558220,558220,568993.0,"Options Trader Danielle Shay On Increasing Awareness, Opportunity In the Markets",2019-10-22 08:30:00-04:00,GOOG,options trader danielle shay on increasing awareness opportunity in the markets,"{'neg': 0.0, 'neu': 0.781, 'pos': 0.219, 'compound': 0.4215}",positive,0.99935382604599
558221,558221,568994.0,Google Names Javier Soltero VP For G Suite Productivity Apps,2019-10-21 14:11:00-04:00,GOOG,google names javier soltero vp for g suite productivity apps,"{'neg': 0.0, 'neu': 1.0, 'pos': 0.0, 'compound': 0.0}",neutral,0.9998785257339478
558222,558222,568995.0,"Veem Leverages Blockchain, Bitcoin In Global Payments Space",2019-10-21 12:29:00-04:00,GOOG,veem leverages blockchain bitcoin in global payments space,"{'neg': 0.0, 'neu': 1.0, 'pos': 0.0, 'compound': 0.0}",neutral,0.9994113445281982
558223,558223,568996.0,Today's Pick-Up: Sunrise May Not Be Seen Until 2023,2019-10-21 12:17:00-04:00,GOOG,todays pick up sunrise may not be seen until 2023,"{'neg': 0.0, 'neu': 1.0, 'pos': 0.0, 'compound': 0.0}",neutral,0.9998685121536255
558224,558224,568997.0,Cramer: Is FAAMG The New FAANG?,2019-10-21 11:11:00-04:00,GOOG,cramer is faamg the new faang,"{'neg': 0.0, 'neu': 1.0, 'pos': 0.0, 'compound': 0.0}",neutral,0.9998856782913208
558225,558225,568998.0,Today's Pickup: Logistics Solutions Boost CBD Pet Products Market,2019-10-18 12:00:00-04:00,GOOG,todays pickup logistics solutions boost cbd pet products market,"{'neg': 0.0, 'neu': 0.614, 'pos': 0.386, 'compound': 0.5267}",positive,0.9995803236961365
558226,558226,568999.0,Public: The Investment App Connecting Millennials With 'One Of The Biggest Drivers Of Prosperity',2019-10-17 16:04:00-04:00,GOOG,public the investment app connecting millennials with one of the biggest drivers of prosperity,"{'neg': 0.0, 'neu': 1.0, 'pos': 0.0, 'compound': 0.0}",neutral,0.9902004599571228
558227,558227,569000.0,Trump Says Not Happy With EU Digital Tax On American Companies,2019-10-16 13:25:00-04:00,GOOG,trump says not happy with eu digital tax on american companies,"{'neg': 0.231, 'neu': 0.769, 'pos': 0.0, 'compound': -0.4585}",negative,0.9887536764144897
558228,558228,569001.0,'Panasonic poaches Google robotic expert for smart-home tech' -Recent Nikkei Article,2019-10-16 13:13:00-04:00,GOOG,panasonic poaches google robotic expert for smart home tech recent nikkei article,"{'neg': 0.0, 'neu': 0.803, 'pos': 0.197, 'compound': 0.4019}",neutral,0.9998552799224854
558229,558229,569002.0,Howdoo: A 'Radically Different' Income-Generating Medium For Content Creators,2019-10-15 12:23:00-04:00,GOOG,howdoo a radically different income generating medium for content creators,"{'neg': 0.0, 'neu': 1.0, 'pos': 0.0, 'compound': 0.0}",neutral,0.9996975660324097
558230,558230,569003.0,From Google Pixel 4 Event: Smartphone Starts At $799,2019-10-15 10:52:00-04:00,GOOG,from google pixel 4 event smartphone starts at dollars 99,"{'neg': 0.0, 'neu': 1.0, 'pos': 0.0, 'compound': 0.0}",neutral,0.999893069267273
558231,558231,569004.0,From Google Pixel 4 Event: Has Launched New Nest Wifi Router 2 Pack For $269,2019-10-15 10:38:00-04:00,GOOG,from google pixel 4 event has launched new nest wifi router 2 pack for dollars 69,"{'neg': 0.0, 'neu': 0.909, 'pos': 0.091, 'compound': 0.128}",neutral,0.9996474981307983
558232,558232,569005.0,From Google Pixel 4 Event: Has Launched Nest Mini Smart Speaker With A Mall Mount For $49,2019-10-15 10:36:00-04:00,GOOG,from google pixel 4 event has launched nest mini smart speaker with a mall mount for dollars 9,"{'neg': 0.0, 'neu': 0.792, 'pos': 0.208, 'compound': 0.4939}",neutral,0.9998712539672852
558233,558233,569006.0,From Google Pixel 4 Event: Highlighting Updates For Google Nest,2019-10-15 10:26:00-04:00,GOOG,from google pixel 4 event highlighting updates for google nest,"{'neg': 0.0, 'neu': 1.0, 'pos': 0.0, 'compound': 0.0}",neutral,0.9998875856399536
558234,558234,569007.0,From Google Pixel 4 Event: New Pixel Earbuds Will Be Coming In Spring 2020,2019-10-15 10:23:00-04:00,GOOG,from google pixel 4 event new pixel earbuds will be coming in spring 2020,"{'neg': 0.0, 'neu': 1.0, 'pos': 0.0, 'compound': 0.0}",neutral,0.9998928308486938
558235,558235,569008.0,'Stadia arrives on November 19' -Google Blog,2019-10-15 10:21:00-04:00,GOOG,stadia arrives on november 19 google blog,"{'neg': 0.0, 'neu': 1.0, 'pos': 0.0, 'compound': 0.0}",neutral,0.9998923540115356
558236,558236,569009.0,CenturyLink Expands On-Demand Network Connectivity to Google Cloud Platform,2019-10-15 08:26:00-04:00,GOOG,centurylink expands on demand network connectivity to google cloud platform,"{'neg': 0.138, 'neu': 0.734, 'pos': 0.128, 'compound': -0.0258}",positive,0.9994503855705261
558237,558237,569010.0,"Apple, Microsoft Battle For Position As World's Most Valuable Company By Market Cap",2019-10-14 15:03:00-04:00,GOOG,apple microsoft battle for position as worlds most valuable company by market cap,"{'neg': 0.153, 'neu': 0.647, 'pos': 0.2, 'compound': 0.2006}",neutral,0.5461327433586121
558238,558238,569011.0,"Mortgage Industry Disruptor Better.com Expands Business Lines, Eyes $1B Valuation",2019-10-11 14:29:00-04:00,GOOG,mortgage industry disruptor better com expands business lines eyes dollars b valuation,"{'neg': 0.0, 'neu': 0.699, 'pos': 0.301, 'compound': 0.5106}",positive,0.9991610050201416
558239,558239,569012.0,Trader Toolkit: Cash Flow,2019-10-11 09:18:00-04:00,GOOG,trader toolkit cash flow,"{'neg': 0.0, 'neu': 1.0, 'pos': 0.0, 'compound': 0.0}",neutral,0.9998539686203003
558240,558240,569013.0,"Google Spokesperson Says 'The Revolution Of Our Times' App Was Found To Be Violating Policy Which Prohibits Developers From Capitalizing On Sensitive Events, Has Suspended It",2019-10-10 11:38:00-04:00,GOOG,google spokesperson says the revolution of our times app was found to be violating policy which prohibits developers from capitalizing on sensitive events has suspended it,"{'neg': 0.216, 'neu': 0.784, 'pos': 0.0, 'compound': -0.765}",negative,0.9874825477600098
558241,558241,569014.0,What To Expect From Q3 Internet Earnings,2019-10-09 16:24:00-04:00,GOOG,what to expect from third quarter internet earnings,"{'neg': 0.0, 'neu': 1.0, 'pos': 0.0, 'compound': 0.0}",neutral,0.9995667338371277
558242,558242,569015.0,Why This Cannabis Social Media Platform Was Just Removed From The App Store,2019-10-09 15:33:00-04:00,GOOG,why this cannabis social media platform was just removed from the app store,"{'neg': 0.0, 'neu': 1.0, 'pos': 0.0, 'compound': 0.0}",neutral,0.9995057582855225
558243,558243,569016.0,"As Trade Talks Approach, ""Barometer"" Stocks Like Apple And Boeing Could Be In Focus",2019-10-08 10:10:00-04:00,GOOG,as trade talks approach barometer stocks like apple and boeing could be in focus,"{'neg': 0.0, 'neu': 0.839, 'pos': 0.161, 'compound': 0.3612}",neutral,0.9996868371963501
558244,558244,569017.0,Survey Shows Teens Prefer YouTube Over Netflix,2019-10-08 09:53:00-04:00,GOOG,survey shows teens prefer youtube over netflix,"{'neg': 0.0, 'neu': 1.0, 'pos': 0.0, 'compound': 0.0}",neutral,0.9980310797691345
558245,558245,569018.0,Investors Sell FANG To Buy IPOs In September's IMX,2019-10-07 16:54:00-04:00,GOOG,investors sell fang to buy ipos in septembers imx,"{'neg': 0.0, 'neu': 1.0, 'pos': 0.0, 'compound': 0.0}",neutral,0.9998601675033569
558246,558246,569019.0,Investor Movement Index Summary: September 2019,2019-10-07 13:18:00-04:00,GOOG,investor movement index summary september 2019,"{'neg': 0.0, 'neu': 1.0, 'pos': 0.0, 'compound': 0.0}",neutral,0.9998868703842163
558247,558247,569020.0,Google to Build a Data Center in Nebraska,2019-10-04 15:41:00-04:00,GOOG,google to build a data center in nebraska,"{'neg': 0.0, 'neu': 1.0, 'pos': 0.0, 'compound': 0.0}",neutral,0.9998654127120972
558248,558248,569021.0,Google Considering Purchase Of Rival To Video App TikTok,2019-10-04 14:25:00-04:00,GOOG,google considering purchase of rival to video app tiktok,"{'neg': 0.0, 'neu': 1.0, 'pos': 0.0, 'compound': 0.0}",neutral,0.999678373336792
558249,558249,569022.0,"Delta, Ulta And More 'Fast Money' Picks For October 3",2019-10-03 11:27:00-04:00,GOOG,delta ulta and more fast money picks for october 3,"{'neg': 0.0, 'neu': 1.0, 'pos': 0.0, 'compound': 0.0}",neutral,0.9997815489768982
558250,558250,569023.0,Cloud Competition: Is Digital Ocean The Next AWS?,2019-10-02 16:36:00-04:00,GOOG,cloud competition is digital ocean the next aws,"{'neg': 0.0, 'neu': 1.0, 'pos': 0.0, 'compound': 0.0}",neutral,0.9998824596405029
558251,558251,569024.0,Alphabet shares are trading lower in sympathy with the overall market amid fears of a recession.,2019-10-02 14:52:00-04:00,GOOG,alphabet shares are trading lower in sympathy with the overall market amid fears of a recession,"{'neg': 0.332, 'neu': 0.468, 'pos': 0.2, 'compound': -0.4767}",negative,0.9985826015472412
558252,558252,569025.0,Here's How Large Option Traders Reacted To Microsoft's Surface Event,2019-10-02 13:25:00-04:00,GOOG,heres how large option traders reacted to microsofts surface event,"{'neg': 0.0, 'neu': 1.0, 'pos': 0.0, 'compound': 0.0}",neutral,0.9998134970664978
558253,558253,569026.0,Microsoft To Partner With Google For Android On The Surface Duo,2019-10-02 11:26:00-04:00,GOOG,microsoft to partner with google for android on the surface duo,"{'neg': 0.0, 'neu': 1.0, 'pos': 0.0, 'compound': 0.0}",neutral,0.9998809099197388
558254,558254,569027.0,Google Announces Incognito Mode in Google Maps,2019-10-02 06:56:00-04:00,GOOG,google announces incognito mode in google maps,"{'neg': 0.0, 'neu': 1.0, 'pos': 0.0, 'compound': 0.0}",neutral,0.9998865127563477
558255,558255,569028.0,Huawei Phones Lose Access to Install Google's Apps,2019-10-02 04:39:00-04:00,GOOG,huawei phones lose access to install googles apps,"{'neg': 0.278, 'neu': 0.722, 'pos': 0.0, 'compound': -0.4019}",negative,0.9745441675186157
558256,558256,569029.0,Looking At The Newest S&P 500 Sector One Year Later,2019-09-30 14:49:00-04:00,GOOG,looking at the newest SP500 500 sector one year later,"{'neg': 0.0, 'neu': 1.0, 'pos': 0.0, 'compound': 0.0}",neutral,0.999889612197876
558257,558257,569030.0,'Alphabet taps former FDA commissioner to oversee health strategy and policy' -CNBC,2019-09-30 14:38:00-04:00,GOOG,alphabet taps former fda commissioner to oversee health strategy and policy cnbc,"{'neg': 0.0, 'neu': 1.0, 'pos': 0.0, 'compound': 0.0}",neutral,0.9998416900634766
558258,558258,569031.0,8 Latest Short Seller Targets,2019-09-30 12:56:00-04:00,GOOG,8 latest short seller targets,"{'neg': 0.0, 'neu': 1.0, 'pos': 0.0, 'compound': 0.0}",neutral,0.9998507499694824
558259,558259,569032.0,Analyst: Facebook Next To Face Antitrust Scrutiny,2019-09-29 16:26:00-04:00,GOOG,analyst facebook next to face antitrust scrutiny,"{'neg': 0.0, 'neu': 1.0, 'pos': 0.0, 'compound': 0.0}",neutral,0.9994053840637207
558260,558260,569033.0,Analyst: Apple's Services Narrative Is Largely Priced In; Stock No Longer Attractive,2019-09-26 12:09:00-04:00,GOOG,analyst apples services narrative is largely priced in stock no longer attractive,"{'neg': 0.315, 'neu': 0.685, 'pos': 0.0, 'compound': -0.5583}",negative,0.9980802536010742
