,Unnamed: 0.1,Unnamed: 0,title,date,stock,Text_Cleaned,Score,label,score
557925,557925,568698.0,Google Says Removed More Than 75M Policy-violating Reviews and 4M Fake Business Profiles in 2019,2020-02-19 12:15:00-05:00,GOOG,google says removed more than 75 million policy violating reviews and 4 million fake business profiles in 2019,"{'neg': 0.292, 'neu': 0.708, 'pos': 0.0, 'compound': -0.765}",neutral,0.9956730008125305
557926,557926,568699.0,"Elon Musk Thinks All Artificial Intelligence Needs To Be Better Regulated, Including At Tesla",2020-02-19 07:14:00-05:00,GOOG,elon musk thinks all artificial intelligence needs to be better regulated including at tesla,"{'neg': 0.0, 'neu': 0.667, 'pos': 0.333, 'compound': 0.7184}",neutral,0.9984288811683655
557927,557927,568700.0,"Q4 13F Roundup: How Buffett, Einhorn, Ackman And Others Adjusted Their Portfolios",2020-02-18 13:00:00-05:00,GOOG,q4 13 f roundup how buffett einhorn ackman and others adjusted their portfolios,"{'neg': 0.0, 'neu': 1.0, 'pos': 0.0, 'compound': 0.0}",neutral,0.9998219609260559
557928,557928,568701.0,Stocks That Hit 52-Week Highs On Tuesday,2020-02-18 11:03:00-05:00,GOOG,stocks that hit 52 week highs on tuesday,"{'neg': 0.0, 'neu': 1.0, 'pos': 0.0, 'compound': 0.0}",positive,0.9955780506134033
557929,557929,568702.0,Commentary: Revolutionary Transportation Innovations Moved Humankind Forward,2020-02-18 09:18:00-05:00,GOOG,commentary revolutionary transportation innovations moved humankind forward,"{'neg': 0.0, 'neu': 1.0, 'pos': 0.0, 'compound': 0.0}",positive,0.9870564937591553
557930,557930,568703.0,"Global Stocks Drop As Apple, Others Share Grim Outlook Due To Coronavirus Outbreak",2020-02-18 08:57:00-05:00,GOOG,global stocks drop as apple others share grim outlook due to coronavirus outbreak,"{'neg': 0.322, 'neu': 0.556, 'pos': 0.122, 'compound': -0.5574}",negative,0.9987186193466187
557931,557931,568704.0,Duda Launches App Store After Announcing $25M Investment Round,2020-02-17 09:49:00-05:00,GOOG,duda launches app store after announcing dollars 5 million investment round,"{'neg': 0.0, 'neu': 1.0, 'pos': 0.0, 'compound': 0.0}",neutral,0.9998202919960022
557932,557932,568705.0,"Tiger Global Management Takes Share Stake Of 106,360 Shares Of Class A Capital Stock In Alphabet",2020-02-14 13:56:00-05:00,GOOG,tiger global management takes share stake of 106360 shares of class a capital stock in alphabet,"{'neg': 0.0, 'neu': 0.761, 'pos': 0.239, 'compound': 0.5267}",neutral,0.9998863935470581
557933,557933,568706.0,YouTube Says in a Blog it Paid $3B to the Music Industry in 2019 via Ads and Subscriptions,2020-02-14 13:28:00-05:00,GOOG,youtube says in a blog it paid dollars b to the music industry in 2019 via ads and subscriptions,"{'neg': 0.0, 'neu': 1.0, 'pos': 0.0, 'compound': 0.0}",neutral,0.9998763799667358
557934,557934,568707.0,Google In Talks To Pay Publishers For Content In Premium News Product,2020-02-14 09:02:00-05:00,GOOG,google in talks to pay publishers for content in premium news product,"{'neg': 0.113, 'neu': 0.887, 'pos': 0.0, 'compound': -0.1027}",neutral,0.9992231130599976
557935,557935,568708.0,"Streaming Is Now 20% Of TV Viewing, Netflix Clings To Top Spot",2020-02-13 15:33:00-05:00,GOOG,streaming is now 20 percent of tv viewing netflix clings to top spot,"{'neg': 0.0, 'neu': 0.87, 'pos': 0.13, 'compound': 0.2023}",neutral,0.5132277011871338
557936,557936,568709.0,UK's CMA Clears Deal Between Google and Looker,2020-02-13 05:36:00-05:00,GOOG,uks cma clears deal between google and looker,"{'neg': 0.0, 'neu': 0.843, 'pos': 0.157, 'compound': 0.0772}",positive,0.9993314743041992
557937,557937,568710.0,3 Unique ETF Strategies To Consider Right Now,2020-02-12 10:21:00-05:00,GOOG,3 unique etf strategies to consider right now,"{'neg': 0.0, 'neu': 1.0, 'pos': 0.0, 'compound': 0.0}",neutral,0.9998576641082764
557938,557938,568711.0,FTC Asks Tech Giants To Hand Over Details Of Every Single Acquisition They Made Last Decade,2020-02-12 03:03:00-05:00,GOOG,ftc asks tech giants to hand over details of every single acquisition they made last decade,"{'neg': 0.0, 'neu': 0.824, 'pos': 0.176, 'compound': 0.4939}",neutral,0.9998738765716553
557939,557939,568712.0,"Trump Gives New Definition To 'Make America Great Again,' And It Involves Tech Giants",2020-02-12 01:57:00-05:00,GOOG,trump gives new definition to make america great again and it involves tech giants,"{'neg': 0.0, 'neu': 0.76, 'pos': 0.24, 'compound': 0.6249}",neutral,0.9872667193412781
557940,557940,568713.0,"WhatsApp Payments To Launch In India, BofA Says Monetization Will Take Time",2020-02-11 15:08:00-05:00,GOOG,whatsapp payments to launch in india bofa says monetization will take time,"{'neg': 0.0, 'neu': 1.0, 'pos': 0.0, 'compound': 0.0}",neutral,0.999735414981842
557941,557941,568714.0,"Hearing FTC To Examine Past Acquisitions By Large Technology Companies, Wants Information On Past Deals That Weren't Scrutinized; Unconfirmed",2020-02-11 11:40:00-05:00,GOOG,hearing ftc to examine past acquisitions by large technology companies wants information on past deals that werent scrutinized unconfirmed,"{'neg': 0.0, 'neu': 0.929, 'pos': 0.071, 'compound': 0.0951}",neutral,0.9998844861984253
557942,557942,568715.0,Stocks That Hit 52-Week Highs On Tuesday,2020-02-11 10:17:00-05:00,GOOG,stocks that hit 52 week highs on tuesday,"{'neg': 0.0, 'neu': 1.0, 'pos': 0.0, 'compound': 0.0}",positive,0.9955780506134033
557943,557943,568716.0,Youtube In Talks To Follow Amazon And Apple Into Video Subscriptions Market,2020-02-11 05:32:00-05:00,GOOG,youtube in talks to follow amazon and apple into video subscriptions market,"{'neg': 0.0, 'neu': 0.866, 'pos': 0.134, 'compound': 0.1779}",neutral,0.9998910427093506
557944,557944,568717.0,"Deutsche Bank Seeking Bids From Microsoft, Google, Amazon to Overhaul Its Technology",2020-02-11 05:23:00-05:00,GOOG,deutsche bank seeking bids from microsoft google amazon to overhaul its technology,"{'neg': 0.0, 'neu': 0.866, 'pos': 0.134, 'compound': 0.1779}",neutral,0.9996981620788574
557945,557945,568718.0,Google 'People Operations' Head Steps Down As Company Faces Mounting Employee Protests,2020-02-11 02:55:00-05:00,GOOG,google people operations head steps down as company faces mounting employee protests,"{'neg': 0.147, 'neu': 0.853, 'pos': 0.0, 'compound': -0.2263}",negative,0.8324376940727234
557946,557946,568719.0,"'Google Could Acquire Tesla For $1,500 Per Share On Its Way To $2 Trillion Stock' -Forbes Contributor Article From Trefis, Great Speculations",2020-02-10 06:18:00-05:00,GOOG,google could acquire tesla for dollars 500 per share on its way to dollars trillion stock forbes contributor article from trefis great speculations,"{'neg': 0.0, 'neu': 0.769, 'pos': 0.231, 'compound': 0.743}",neutral,0.9998644590377808
557947,557947,568720.0,'Big Google Search Ranking Algorithm Update - Currently Unconfirmed' -Search Engine Roundtable,2020-02-10 06:15:00-05:00,GOOG,big google search ranking algorithm update to currently unconfirmed search engine roundtable,"{'neg': 0.12, 'neu': 0.88, 'pos': 0.0, 'compound': -0.128}",neutral,0.9992278814315796
557948,557948,568721.0,Google Accused of Competition Abuse in Holiday Rentals,2020-02-10 04:24:00-05:00,GOOG,google accused of competition abuse in holiday rentals,"{'neg': 0.454, 'neu': 0.355, 'pos': 0.191, 'compound': -0.5719}",neutral,0.9296568632125854
557949,557949,568722.0,Hearing the US Has Blocked a Planned Data Cable Connecting LA and Hong Kong,2020-02-07 13:41:00-05:00,GOOG,hearing the us has blocked a planned data cable connecting la and hong kong,"{'neg': 0.139, 'neu': 0.861, 'pos': 0.0, 'compound': -0.2732}",negative,0.9429129362106323
557950,557950,568723.0,"Google's Former Head of Pixel Smartphone Division, Mario Queiroz, has Left the Company",2020-02-07 05:36:00-05:00,GOOG,googles former head of pixel smartphone division mario queiroz has left the company,"{'neg': 0.0, 'neu': 1.0, 'pos': 0.0, 'compound': 0.0}",neutral,0.9997850060462952
557951,557951,568724.0,BitTorrent CEO Justin Sun's $4.5-Million Dinner With Warren Buffett,2020-02-06 15:33:00-05:00,GOOG,bittorrent ceo justin suns dollars .5 million dinner with warren buffett,"{'neg': 0.0, 'neu': 1.0, 'pos': 0.0, 'compound': 0.0}",neutral,0.99986732006073
557952,557952,568725.0,Everything You Need To Know About The Overwatch League 2020,2020-02-06 14:20:00-05:00,GOOG,everything you need to know about the overwatch league 2020,"{'neg': 0.0, 'neu': 1.0, 'pos': 0.0, 'compound': 0.0}",neutral,0.999870777130127
557953,557953,568726.0,"Alphabet, Sonos Shares Appear Unaffected Following Recent Reuters Article 'U.S. trade panel opens patent probe into Google speakers after Sonos complaint'",2020-02-06 14:05:00-05:00,GOOG,alphabet sonos shares appear unaffected following recent reuters article u s trade panel opens patent probe into google speakers after sonos complaint,"{'neg': 0.09, 'neu': 0.82, 'pos': 0.09, 'compound': 0.0}",neutral,0.9676389098167419
557954,557954,568727.0,Alphabet shares are trading higher after CFRA maintained a Strong Buy on the company and raised the price target from $1737 to $1761.,2020-02-06 11:28:00-05:00,GOOG,alphabet shares are trading higher after cfra maintained a strong buy on the company and raised the price target from dollars 737 to dollars 761,"{'neg': 0.0, 'neu': 0.807, 'pos': 0.193, 'compound': 0.6705}",positive,0.9997100234031677
557955,557955,568728.0,Why Company Culture Is Critical for a Small Business' Bottom Line,2020-02-06 09:00:00-05:00,GOOG,why company culture is critical for a small business bottom line,"{'neg': 0.187, 'neu': 0.813, 'pos': 0.0, 'compound': -0.3182}",neutral,0.9997554421424866
557956,557956,568729.0,"CFRA Maintains Strong Buy on Alphabet, Raises Price Target to $1761",2020-02-06 06:34:00-05:00,GOOG,cfra maintains strong buy on alphabet raises price target to dollars 761,"{'neg': 0.0, 'neu': 0.769, 'pos': 0.231, 'compound': 0.5106}",positive,0.9996390342712402
557957,557957,568730.0,Amazon Made It Happen And Gained The $1 Trillion Club Membership,2020-02-05 10:33:00-05:00,GOOG,amazon made it happen and gained the dollars trillion club membership,"{'neg': 0.0, 'neu': 0.677, 'pos': 0.323, 'compound': 0.5106}",positive,0.9992350339889526
557958,557958,568731.0,Nvidia GeForce Now Game Streaming Is Now Available,2020-02-04 18:11:00-05:00,GOOG,nvidia geforce now game streaming is now available,"{'neg': 0.0, 'neu': 1.0, 'pos': 0.0, 'compound': 0.0}",neutral,0.9997926354408264
557959,557959,568732.0,Group Of State Attorney Generals Say Meeting With US Justice Department Officials To Discuss Alphabet's Google Anti-Trust Probe Has Concluded,2020-02-04 15:39:00-05:00,GOOG,group of state attorney generals say meeting with us justice department officials to discuss alphabets google anti trust probe has concluded,"{'neg': 0.085, 'neu': 0.667, 'pos': 0.248, 'compound': 0.6597}",neutral,0.9997135996818542
557960,557960,568733.0,"OK Google, How Is The Street Reacting To Alphabet's Q4 Earnings?",2020-02-04 13:40:00-05:00,GOOG,ok google how is the street reacting to alphabets fourth quarter earnings,"{'neg': 0.0, 'neu': 0.833, 'pos': 0.167, 'compound': 0.296}",neutral,0.9997562766075134
557961,557961,568734.0,55 Stocks Moving In Tuesday's Mid-Day Session,2020-02-04 12:35:00-05:00,GOOG,55 stocks moving in tuesdays mid day session,"{'neg': 0.0, 'neu': 1.0, 'pos': 0.0, 'compound': 0.0}",neutral,0.9998792409896851
557962,557962,568735.0,"PreMarket Prep Recap, Feb. 4, 2020: TSLA Continues Its Unbelievable Move",2020-02-04 11:00:00-05:00,GOOG,premarket prep recap feb 4 2020 tsla continues its unbelievable move,"{'neg': 0.0, 'neu': 0.847, 'pos': 0.153, 'compound': 0.2023}",positive,0.9153274297714233
557963,557963,568736.0,"UPDATE: Needham Maintains Buy On Alphabet, Raises Target To $1,800 Notes 'There were several key ""firsts"" now that Sundar Pichai is CEO:'",2020-02-04 10:30:00-05:00,GOOG,update needham maintains buy on alphabet raises target to dollars 800 notes there were several key firsts now that sundar pichai is ceo,"{'neg': 0.0, 'neu': 1.0, 'pos': 0.0, 'compound': 0.0}",positive,0.9993876218795776
557964,557964,568737.0,"Credit Suisse Maintains Outperform On Alphabet, $1700 Price Target As Firm Notes 3 Factors:",2020-02-04 09:44:00-05:00,GOOG,credit suisse maintains outperform on alphabet dollars 700 price target as firm notes 3 factors,"{'neg': 0.0, 'neu': 0.843, 'pos': 0.157, 'compound': 0.3818}",positive,0.9996166229248047
557965,557965,568738.0,"Deutsche Bank Maintains Buy on Alphabet, Lowers Price Target to $1700",2020-02-04 09:01:00-05:00,GOOG,deutsche bank maintains buy on alphabet lowers price target to dollars 700,"{'neg': 0.12, 'neu': 0.88, 'pos': 0.0, 'compound': -0.128}",positive,0.9991381168365479
557966,557966,568739.0,"Benzinga Pro's Top 5 Stocks To Watch For Tues., Feb. 4, 2020: GOOGL, DIS, EBAY, F, IBIO",2020-02-04 08:54:00-05:00,GOOG,benzinga pros top 5 stocks to watch for tues feb 4 2020 googl dis ebay f ibio,"{'neg': 0.0, 'neu': 0.899, 'pos': 0.101, 'compound': 0.2023}",neutral,0.9998154044151306
557967,557967,568740.0,"KeyBanc On Alphabet Notes 'Further, new disclosures and commentary helped highlight the magnitude of investments in opportunities beyond Search, which we believe can create substantial value for GOOGL over time'",2020-02-04 08:32:00-05:00,GOOG,keybanc on alphabet notes further new disclosures and commentary helped highlight the magnitude of investments in opportunities beyond search which we believe can create substantial value for googl over time,"{'neg': 0.0, 'neu': 0.689, 'pos': 0.311, 'compound': 0.8519}",positive,0.9994113445281982
557968,557968,568741.0,"KeyBanc Reiterates Overweight, $1,769 Target On Alphabet As Firm Notes 'We recommend owning GOOGL. 4Q results showed excellent core Search ad revenue growth that appears sustainable for the foreseeable future'",2020-02-04 08:32:00-05:00,GOOG,keybanc reiterates overweight dollars 769 target on alphabet as firm notes we recommend owning googl fourth quarter results showed excellent core search ad revenue growth that appears sustainable for the foreseeable future,"{'neg': 0.064, 'neu': 0.712, 'pos': 0.224, 'compound': 0.743}",positive,0.9996148347854614
557969,557969,568742.0,"UPDATE: Raymond James Maintains Outperform On Alphabet, Raises Target To $1,580 'given solid advertising growth (Search, YouTube), increasing Google Cloud momentum, and an attractive valuation (~22x 2020E core EPS ex cash)'",2020-02-04 08:22:00-05:00,GOOG,update raymond james maintains outperform on alphabet raises target to dollars 580 given solid advertising growth search youtube increasing google cloud momentum and an attractive valuation 22 times 2020 e core eps ex cash,"{'neg': 0.0, 'neu': 0.814, 'pos': 0.186, 'compound': 0.7269}",positive,0.9997169375419617
557970,557970,568743.0,"UPDATE:Piper Sandler On Alphabet Notes Co's 'Cloud Segment & YouTube Ads Growing Faster Than Core, But Too Small to Offset Broader Deceleration'; 'cloud segment is 6% and YouTube ads is 9% of '19 revenue'; 'Online Ad Spend is Ongoing Secular Tailwind'",2020-02-04 08:16:00-05:00,GOOG,update piper sandler on alphabet notes cos cloud segment and youtube ads growing faster than core but too small to offset broader deceleration cloud segment is 6 percent and youtube ads is 9 percent of 19 revenue online ad spend is ongoing secular tailwind,"{'neg': 0.0, 'neu': 0.97, 'pos': 0.03, 'compound': 0.09}",positive,0.9996008276939392
557971,557971,568744.0,"UPDATE: Piper Sandler Maintains Overweight On Alphabet, Raises Target To $1,600 Notes 'The core advertising business is decelerating, while cloud is accelerating and YouTube growth is outpacing the core'",2020-02-04 08:16:00-05:00,GOOG,update piper sandler maintains overweight on alphabet raises target to dollars 600 notes the core advertising business is decelerating while cloud is accelerating and youtube growth is outpacing the core,"{'neg': 0.076, 'neu': 0.846, 'pos': 0.079, 'compound': 0.0258}",positive,0.9941180944442749
557972,557972,568745.0,10 Biggest Price Target Changes For Tuesday,2020-02-04 08:14:00-05:00,GOOG,10 biggest price target changes for tuesday,"{'neg': 0.0, 'neu': 1.0, 'pos': 0.0, 'compound': 0.0}",neutral,0.999796450138092
557973,557973,568746.0,12 Communication Services Stocks Moving In Tuesday's Pre-Market Session,2020-02-04 07:52:00-05:00,GOOG,12 communication services stocks moving in tuesdays pre market session,"{'neg': 0.0, 'neu': 1.0, 'pos': 0.0, 'compound': 0.0}",neutral,0.9998763799667358
557974,557974,568747.0,"Raymond James Maintains Outperform on Alphabet, Raises Price Target to $1580",2020-02-04 07:41:00-05:00,GOOG,raymond james maintains outperform on alphabet raises price target to dollars 580,"{'neg': 0.0, 'neu': 1.0, 'pos': 0.0, 'compound': 0.0}",positive,0.9996628761291504
557975,557975,568748.0,4 Internet Content & Information Stocks Moving In Tuesday's Pre-Market Session,2020-02-04 07:40:00-05:00,GOOG,4 internet content and information stocks moving in tuesdays pre market session,"{'neg': 0.0, 'neu': 1.0, 'pos': 0.0, 'compound': 0.0}",neutral,0.9998714923858643
557976,557976,568749.0,"Piper Sandler Maintains Overweight on Alphabet, Raises Price Target to $1600",2020-02-04 07:27:00-05:00,GOOG,piper sandler maintains overweight on alphabet raises price target to dollars 600,"{'neg': 0.185, 'neu': 0.815, 'pos': 0.0, 'compound': -0.3612}",negative,0.9972781538963318
557977,557977,568750.0,33 Stocks Moving in Tuesday's Pre-Market Session,2020-02-04 07:24:00-05:00,GOOG,33 stocks moving in tuesdays pre market session,"{'neg': 0.0, 'neu': 1.0, 'pos': 0.0, 'compound': 0.0}",neutral,0.9998741149902344
557978,557978,568751.0,Alphabet shares are trading lower after the company reported worse-than-expected Q4 sales results.,2020-02-04 07:15:00-05:00,GOOG,alphabet shares are trading lower after the company reported worse than expected fourth quarter sales results,"{'neg': 0.259, 'neu': 0.634, 'pos': 0.107, 'compound': -0.4767}",negative,0.9984501600265503
557979,557979,568752.0,"Needham Maintains Buy on Alphabet, Raises Price Target to $1800",2020-02-04 06:42:00-05:00,GOOG,needham maintains buy on alphabet raises price target to dollars 800,"{'neg': 0.0, 'neu': 1.0, 'pos': 0.0, 'compound': 0.0}",positive,0.9995219707489014
557980,557980,568753.0,"Nomura Maintains Buy on Alphabet, Raises Price Target to $1680",2020-02-04 06:24:00-05:00,GOOG,nomura maintains buy on alphabet raises price target to dollars 680,"{'neg': 0.0, 'neu': 1.0, 'pos': 0.0, 'compound': 0.0}",positive,0.9995434880256653
557981,557981,568754.0,"Pivotal Research Maintains Buy on Alphabet, Raises Price Target to $1700",2020-02-04 06:19:00-05:00,GOOG,pivotal research maintains buy on alphabet raises price target to dollars 700,"{'neg': 0.0, 'neu': 1.0, 'pos': 0.0, 'compound': 0.0}",positive,0.999565064907074
557982,557982,568755.0,Facebook Co-Founder's Asana Files To Go Public Via Direct Listing,2020-02-04 05:12:00-05:00,GOOG,facebook co founders asana files to go public via direct listing,"{'neg': 0.0, 'neu': 1.0, 'pos': 0.0, 'compound': 0.0}",neutral,0.9998732805252075
557983,557983,568756.0,Google Discloses YouTube Revenue For The First Time Ever,2020-02-04 01:44:00-05:00,GOOG,google discloses youtube revenue for the first time ever,"{'neg': 0.0, 'neu': 1.0, 'pos': 0.0, 'compound': 0.0}",neutral,0.9870280027389526
557984,557984,568757.0,Amazon Testing Online Platform To Let Merchants Shop For Loans: Report,2020-02-03 21:44:00-05:00,GOOG,amazon testing online platform to let merchants shop for loans report,"{'neg': 0.0, 'neu': 0.855, 'pos': 0.145, 'compound': 0.1779}",neutral,0.9998688697814941
557985,557985,568758.0,"Alphabet CEO Says Youtube Has 20 Million Paid Music And Premium Subscribers, Says YouTube Has 2M Paid YouTube TV Subscribers",2020-02-03 17:13:00-05:00,GOOG,alphabet ceo says youtube has 20 million paid music and premium subscribers says youtube has 2 million paid youtube tv subscribers,"{'neg': 0.0, 'neu': 1.0, 'pos': 0.0, 'compound': 0.0}",neutral,0.9998829364776611
557986,557986,568759.0,Alphabet Reports Mixed Q4 Earnings,2020-02-03 16:34:00-05:00,GOOG,alphabet reports mixed fourth quarter earnings,"{'neg': 0.0, 'neu': 1.0, 'pos': 0.0, 'compound': 0.0}",negative,0.9963887929916382
557987,557987,568760.0,"Alphabet CFO Says No Impact Currently From Coronovirus, Could Impact Hardware Products If Protracted",2020-02-03 16:28:00-05:00,GOOG,alphabet cfo says no impact currently from coronovirus could impact hardware products if protracted,"{'neg': 0.145, 'neu': 0.855, 'pos': 0.0, 'compound': -0.296}",neutral,0.9582733511924744
557988,557988,568761.0,7 Stocks Moving In Monday's After Hours,2020-02-03 16:24:00-05:00,GOOG,7 stocks moving in mondays after hours,"{'neg': 0.0, 'neu': 1.0, 'pos': 0.0, 'compound': 0.0}",neutral,0.9998512268066406
557989,557989,568762.0,Alphabet shares are trading lower after the company reported worse-than-expected Q4 sales results.,2020-02-03 16:08:00-05:00,GOOG,alphabet shares are trading lower after the company reported worse than expected fourth quarter sales results,"{'neg': 0.259, 'neu': 0.634, 'pos': 0.107, 'compound': -0.4767}",negative,0.9984501600265503
557990,557990,568763.0,Alphabet Reports Google Cloud Revenue 2.61B Up From 1.7B YoY,2020-02-03 16:06:00-05:00,GOOG,alphabet reports google cloud revenue 2.61 billion up from 1.7 billion yoy,"{'neg': 0.0, 'neu': 1.0, 'pos': 0.0, 'compound': 0.0}",positive,0.999728262424469
557991,557991,568764.0,Alphabet Q4 Total Traffic Acquisition Cost $8.501B vs $7.436B in Same Qtr. Last Year,2020-02-03 16:05:00-05:00,GOOG,alphabet fourth quarter total traffic acquisition cost dollars .501 billion vs dollars .436 billion in same qtr last year,"{'neg': 0.0, 'neu': 1.0, 'pos': 0.0, 'compound': 0.0}",neutral,0.9994744658470154
557992,557992,568765.0,"Alphabet Reports Q4 Operating Margin 20%, Down From 21% YoY",2020-02-03 16:05:00-05:00,GOOG,alphabet reports fourth quarter operating margin 20 percent down from 21 percent yoy,"{'neg': 0.0, 'neu': 1.0, 'pos': 0.0, 'compound': 0.0}",negative,0.9984782338142395
557993,557993,568766.0,"Alphabet Q4 EPS $15.35 Beats $12.53 Estimate, Sales $46.075B Miss $46.94B Estimate",2020-02-03 16:03:00-05:00,GOOG,alphabet fourth quarter eps dollars 5.35 beats dollars 2.53 estimate sales dollars 6.075 billion miss dollars 6.94 billion estimate,"{'neg': 0.082, 'neu': 0.918, 'pos': 0.0, 'compound': -0.1531}",neutral,0.9998542070388794
557994,557994,568767.0,Here's How Much Investing $100 In Google Stock Back In 2010 Would Be Worth Today,2020-02-03 13:10:00-05:00,GOOG,heres how much investing dollars 00 in google stock back in 2010 would be worth today,"{'neg': 0.0, 'neu': 0.888, 'pos': 0.112, 'compound': 0.2263}",neutral,0.9994947910308838
557995,557995,568768.0,"3 Sector ETFs To Play Ahead Of Alphabet, Disney Earnings",2020-02-03 10:45:00-05:00,GOOG,3 sector etfs to play ahead of alphabet disney earnings,"{'neg': 0.0, 'neu': 0.789, 'pos': 0.211, 'compound': 0.34}",neutral,0.575237512588501
557996,557996,568769.0,"Alphabet Inc. shares are trading higher, potentially in anticipation of the company's Q4 earnings release after the close today.",2020-02-03 10:44:00-05:00,GOOG,alphabet inc shares are trading higher potentially in anticipation of the companys fourth quarter earnings release after the close today,"{'neg': 0.0, 'neu': 0.833, 'pos': 0.167, 'compound': 0.3818}",positive,0.9996123909950256
557997,557997,568770.0,"Monday's Market Minute: Earnings, Ecodata & Coronavirus, Oh My!",2020-02-03 09:19:00-05:00,GOOG,mondays market minute earnings ecodata and coronavirus oh my,"{'neg': 0.0, 'neu': 1.0, 'pos': 0.0, 'compound': 0.0}",neutral,0.9998396635055542
557998,557998,568771.0,Google Addresses Stadia Users Complaints About Lack Of Info For Upcoming Games,2020-02-03 08:35:00-05:00,GOOG,google addresses stadia users complaints about lack of info for upcoming games,"{'neg': 0.333, 'neu': 0.667, 'pos': 0.0, 'compound': -0.6124}",neutral,0.7166131734848022
557999,557999,568772.0,MAGA: A Look At The Trillion Dollar Market Cap Club,2020-01-31 12:05:00-05:00,GOOG,maga a look at the trillion dollar market cap club,"{'neg': 0.0, 'neu': 1.0, 'pos': 0.0, 'compound': 0.0}",neutral,0.9998762607574463
558000,558000,568773.0,"Benzinga Pro's Top 5 Stocks To Watch For Fri., Jan. 31, 2020: AMZN, IBM, GOOGL, WWE, UBER",2020-01-31 08:27:00-05:00,GOOG,benzinga pros top 5 stocks to watch for fri jan 31 2020 amzn ibm googl wwe uber,"{'neg': 0.0, 'neu': 0.899, 'pos': 0.101, 'compound': 0.2023}",neutral,0.9997829794883728
558001,558001,568774.0,Alphabet Earnings Ahead: Analysts Eyeing These 3 Growth Drivers At Google,2020-01-30 11:30:00-05:00,GOOG,alphabet earnings ahead analysts eyeing these 3 growth drivers at google,"{'neg': 0.0, 'neu': 0.794, 'pos': 0.206, 'compound': 0.3818}",positive,0.9790005087852478
558002,558002,568775.0,3 Things That Move Alphabet's Stock,2020-01-30 11:15:00-05:00,GOOG,3 things that move alphabets stock,"{'neg': 0.0, 'neu': 1.0, 'pos': 0.0, 'compound': 0.0}",neutral,0.9998722076416016
558003,558003,568776.0,Google Confirms That Is Temporarily Shutting Down All China Offices Due To Coronavirus Outbreak,2020-01-29 15:54:00-05:00,GOOG,google confirms that is temporarily shutting down all china offices due to coronavirus outbreak,"{'neg': 0.0, 'neu': 1.0, 'pos': 0.0, 'compound': 0.0}",neutral,0.7560877799987793
558004,558004,568777.0,'Google is temporarily shutting down all China offices due to coronavirus outbreak' -The Verge,2020-01-29 14:53:00-05:00,GOOG,google is temporarily shutting down all china offices due to coronavirus outbreak the verge,"{'neg': 0.0, 'neu': 1.0, 'pos': 0.0, 'compound': 0.0}",neutral,0.7174638509750366
