,Unnamed: 0.1,Unnamed: 0,title,date,stock,Text_Cleaned,Score,label,score
988561,988561,1000701.0,"Pfizer Q1 EPS Adj. $0.85 Beats $0.75 Estimate, Sales $12.12B Miss $13B Estimate",2019-04-30 06:47:00-04:00,PFE,pfizer first quarter eps adj dollars .85 beats dollars .75 estimate sales dollars 2.12 billion miss dollars 3 billion estimate,"{'neg': 0.078, 'neu': 0.922, 'pos': 0.0, 'compound': -0.1531}",neutral,0.9997442364692688
988562,988562,1000702.0,"15 Stocks To Watch For April 30, 2019",2019-04-30 06:37:00-04:00,PFE,15 stocks to watch for april 30 2019,"{'neg': 0.0, 'neu': 1.0, 'pos': 0.0, 'compound': 0.0}",neutral,0.9998714923858643
988563,988563,1000703.0,"Earnings Scheduled For April 30, 2019",2019-04-30 06:18:00-04:00,PFE,earnings scheduled for april 30 2019,"{'neg': 0.0, 'neu': 1.0, 'pos': 0.0, 'compound': 0.0}",neutral,0.9998846054077148
988564,988564,1000704.0,Pfizer Reports Received Positive CHMP Opinion For TALZENNA,2019-04-26 11:00:00-04:00,PFE,pfizer reports received positive chmp opinion for talzenna,"{'neg': 0.0, 'neu': 0.66, 'pos': 0.34, 'compound': 0.5574}",positive,0.9994882345199585
988565,988565,1000705.0,"Shares of several healthcare stocks are trading higher in a potential rebound from last week's selloff. In an upgrade of HCA Healthcare, Raymond James analysts noted the selloff was 'based on legislation that has almost no chance of passing'",2019-04-23 11:52:00-04:00,PFE,shares of several healthcare stocks are trading higher in a potential rebound from last weeks selloff in an upgrade of hca healthcare raymond james analysts noted the selloff was based on legislation that has almost no chance of passing,"{'neg': 0.067, 'neu': 0.879, 'pos': 0.054, 'compound': 0.1142}",positive,0.9994731545448303
988566,988566,1000706.0,"Eli Lilly-Pfizer's Non-Opioid Painkiller Faces Safety, Efficacy Concerns",2019-04-22 10:24:00-04:00,PFE,eli lilly pfizers non opioid painkiller faces safety efficacy concerns,"{'neg': 0.0, 'neu': 0.763, 'pos': 0.237, 'compound': 0.4215}",negative,0.987287163734436
988567,988567,1000707.0,"Pfizer, Eli Lilly Late Thurs. Announced Top-Line Results From Long-Term Phase 3 Study Of Tanezumab In Patients With Osteoarthritis",2019-04-22 08:23:00-04:00,PFE,pfizer eli lilly late thurs announced top line results from long term phase 3 study of tanezumab in patients with osteoarthritis,"{'neg': 0.0, 'neu': 0.917, 'pos': 0.083, 'compound': 0.2023}",neutral,0.9900906085968018
988568,988568,1000708.0,Shares of several drug companies are trading lower amid continued efforts from Washington to curb prescription drug prices. The overall healthcare sector has seen weakness recently due to uncertainty over the future of healthcare policy.,2019-04-18 10:51:00-04:00,PFE,shares of several drug companies are trading lower amid continued efforts from washington to curb prescription drug prices the overall healthcare sector has seen weakness recently due to uncertainty over the future of healthcare policy,"{'neg': 0.182, 'neu': 0.764, 'pos': 0.054, 'compound': -0.6369}",negative,0.9987220168113708
988569,988569,1000709.0,Shares of several drug companies are trading lower amid continued efforts from Washington to curb prescription drug prices. The overall healthcare sector has seen weakness recently due to uncertainty over the future of healthcare policy.,2019-04-17 10:31:00-04:00,PFE,shares of several drug companies are trading lower amid continued efforts from washington to curb prescription drug prices the overall healthcare sector has seen weakness recently due to uncertainty over the future of healthcare policy,"{'neg': 0.182, 'neu': 0.764, 'pos': 0.054, 'compound': -0.6369}",negative,0.9987220168113708
988570,988570,1000710.0,Shares of several drug companies are trading lower. Weakness may be tied to uncertainty over healthcare policy going into the 2020 primaries and Washington's recent efforts to curb prescription drug prices.,2019-04-16 15:34:00-04:00,PFE,shares of several drug companies are trading lower weakness may be tied to uncertainty over healthcare policy going into the 2020 primaries and washingtons recent efforts to curb prescription drug prices,"{'neg': 0.202, 'neu': 0.738, 'pos': 0.06, 'compound': -0.6369}",negative,0.9984425902366638
988571,988571,1000711.0,Pfizer Announces Presentation of Data from a Phase 2 Study of its 20-Valent Pneumococcal Conjugate Vaccine Candidate Being Investigated for the Prevention of Invasive Disease and Pneumonia in Adults Aged 18 Years and Older,2019-04-14 09:49:00-04:00,PFE,pfizer announces presentation of data from a phase 2 study of its 20 valent pneumococcal conjugate vaccine candidate being investigated for the prevention of invasive disease and pneumonia in adults aged 18 years and older,"{'neg': 0.0, 'neu': 1.0, 'pos': 0.0, 'compound': 0.0}",neutral,0.9998741149902344
988572,988572,1000712.0,PreMarket Prep Opening NYSE Imbalance Update: GE 652k Shares To Sell; ExxonMobil 66k Shares To Sell; BofA 123 To Sell; Citi 52k To Sell; P&G 40k sell; J&J 41k To sell; Pfizer 96k To Sell,2019-04-09 08:34:00-04:00,PFE,premarket prep opening nyse imbalance update ge 652 thousand shares to sell exxonmobil 66 thousand shares to sell bofa 123 to sell citi 52 thousand to sell p and g 40 thousand sell j and j 41 thousand to sell pfizer 96 thousand to sell,"{'neg': 0.0, 'neu': 0.907, 'pos': 0.093, 'compound': 0.5267}",neutral,0.9998705387115479
988573,988573,1000713.0,"The Daily Biotech Pulse: PhaseBio Gets Breakthrough Therapy Designation, FDA Shoots Down Zogenix Epilepsy Regulatory Filing",2019-04-09 08:10:00-04:00,PFE,the daily biotech pulse phasebio gets breakthrough therapy designation fda shoots down zogenix epilepsy regulatory filing,"{'neg': 0.0, 'neu': 1.0, 'pos': 0.0, 'compound': 0.0}",negative,0.9956555366516113
988574,988574,1000714.0,"Pfizer, GlaxoSmithKline Reports Its ViiV Healthcare Co. Received FDA Approval For Dovato Drug Regimen For Treatment-Naive HIV-1 Adults",2019-04-08 16:52:00-04:00,PFE,pfizer glaxosmithkline reports its viiv healthcare co received fda approval for dovato drug regimen for treatment naive hiv 1 adults,"{'neg': 0.091, 'neu': 0.776, 'pos': 0.134, 'compound': 0.25}",positive,0.9995118379592896
988575,988575,1000715.0,FDA Says Granted Approval Of Dovato To Viiv Healthcare,2019-04-08 15:39:00-04:00,PFE,fda says granted approval of dovato to viiv healthcare,"{'neg': 0.0, 'neu': 0.579, 'pos': 0.421, 'compound': 0.6249}",positive,0.9991629123687744
988576,988576,1000716.0,FDA Approves First Two-Drug Complete Regimen For HIV-Infected Patients Who Have Never Received Antiretroviral Treatment,2019-04-08 15:33:00-04:00,PFE,fda approves first two drug complete regimen for hiv infected patients who have never received antiretroviral treatment,"{'neg': 0.153, 'neu': 0.718, 'pos': 0.129, 'compound': -0.128}",neutral,0.9936543703079224
988577,988577,1000717.0,"Bulls & Bears Of The Week: Dow, Lyft, Pfizer, Schlumberger, Tesla And More",2019-04-07 16:32:00-04:00,PFE,bulls and bears of the week dow lyft pfizer schlumberger tesla and more,"{'neg': 0.0, 'neu': 1.0, 'pos': 0.0, 'compound': 0.0}",neutral,0.999862790107727
988578,988578,1000718.0,FDA Says Extending The Indication Of Ibrance (Palbociclib) Capsules,2019-04-04 14:15:00-04:00,PFE,fda says extending the indication of ibrance palbociclib capsules,"{'neg': 0.0, 'neu': 1.0, 'pos': 0.0, 'compound': 0.0}",neutral,0.9980504512786865
988579,988579,1000719.0,A Healthy Rating On A Big Health Care ETF,2019-04-04 11:49:00-04:00,PFE,a healthy rating on a big health care etf,"{'neg': 0.0, 'neu': 0.543, 'pos': 0.457, 'compound': 0.7096}",positive,0.9988080263137817
988580,988580,1000720.0,Pfizer Reports VIZIMPRO Received Marketing Authorization In EU For Treatment of Adult Patients with EGFR-Mutated Non-Small Cell Lung Cancer,2019-04-03 09:49:00-04:00,PFE,pfizer reports vizimpro received marketing authorization in eu for treatment of adult patients with egfr mutated non small cell lung cancer,"{'neg': 0.18, 'neu': 0.82, 'pos': 0.0, 'compound': -0.6597}",positive,0.9992684721946716
988581,988581,1000721.0,Sangamo Soars Amid Multiple Development Pipeline Updates,2019-04-02 12:47:00-04:00,PFE,sangamo soars amid multiple development pipeline updates,"{'neg': 0.0, 'neu': 1.0, 'pos': 0.0, 'compound': 0.0}",negative,0.9827905893325806
988582,988582,1000722.0,UPDATE: Safety Monitoring Committee Recommended Cohort Expansion At The 3E13 Vg/Kg Dose Of SB-525,2019-04-02 07:07:00-04:00,PFE,update safety monitoring committee recommended cohort expansion at the 3 e13 vg and kg dose of sb 525,"{'neg': 0.0, 'neu': 0.777, 'pos': 0.223, 'compound': 0.5574}",neutral,0.9987136125564575
988583,988583,1000723.0,Sangamo And Pfizer Announce Phase 1/2 Interim Data For Investigational Hemophilia A Gene Therapy; SB-525 Was Well Tolerated And Demonstrated A Dose-Dependent Increase In Factor VIII (FVIII) Levels,2019-04-02 07:07:00-04:00,PFE,sangamo and pfizer announce phase .5 interim data for investigational hemophilia a gene therapy sb 525 was well tolerated and demonstrated a dose dependent increase in factor viii fviii levels,"{'neg': 0.0, 'neu': 0.864, 'pos': 0.136, 'compound': 0.5267}",positive,0.9994906187057495
988584,988584,1000724.0,"Bank Of America Hikes Pfizer Price Target, Estimates Citing Orphan Drug Catalysts",2019-04-01 13:03:00-04:00,PFE,bank of america hikes pfizer price target estimates citing orphan drug catalysts,"{'neg': 0.0, 'neu': 1.0, 'pos': 0.0, 'compound': 0.0}",negative,0.8067300319671631
988585,988585,1000725.0,"BofA Offers Top 10 US Ideas For Q2: Bullish Burlington Stores, Dover, Masco, Norfolk Southern, Pfizer, Synovus, Thermo Fisher, United Rentals, Bearish Hawaiian Air, ServiceMaster",2019-04-01 11:05:00-04:00,PFE,bofa offers top 10 us ideas for second quarter bullish burlington stores dover masco norfolk southern pfizer synovus thermo fisher united rentals bearish hawaiian air servicemaster,"{'neg': 0.0, 'neu': 0.839, 'pos': 0.161, 'compound': 0.5574}",positive,0.9987001419067383
988586,988586,1000726.0,6 Gene Therapy M&A Targets On The Radar,2019-03-27 12:45:00-04:00,PFE,6 gene therapy m and a targets on the radar,"{'neg': 0.0, 'neu': 1.0, 'pos': 0.0, 'compound': 0.0}",neutral,0.9998911619186401
988587,988587,1000727.0,Cyclacel Drops After Study Supporting Cancer Drug's Mechanism Of Action,2019-03-26 12:46:00-04:00,PFE,cyclacel drops after study supporting cancer drugs mechanism of action,"{'neg': 0.288, 'neu': 0.523, 'pos': 0.19, 'compound': -0.3612}",negative,0.9950246214866638
988588,988588,1000728.0,"The Daily Biotech Pulse: FDA Nod For Sage's Postpartum Depression Drug, Pfizer Invests In Gene Therapy Company",2019-03-20 07:46:00-04:00,PFE,the daily biotech pulse fda nod for sages postpartum depression drug pfizer invests in gene therapy company,"{'neg': 0.188, 'neu': 0.812, 'pos': 0.0, 'compound': -0.5719}",neutral,0.999860405921936
988589,988589,1000729.0,Pfizer Secures Exclusive Option To Acquire 15% Equity Interest In Gene Therapy Company Vivet Therapeutics' Pfizer Paid ~$51M Upon Signing And MAy Pay Up To $635.8M,2019-03-20 06:46:00-04:00,PFE,pfizer secures exclusive option to acquire 15 percent equity interest in gene therapy company vivet therapeutics pfizer paid dollars 1 million upon signing and may pay up to dollars 35.8 million,"{'neg': 0.04, 'neu': 0.767, 'pos': 0.193, 'compound': 0.6597}",neutral,0.9990922212600708
988590,988590,1000730.0,"Merck KGaA, Pfizer Announce Discontinuation of Phase III JAVELIN Ovarian PARP 100 Trial in Previously Untreated Advanced Ovarian Cancer",2019-03-19 20:16:00-04:00,PFE,merck kgaa pfizer announce discontinuation of phase iii javelin ovarian parp 100 trial in previously untreated advanced ovarian cancer,"{'neg': 0.188, 'neu': 0.726, 'pos': 0.085, 'compound': -0.5267}",neutral,0.9535644054412842
988591,988591,1000731.0,A New Look For The Barron's 400 ETF,2019-03-19 08:51:00-04:00,PFE,a new look for the barrons 400 etf,"{'neg': 0.0, 'neu': 1.0, 'pos': 0.0, 'compound': 0.0}",neutral,0.9998680353164673
988592,988592,1000732.0,"Morgan Stanley Drops Bearish Exelixis Stance, Sees 'Limited Downside Risk'",2019-03-18 14:26:00-04:00,PFE,morgan stanley drops bearish exelixis stance sees limited downside risk,"{'neg': 0.462, 'neu': 0.538, 'pos': 0.0, 'compound': -0.6124}",negative,0.9982321858406067
988593,988593,1000733.0,Pfizer's Drug TRAZIMERA Wins FDA Approval,2019-03-11 16:29:00-04:00,PFE,pfizers drug trazimera wins fda approval,"{'neg': 0.0, 'neu': 0.37, 'pos': 0.63, 'compound': 0.7783}",positive,0.9992129802703857
988594,988594,1000734.0,"Shares of several biotech companies are trading lower after FDA commissioner Scott Gottlieb announced he will resign; he pushed to spur the development of new drugs and with his absence, there is concern on future FDA approvals.",2019-03-06 11:59:00-05:00,PFE,shares of several biotech companies are trading lower after fda commissioner scott gottlieb announced he will resign he pushed to spur the development of new drugs and with his absence there is concern on future fda approvals,"{'neg': 0.113, 'neu': 0.833, 'pos': 0.054, 'compound': -0.34}",negative,0.9974047541618347
988595,988595,1000735.0,"The Daily Biotech Pulse: Novartis Psoriasis Drug Found Superior, Ascendis Offering, Adamas Earnings",2019-03-05 07:24:00-05:00,PFE,the daily biotech pulse novartis psoriasis drug found superior ascendis offering adamas earnings,"{'neg': 0.0, 'neu': 0.774, 'pos': 0.226, 'compound': 0.5423}",positive,0.9992073178291321
988596,988596,1000736.0,Attention Biotech Investors: Mark Your Calendar For These March PDUFA Dates,2019-03-04 11:50:00-05:00,PFE,attention biotech investors mark your calendar for these march pdufa dates,"{'neg': 0.0, 'neu': 1.0, 'pos': 0.0, 'compound': 0.0}",neutral,0.9998832941055298
988597,988597,1000737.0,"BioXcel Therapeutics Announces Addition Of Merck KGaA, Darmstadt, Germany, And Pfizer To Clinical Collaboration With Nektar For Development Of Triple-combination Therapy In Pancreatic Cancer",2019-03-04 08:13:00-05:00,PFE,bioxcel therapeutics announces addition of merck kgaa darmstadt germany and pfizer to clinical collaboration with nektar for development of triple combination therapy in pancreatic cancer,"{'neg': 0.155, 'neu': 0.845, 'pos': 0.0, 'compound': -0.6597}",positive,0.9953165054321289
988598,988598,1000738.0,BioXcel Therapeutics Announces Merck and Pfizer Join its Clinical Collaboration with Nektar Therapeutics to Evaluate a Triple Therapy for Pancreatic Cancer,2019-03-04 08:07:00-05:00,PFE,bioxcel therapeutics announces merck and pfizer join its clinical collaboration with nektar therapeutics to evaluate a triple therapy for pancreatic cancer,"{'neg': 0.172, 'neu': 0.742, 'pos': 0.086, 'compound': -0.4939}",neutral,0.7659597992897034
988599,988599,1000739.0,Barron's On: Pharma's Big Hope,2019-03-03 10:47:00-05:00,PFE,barrons on pharmas big hope,"{'neg': 0.0, 'neu': 0.58, 'pos': 0.42, 'compound': 0.4404}",positive,0.9103179574012756
988600,988600,1000740.0,"Mylan's Disappointing Outlook Rattles Analysts, Investors",2019-02-27 16:04:00-05:00,PFE,mylans disappointing outlook rattles analysts investors,"{'neg': 0.39, 'neu': 0.61, 'pos': 0.0, 'compound': -0.4939}",negative,0.9986045956611633
988601,988601,1000741.0,It Could Be Time For This Pharma ETF,2019-02-26 09:42:00-05:00,PFE,it could be time for this pharma etf,"{'neg': 0.0, 'neu': 1.0, 'pos': 0.0, 'compound': 0.0}",neutral,0.9997547268867493
988602,988602,1000742.0,"The Daily Biotech Pulse: Immunomedics CEO Departs, Ultragenyx Offering, Karyopharm Awaits FDA Panel Vote",2019-02-26 07:56:00-05:00,PFE,the daily biotech pulse immunomedics ceo departs ultragenyx offering karyopharm awaits fda panel vote,"{'neg': 0.0, 'neu': 0.909, 'pos': 0.091, 'compound': 0.0772}",neutral,0.9998552799224854
988603,988603,1000743.0,FDA Is Working With Pfizer To Evaluate Other Currently Available Safety Info For Tofacitinib,2019-02-25 15:56:00-05:00,PFE,fda is working with pfizer to evaluate other currently available safety info for tofacitinib,"{'neg': 0.0, 'neu': 0.823, 'pos': 0.177, 'compound': 0.4215}",neutral,0.9998332262039185
988604,988604,1000744.0,"Supreme Court Rejects Maryland's Bid To Revive A Law Aimed At Preventing Price Gouging By Pharmaceutical Companies, Reuters Reports",2019-02-19 10:04:00-05:00,PFE,supreme court rejects marylands bid to revive a law aimed at preventing price gouging by pharmaceutical companies reuters reports,"{'neg': 0.17, 'neu': 0.593, 'pos': 0.237, 'compound': 0.4019}",neutral,0.9551630616188049
988605,988605,1000745.0,"Pfizer Reports Received European Approval For ZIRABEV, A Biosimilar To Avastin",2019-02-19 09:32:00-05:00,PFE,pfizer reports received european approval for zirabev a biosimilar to avastin,"{'neg': 0.0, 'neu': 0.763, 'pos': 0.237, 'compound': 0.4767}",positive,0.9988975524902344
988606,988606,1000746.0,Pfizer And Lilly Announce Top-line Results From Phase 3 Study Of Tanezumab In Chronic Low Back Pain; Tanezumab Met Primary Endpoint,2019-02-19 06:48:00-05:00,PFE,pfizer and lilly announce top line results from phase 3 study of tanezumab in chronic low back pain tanezumab met primary endpoint,"{'neg': 0.206, 'neu': 0.725, 'pos': 0.069, 'compound': -0.5574}",neutral,0.9974303841590881
988607,988607,1000747.0,Pfizer Announces Pivotal Phase III Data for BAVENCIO Plus INLYTA in Advanced RCC Published in the New England Journal of Medicine,2019-02-17 08:42:00-05:00,PFE,pfizer announces pivotal phase iii data for bavencio plus inlyta in advanced rcc published in the new england journal of medicine,"{'neg': 0.0, 'neu': 0.909, 'pos': 0.091, 'compound': 0.25}",neutral,0.9062099456787109
988608,988608,1000748.0,"PreMarket Prep Opening NYSE Imbalance Update: Bank Of America 335k Shares To Buy, JP Morgan 143k To Buy; Coca-Cola 274k To Buy,  Pfizer 251k To Buy, AT&T 224K To Buy, Verizon 130k To Buy",2019-02-15 09:03:00-05:00,PFE,premarket prep opening nyse imbalance update bank of america 335 thousand shares to buy jp morgan 143 thousand to buy coca cola 274 thousand to buy pfizer 251 thousand to buy at and t 224 thousand to buy verizon 130 thousand to buy,"{'neg': 0.0, 'neu': 0.83, 'pos': 0.17, 'compound': 0.802}",neutral,0.9998564720153809
988609,988609,1000749.0,"The Daily Biotech Pulse: Vanda Q4 Results, Inovio Debt Offering, Caladrius Diabetes Drug Flunks Mid-Stage Trial",2019-02-14 07:50:00-05:00,PFE,the daily biotech pulse vanda fourth quarter results inovio debt offering caladrius diabetes drug flunks mid stage trial,"{'neg': 0.249, 'neu': 0.751, 'pos': 0.0, 'compound': -0.6486}",negative,0.994611382484436
988610,988610,1000750.0,"Hearing Alliance Bernstein Reduces Stakes In Apple, Facebook, Amazon, Citigroup, Crown Castle; Raises Stakes In Vertex Pharmaceuticals, Procter & Gamble, Regency Centers, Microsoft, Pfizer",2019-02-13 13:14:00-05:00,PFE,hearing alliance bernstein reduces stakes in apple facebook amazon citigroup crown castle raises stakes in vertex pharmaceuticals procter and gamble regency centers microsoft pfizer,"{'neg': 0.0, 'neu': 0.931, 'pos': 0.069, 'compound': 0.1779}",positive,0.9926323294639587
988611,988611,1000751.0,PreMarket Prep Opening NYSE Imbalance Update: Pfizer 112k Shares To Sell; Bank of America 90k To Sell; Square 40k To Buy,2019-02-12 08:32:00-05:00,PFE,premarket prep opening nyse imbalance update pfizer 112 thousand shares to sell bank of america 90 thousand to sell square 40 thousand to buy,"{'neg': 0.0, 'neu': 0.913, 'pos': 0.087, 'compound': 0.296}",neutral,0.9998576641082764
988612,988612,1000752.0,"The Daily Biotech Pulse: NASH Disappointment For Gilead, Xeris To Offer Shares",2019-02-12 08:04:00-05:00,PFE,the daily biotech pulse nash disappointment for gilead xeris to offer shares,"{'neg': 0.213, 'neu': 0.645, 'pos': 0.142, 'compound': -0.2732}",negative,0.844599187374115
988613,988613,1000753.0,FDA Accepts Pfeizer's sBLA And Grants Priority Review For BAVENCIO Plus INLYTA For The Treatment Of Advanced Renal Cell Carcinoma,2019-02-11 17:51:00-05:00,PFE,fda accepts pfeizers sbla and grants priority review for bavencio plus inlyta for the treatment of advanced renal cell carcinoma,"{'neg': 0.0, 'neu': 0.733, 'pos': 0.267, 'compound': 0.6369}",positive,0.9807054400444031
988614,988614,1000754.0,Pfizer Reports Results From Phase 3 ARCHES Trial In Men With mHSPC: Showed XTANDI Plus ADT Met Primary Endpoint 'by significantly reducing the risk of radiographic progression or death by 61% versus ADT alone',2019-02-11 17:01:00-05:00,PFE,pfizer reports results from phase 3 arches trial in men with mhspc showed xtandi plus adt met primary endpoint by significantly reducing the risk of radiographic progression or death by 61 percent versus adt alone,"{'neg': 0.2, 'neu': 0.8, 'pos': 0.0, 'compound': -0.7906}",positive,0.9996235370635986
988615,988615,1000755.0,"The Week Ahead In Biotech: Conferences, PDUFA Dates And Clinical Trials",2019-02-10 17:37:00-05:00,PFE,the week ahead in biotech conferences pdufa dates and clinical trials,"{'neg': 0.0, 'neu': 1.0, 'pos': 0.0, 'compound': 0.0}",neutral,0.9998906850814819
988616,988616,1000756.0,"Barron's Picks And Pans: BB&T, Best Buy, Boeing And More",2019-02-10 16:38:00-05:00,PFE,barrons picks and pans bb and t best buy boeing and more,"{'neg': 0.0, 'neu': 0.724, 'pos': 0.276, 'compound': 0.6369}",neutral,0.9998736381530762
988617,988617,1000757.0,Solid Biosciences Shares Crash After Data Release On Muscular Dystrophy Candidate,2019-02-07 12:57:00-05:00,PFE,solid biosciences shares crash after data release on muscular dystrophy candidate,"{'neg': 0.186, 'neu': 0.552, 'pos': 0.262, 'compound': 0.0258}",negative,0.9971396923065186
988618,988618,1000758.0,Trump At State Of The Union Will Ask For Drug Pricing Cuts,2019-02-01 15:36:00-05:00,PFE,trump at state of the union will ask for drug pricing cuts,"{'neg': 0.167, 'neu': 0.833, 'pos': 0.0, 'compound': -0.296}",neutral,0.9993672966957092
988619,988619,1000759.0,Pharma Catches Another Case Of M&A Fever,2019-02-01 10:15:00-05:00,PFE,pharma catches another case of m and a fever,"{'neg': 0.0, 'neu': 1.0, 'pos': 0.0, 'compound': 0.0}",neutral,0.5670923590660095
988620,988620,1000760.0,Pfizer Receives Positive CHMP Opinion For Vizimpro For The First-line Treatment Of Adult Patients With Locally Advanced Or Metastatic Non-small Cell Lung Cancer With Egfr-activating Mutations,2019-02-01 09:18:00-05:00,PFE,pfizer receives positive chmp opinion for vizimpro for the first line treatment of adult patients with locally advanced or metastatic non small cell lung cancer with egfr activating mutations,"{'neg': 0.122, 'neu': 0.722, 'pos': 0.156, 'compound': 0.0516}",positive,0.999454915523529
988621,988621,1000761.0,UPDATE: Credit Suisse Upgrades Pfizer As Firm Notes Co 'has been working through a dark period with extensive patent expirations that have hampered its ability to grow' And Firm Believes 'That period is now nearing an end',2019-01-31 10:47:00-05:00,PFE,update credit suisse upgrades pfizer as firm notes co has been working through a dark period with extensive patent expirations that have hampered its ability to grow and firm believes that period is now nearing an end,"{'neg': 0.0, 'neu': 0.877, 'pos': 0.123, 'compound': 0.5994}",negative,0.9981697797775269
988622,988622,1000762.0,"Benzinga's Top Upgrades, Downgrades For January 31, 2019",2019-01-31 09:11:00-05:00,PFE,benzingas top upgrades downgrades for january 31 2019,"{'neg': 0.0, 'neu': 0.795, 'pos': 0.205, 'compound': 0.2023}",neutral,0.9252099990844727
988623,988623,1000763.0,"Argus Upgrades Pfizer to Outperform, Announces $55 Price Target",2019-01-31 07:19:00-05:00,PFE,argus upgrades pfizer to outperform announces dollars 5 price target,"{'neg': 0.0, 'neu': 1.0, 'pos': 0.0, 'compound': 0.0}",positive,0.999639630317688
988624,988624,1000764.0,Credit Suisse Upgrades Pfizer to Outperform,2019-01-31 07:18:00-05:00,PFE,credit suisse upgrades pfizer to outperform,"{'neg': 0.0, 'neu': 0.658, 'pos': 0.342, 'compound': 0.3818}",positive,0.9996192455291748
988625,988625,1000765.0,"Apple, Boeing And The Fed: A Full Day Ahead As Earnings Help Recharge Wall Street",2019-01-30 10:03:00-05:00,PFE,apple boeing and the fed a full day ahead as earnings help recharge wall street,"{'neg': 0.0, 'neu': 0.838, 'pos': 0.162, 'compound': 0.4019}",positive,0.9976605176925659
988626,988626,1000766.0,How To Approach Q4 Earnings: The Technical Perspective,2019-01-29 13:11:00-05:00,PFE,how to approach fourth quarter earnings the technical perspective,"{'neg': 0.0, 'neu': 1.0, 'pos': 0.0, 'compound': 0.0}",neutral,0.9998699426651001
988627,988627,1000767.0,"Apple Today, Powell Tomorrow: Busy Earnings And Fed Week Continues",2019-01-29 12:22:00-05:00,PFE,apple today powell tomorrow busy earnings and fed week continues,"{'neg': 0.0, 'neu': 1.0, 'pos': 0.0, 'compound': 0.0}",neutral,0.9998142123222351
988628,988628,1000768.0,From Pfizer Q4 Earnings Conference Call: Sees Pricing In US Flat Over 2019,2019-01-29 11:05:00-05:00,PFE,from pfizer fourth quarter earnings conference call sees pricing in us flat over 2019,"{'neg': 0.0, 'neu': 1.0, 'pos': 0.0, 'compound': 0.0}",negative,0.998760461807251
988629,988629,1000769.0,Pfizer shares are trading lower after the company said it expects 2019 EPS of $2.82 to $2.92 versus the $3.04 analyst estimate.,2019-01-29 08:35:00-05:00,PFE,pfizer shares are trading lower after the company said it expects 2019 eps of dollars .82 to dollars .92 versus the dollars .04 analyst estimate,"{'neg': 0.08, 'neu': 0.839, 'pos': 0.08, 'compound': 0.0}",negative,0.9985645413398743
988630,988630,1000770.0,24 Stocks Moving In Tuesday's Pre-Market Session,2019-01-29 08:09:00-05:00,PFE,24 stocks moving in tuesdays pre market session,"{'neg': 0.0, 'neu': 1.0, 'pos': 0.0, 'compound': 0.0}",neutral,0.9998745918273926
